English name,Score,Genres,Type,Producers,Studios,Rank,Popularity,Favorites,Scored By,Members,Weighted_Score
The Seven Deadly Sins the Movie: Prisoners of the Sky,7.11,"Action, Adventure, Fantasy",Movie,"Aniplex, Kodansha",A-1 Pictures,3492.0,778,332,167725.0,287470,72.78258905161157
Basilisk: The Ouka Ninja Scrolls,5.52,"Action, Drama",TV,"Kodansha, Glovision, King Records, Universal Entertainment",Seven Arcs Pictures,10699.0,3465,34,10089.0,36423,44.48811622589049
Wotakoi: Love is Hard for Otaku,7.94,Romance,TV,"Aniplex, Dentsu, Fuji TV, Half H.P Studio, Ichijinsha, Kanetsu Investment, Christmas Holly",A-1 Pictures,654.0,159,11110,494378.0,926723,83.7844669545098
Fairy Tail Final Series,7.57,"Action, Adventure, Fantasy",TV,"TV Tokyo, Dentsu, Kodansha, Avex Pictures","A-1 Pictures, Bridge, CloverWorks",1480.0,424,4972,234857.0,480487,76.47032008314063
Harukana Receive,6.66,Sports,TV,"AT-X, Houbunsha, Docomo Anime Store, Kadokawa Media House, Kadokawa",C2C,5524.0,1851,172,40232.0,107248,58.995044282219425
Damepri Anime Caravan,6.5,"Adventure, Comedy, Fantasy, Romance",TV,"Pierrot, Movic, BS Fuji, Tokyo MX, AZ Creative, Kadokawa, Live Viewing Japan, Libre",Studio Flad,6381.0,3877,80,8670.0,28752,44.59751927709522
Angels of Death,6.96,"Adventure, Horror, Suspense",TV,"Lantis, AT-X, Kadokawa",J.C.Staff,4155.0,303,5417,298469.0,634288,77.90791043029142
Maerchen Maedchen,5.39,Fantasy,TV,"Lantis, AT-X, NBCUniversal Entertainment Japan, Medicos Entertainment, Shueisha, Kanon Sound, DMM.com, NichiNare",Hoods Entertainment,11118.0,3271,41,13985.0,40269,47.28343003998911
Between the Sky and Sea,5.66,"Adventure, Fantasy, Sci-Fi",TV,Half H.P Studio,TMS Entertainment,10249.0,4510,21,6280.0,20654,40.341633297071745
Persona 5 The Animation,6.44,"Action, Fantasy, Supernatural",TV,"Aniplex, A-1 Pictures, Movic, Atlus, Sammy, Sonilude",CloverWorks,6653.0,912,919,93914.0,246695,66.51309190142301
King's Game,5.05,"Drama, Horror, Mystery, Supernatural",TV,"AT-X, Warner Music Japan, Amuse, Hakuhodo DY Music & Pictures, Futabasha, Kakao Japan, Spacey Music Entertainment, A-Craft, Tohan Corporation",Seven,11871.0,947,432,121383.0,236124,66.63712126666476
Golden Kamuy,7.87,"Action, Adventure",TV,"Magic Capsule, NBCUniversal Entertainment Japan, Tokyo MX, Good Smile Company, Sammy, Shueisha, JR East Marketing & Communications, Twin Engine",Geno Studio,791.0,601,3956,150844.0,361477,72.7408146300958
Hakyu Hoshin Engi,5.37,"Adventure, Fantasy, Supernatural",TV,"NBCUniversal Entertainment Japan, i0+",C-Station,11165.0,4531,21,5325.0,20429,38.33269507968775
Senran Kagura: Shinovi Master,6.3,"Action, Comedy, Ecchi",TV,"Sotsu, Lantis, AT-X, Crunchyroll SC Anime Fund",TNK,7413.0,3185,91,9927.0,42302,45.559158841319366
Recovery of an MMO Junkie,7.55,"Comedy, Romance",TV,"DAX Production, flying DOG, Sony Music Communications, Tokyo MX, comico, JR East Marketing & Communications, Crunchyroll SC Anime Fund",Signal.MD,1561.0,461,2299,237877.0,449244,76.56387881672163
Recovery of an MMO Junkie Special,7.35,"Comedy, Romance",Special,"comico, Crunchyroll SC Anime Fund",Signal.MD,2286.0,1883,79,64353.0,104365,64.24302649731345
Dagashi Kashi 2,6.83,"Comedy, Gourmet",TV,"Pony Canyon, TBS, Shogakukan, Lawson, Pony Canyon Enterprise",Tezuka Productions,4702.0,1354,196,69209.0,161804,64.23722463482414
Hakumei and Mikochi,7.68,"Fantasy, Slice of Life",TV,"Lantis, AT-X, Sony Music Communications, Kadokawa Media House, Kadokawa",Lerche,1184.0,2593,372,18196.0,62037,52.98376047511244
I Want To Eat Your Pancreas,8.56,"Drama, Romance",Movie,"Aniplex, ABC Animation",Studio VOLN,97.0,168,19488,535261.0,895776,85.21250296153531
Attack on Titan: Lost Girls,7.81,"Action, Drama",OVA,"Production I.G, Dentsu, Mainichi Broadcasting System, Pony Canyon, Kodansha, Pony Canyon Enterprise",Wit Studio,893.0,764,540,148653.0,291631,72.5350274567902
Takunomi,6.42,"Comedy, Gourmet",TV,"Pony Canyon, TBS, Magic Capsule, Shogakukan, Lawson, RAY, U-NEXT, Nichion",Production IMS,6788.0,3045,49,14894.0,45682,49.47979803083514
Junji Ito Collection,6.47,"Drama, Horror, Mystery, Supernatural",TV,"Nippon Columbia, Asahi Shimbun, Yomiuri TV Enterprise, Pony Canyon Enterprise, Smiral Animation, Crunchyroll SC Anime Fund, Muse Communication, Asahi Shinbun Shuppan",Studio Deen,6534.0,1324,979,73723.0,164883,64.32066163634295
GARO -VANISHING LINE-,7.13,"Action, Fantasy, Supernatural",TV,Tohokushinsha Film Corporation,MAPPA,3394.0,2360,122,22964.0,72424,54.446663021669536
Gun Girls,5.26,"Action, Comedy, Sci-Fi, Slice of Life",ONA,"Tencent Animation & Comics, Tencent Penguin Pictures, AHA Entertainment",Hoods Entertainment,11448.0,12553,1,172.0,1027,6.452331881272275
Lan Mo's Flower,6.38,Romance,ONA,Colored Pencil Animation Japan,Colored Pencil Animation,6989.0,7637,17,1848.0,5590,30.15165497788794
Starship Troopers: Traitor of Mars,6.45,"Action, Sci-Fi",Movie,"Lucent Pictures Entertainment, Kadokawa, Sony Pictures Worldwide Acquisitions",Sola Digital Arts,6634.0,9752,2,1344.0,2696,27.311934906533175
"Infini-T Force: Farewell, Friend",6.2,"Action, Sci-Fi",Movie,"Yomiuri Telecasting, Shochiku, HoriPro, Pony Canyon, Digital Frontier, Bushiroad, Nippon Television Network, bilibili, Nippon Television Music, Hulu, Kadokawa, Sapporo Television Broadcasting, Miyagi Television Broadcasting, Shizuoka Daiichi Television, Chukyo TV Broadcasting, Hiroshima Television, Fukuoka Broadcasting System",Tatsunoko Production,7883.0,10723,0,303.0,1969,13.194312742544353
Kase-san and Morning Glories,7.71,"Girls Love, Romance",OVA,Sotsu,Zexcs,1102.0,1846,1108,45421.0,107594,61.46721652050746
Our love has always been 10 centimeters apart.,7.47,"Comedy, Drama, Romance",TV,"Aniplex, Movic, Magic Capsule, Lawson, MusicRay’n, Kadokawa, INCS toenter, Yoshimoto Creative Agency",Lay-duce,1812.0,1034,742,88149.0,217076,67.29816907068077
Evil or Live,5.79,Horror,TV,Emon,Haoliners Animation League,9722.0,2267,112,32769.0,77735,55.807605060777135
Monster Strike The Fading Cosmos,6.33,"Action, Fantasy",ONA,XFLAG Pictures,"Anima, ILCA, Yokohama Animation Lab",7223.0,8081,5,1109.0,4906,25.363963756865353
Pingu in the City,6.52,"Comedy, Slice of Life",TV,"NHK, Polygon Pictures, NHK Enterprises, Mattel Creations",DandeLion Animation Studio,6242.0,3203,756,23679.0,41931,53.90389741046114
Magical Girl Site,6.52,"Drama, Horror, Supernatural",TV,"Sotsu, Avex Pictures",production doA,6232.0,994,1205,92870.0,225982,66.52386886945442
Space Battleship Tiramisu,6.37,"Comedy, Sci-Fi, Slice of Life",TV,"Frontier Works, Nippon Columbia, Studio Mausu, Tokyo MX, Adores, Shinchosha, FuRyu, Exa International, NTT Plala, JY Animation",Gonzo,7030.0,3954,27,10089.0,27574,45.81067789835495
Natsume's Book of Friends Season 6 Specials,8.39,"Drama, Slice of Life, Supernatural",Special,NAZ,Shuka,179.0,3104,69,19382.0,44300,54.38337286262144
Glamorous Heroes,4.23,Action,TV,Shanghai Jump Network Technology,drop,12569.0,7889,2,750.0,5200,18.031137129504188
Hinamatsuri,8.14,"Comedy, Supernatural",TV,"AT-X, Magic Capsule, Nippon Columbia, Kadokawa Media House, NTT Plala, Kadokawa, Akatsuki",feel.,424.0,419,4301,240827.0,487209,77.37252481858754
I've Always Liked You: A Friday's Good Morning,7.16,Romance,Special,Aniplex,Qualia Animation,3270.0,4314,29,8308.0,22831,45.09670996212044
Butlers x Battlers,5.65,"Drama, Supernatural",TV,"Lantis, Kadokawa",SILVER LINK.,10284.0,4215,42,6066.0,24181,40.00514676860623
Seven Senses of the Re'Union,6.1,"Action, Drama, Fantasy",TV,"TBS, SUPA LOVE",Lerche,8351.0,1560,219,51003.0,133359,60.37459509264382
Skull-face Bookseller Honda-san,7.29,Comedy,TV,"Lantis, Half H.P Studio, Encourage Films, Radio Osaka, Kadokawa, Muse Communication, Bandai Namco Arts",DLE,2555.0,1788,380,46788.0,112379,61.22377261136274
Full-Time Magister 2nd Season,6.76,"Action, Fantasy",ONA,"Tencent Penguin Pictures, China Literature Limited",Foch Films,5030.0,2412,91,35450.0,70230,57.96414233885804
Legend of the Galactic Heroes: The New Thesis - Stellar War Part 1,8.03,"Drama, Sci-Fi",Movie,Shochiku,Production I.G,549.0,3963,63,12974.0,27442,50.27169987963198
Legend of the Galactic Heroes: The New Thesis - Stellar War Part 2,8.15,"Drama, Sci-Fi",Movie,Shochiku,Production I.G,404.0,4254,47,11909.0,23588,49.617721451965025
Legend of the Galactic Heroes: Die Neue These - Stellar War Part 3,8.25,"Drama, Sci-Fi",Movie,Shochiku,Production I.G,296.0,4197,93,11952.0,24340,49.76362072642403
Frankenstein Family,6.31,"Sci-Fi, Slice of Life",ONA,"Tencent Penguin Pictures, KJJ Animation, Da Huoniao Donghua",Big Firebird Culture,7341.0,3018,53,12663.0,46361,47.821697398772606
Wise Man's Grandchild,6.62,"Action, Comedy, Fantasy, Romance",TV,"Sotsu, Docomo Anime Store, ABC Animation, Kadokawa",SILVER LINK.,5738.0,362,2813,318687.0,552675,78.05066922738929
A Certain Magical Index III,6.81,"Action, Fantasy, Sci-Fi",TV,"Square Enix, Movic, AT-X, Warner Bros. Japan, NBCUniversal Entertainment Japan, Kadokawa",J.C.Staff,4803.0,928,812,95831.0,240906,67.21556432216032
My Cultivator Girlfriend,6.46,"Adventure, Fantasy, Romance, Supernatural",ONA,"Tencent Animation & Comics, KJJ Animation","Big Firebird Culture, TrioPen Studio",6576.0,3508,102,8972.0,35525,44.85669990044042
My Hero Academia Season 3,8.04,Action,TV,"Dentsu, Yomiuri Telecasting, Movic, Sony Music Entertainment, TOHO animation, Shueisha",Bones,531.0,26,12739,1376029.0,2085281,93.35302817587025
LBX Girls,5.76,"Action, Fantasy",TV,DMM Music,Studio A-CAT,9848.0,5180,35,4064.0,14548,36.4846105781301
Digimon Adventure tri. Future,7.2,"Action, Adventure, Comedy, Drama",Movie,Sonilude,Toei Animation,3013.0,3105,52,22639.0,44291,54.40525659895419
Tada Never Falls in Love,7.57,"Comedy, Romance",TV,"AT-X, Docomo Anime Store, BS11",Doga Kobo,1464.0,794,1323,124296.0,283683,70.59429367644043
Sword Art Online: Alicization,7.56,"Action, Adventure, Fantasy",TV,"Aniplex, Genco, Bandai Namco Entertainment, Egg Firm, Straight Edge, Kadokawa",A-1 Pictures,1523.0,145,7036,587461.0,991983,84.92462941688702
Fights Break Sphere,7.23,"Action, Adventure, Comedy, Romance, Supernatural",ONA,"Tencent Penguin Pictures, China Literature Limited",Foch Films,2870.0,5616,126,5280.0,11952,41.00069523024479
THE IDOLM@STER CINDERELLA GIRLS Theater (Web) 2nd Season,6.48,Comedy,ONA,"Frontier Works, Half H.P Studio, Nippon Columbia, Bandai Namco Entertainment, Anime Consortium Japan, Kadokawa","Gathering, Lesprit",6460.0,8551,0,1700.0,4157,29.524470398404592
Ulysses: Jeanne d'Arc and the Alchemist Knight,5.33,"Action, Fantasy, Ecchi",TV,"Lantis, Studio Mausu, Shueisha, Yomiuri TV Enterprise, Emon, DMM pictures, Crunchyroll SC Anime Fund, Bandai Namco Arts",AXsiZ,11268.0,2055,101,32239.0,91240,54.892587642436254
Tokyo Ghoul:re,6.37,"Action, Fantasy, Horror",TV,"Marvelous, Pierrot Plus, TC Entertainment",Pierrot,7030.0,122,3776,668942.0,1122310,84.54246579837124
Beatless,6.21,"Action, Drama, Romance, Sci-Fi",TV,"Kadokawa Shoten, Mainichi Broadcasting System, Sony Music Entertainment, Good Smile Company, Animatic",Diomedéa,7798.0,1303,469,52539.0,168642,60.81363471470561
Batman Ninja,6.07,Action,Movie,Warner Bros. Japan,Kamikaze Douga,8504.0,2755,103,31291.0,55250,55.81752181197526
Spiritpact: Bond of the Underworld,7.48,"Action, Boys Love, Comedy, Supernatural",TV,Tencent Animation & Comics,Haoliners Animation League,1764.0,3038,213,18125.0,45787,52.703990103957274
Dies irae: The Dawning Days,5.34,Action,Special,"Genco, DMM pictures, Greenwood, Brave Hearts, Crunchyroll SC Anime Fund",A.C.G.T.,11249.0,4189,14,13202.0,24414,46.665309532622345
Bullet Train Transforming Robot Shinkalion The Animation,6.73,"Action, Sci-Fi",TV,"Ajia-do, TBS",OLM,5166.0,8711,29,739.0,3922,22.18190691621183
STARMYU Season 3,6.94,Slice of Life,TV,NBCUniversal Entertainment Japan,C-Station,4225.0,6101,33,2911.0,9772,35.12436508466245
Natsume Yujin-cho the Movie: Ephemeral Bond,8.41,"Drama, Slice of Life, Supernatural",Movie,Aniplex,Shuka,168.0,2467,188,23523.0,67663,56.193466866960286
I fall in love with you through a robot,6.25,"Romance, Sci-Fi",Special,Kawade Shobo Shinsha,A-1 Pictures,7642.0,8193,4,1046.0,4733,24.706524510463577
Black and White Warriors,6.24,"Action, Comedy, Supernatural",ONA,bilibili,Wawayu Animation,7677.0,8900,6,724.0,3640,21.294642379817144
Fox Spirit Matchmaker 5th Season,7.38,"Comedy, Romance, Supernatural",ONA,Tencent Animation & Comics,Haoliners Animation League,2147.0,6910,9,2439.0,7201,34.0584178786638
Kokkoku,6.99,"Drama, Mystery, Supernatural",TV,Twin Engine,Geno Studio,4038.0,1231,325,69637.0,179724,64.50798968763246
PEACE MAKER KUROGANE – Belief & Friend,6.49,"Action, Comedy",Movie,Showgate,White Fox,6428.0,9073,5,462.0,3437,17.510037588730807
Fights Break Sphere Specials,7.53,"Action, Adventure, Fantasy",ONA,"Tencent Penguin Pictures, China Literature Limited",Motion Magic,1606.0,8223,24,2577.0,4677,34.75244053054047
Megalobox,7.88,"Sci-Fi, Sports",TV,"TBS, Kodansha, Bandai Namco Arts, TMS Music",TMS Entertainment,769.0,417,3412,261103.0,489488,77.81923426834285
Granblue Fantasy: The Animation Season 2,6.74,"Adventure, Fantasy",TV,"Aniplex, Cygames, dugout",MAPPA,5126.0,2539,74,20522.0,64385,52.888978614908574
The Highschool Life of a Fudanshi Special,6.24,Comedy,Special,DAX Production,EMT Squared,7672.0,7808,3,1444.0,5339,27.668964571518014
"My Sister, My Writer",4.87,"Comedy, Romance, Ecchi",TV,MAGES.,"NAZ, Magia Doraglier",12109.0,1617,242,53148.0,128202,58.67545909935436
Date A Live III,7.19,"Action, Romance, Sci-Fi",TV,"Nippon Columbia, Kadokawa",J.C.Staff,3081.0,579,1629,196096.0,372305,74.32907125921261
The Young Imperial Guards,6.1,"Action, Adventure, Mystery, Romance",ONA,Youku,Boyan Pictures,8349.0,12329,8,284.0,1100,12.446554404955515
Banana Fish,8.48,"Action, Adventure, Drama, Suspense",TV,"Aniplex, Dentsu, Movic, Fuji TV, Shogakukan",MAPPA,134.0,205,28969,349236.0,810399,81.18259064170132
Forest of Piano,7.31,Drama,TV,NHK,Gaina,2492.0,1686,438,52103.0,121611,62.242665890526084
Tsurune: Kazemai High School Kyudo Club,7.66,Sports,TV,"Lantis, Pony Canyon, Rakuonsha, Bandai Namco Arts",Kyoto Animation,1237.0,1424,1117,57757.0,150738,63.62590908830539
We Rent Tsukumogami,6.69,Supernatural,TV,"TMS Entertainment, Sony Music Communications, Being, Universal Music Japan, Kadokawa, NHK Enterprises",Telecom Animation Film,5409.0,4801,9,5168.0,17923,40.085897462345535
Fist of the Blue Sky: Regenesis,5.65,Action,TV,Souten no Ken,Polygon Pictures,10271.0,5817,17,3349.0,10947,34.519709036527736
The Guardian,6.45,"Action, Adventure, Fantasy",Movie,"Beijing Enlight Pictures, Horgos Coloroom Pictures Co., Ltd.",Nice Boat Animation,6608.0,12611,2,249.0,1010,11.747642955632166
The Testament of Sister New Devil Departures,6.91,"Action, Fantasy, Romance, Ecchi",OVA,"AT-X, Nippon Columbia, KlockWorx, Toranoana, Glovision, Sony PCL, Kadokawa Media House, Sun TV, Kadokawa",Production IMS,4351.0,2062,150,40816.0,90608,59.46841932776487
Attack on Titan: The Roar of Awakening,7.83,"Action, Drama",Movie,"Production I.G, Dentsu, Mainichi Broadcasting System, Pony Canyon, Kodansha, Pony Canyon Enterprise",Wit Studio,867.0,2528,82,19690.0,65088,53.89106563209065
The Legend of Ancient Soul,5.64,"Action, Adventure, Fantasy, Mystery, Supernatural",ONA,Tencent Penguin Pictures,Mili Pictures,10329.0,8883,9,221.0,3664,9.408474978937614
Yuuna and the Haunted Hot Springs,7.01,"Comedy, Romance, Supernatural, Ecchi",TV,"Aniplex, Shueisha, BS11",Xebec,3930.0,777,762,121325.0,287752,69.66116158175011
Kakuriyo: Bed and Breakfast for Spirits,7.53,"Drama, Fantasy, Gourmet, Romance",TV,"flying DOG, Kadokawa",Gonzo,1617.0,1378,1298,57632.0,157436,63.44783524547911
Bloody Code,5.98,"Action, Adventure, Fantasy, Horror, Mystery, Suspense",ONA,Tencent Animation & Comics,CG Year,8940.0,9984,3,563.0,2498,18.579730972150564
Working Buddies!,6.36,Comedy,TV,"Lantis, Movic, Half H.P Studio, BS Fuji, Tokyo MX, Good Smile Company",Tomovies,7083.0,6535,19,3270.0,8235,35.392337269158936
Eromanga Sensei OVA,6.81,"Comedy, Drama, Romance, Ecchi",OVA,"Aniplex, Movic, BS11, Kinoshita Group Holdings, Kadokawa",A-1 Pictures,4794.0,1793,177,57688.0,111947,62.528709213266225
Real Girl,6.85,Romance,TV,"VAP, Nippon Television Network, DeNA",Hoods Entertainment,4630.0,672,1521,161092.0,324468,72.06595627373936
gdgd men's Party,5.82,"Comedy, Fantasy",TV,"Tokyo MX, Fan Company, Global Solutions",Strawberry Meets Pictures,9606.0,9539,4,1001.0,2936,23.642371023557427
Godzilla: City on the Edge of Battle,6.54,"Action, Adventure, Sci-Fi",Movie,"Toho, TOHO animation",Polygon Pictures,6123.0,3331,36,23039.0,38920,53.67915490007366
Miss Caretaker of Sunohara-sou,6.77,"Comedy, Ecchi",TV,"Sotsu, flying DOG, Ichijinsha",SILVER LINK.,5011.0,1475,415,55285.0,144092,62.08140292992067
Fox Spirit Matchmaker 4th Season,7.43,"Comedy, Romance, Supernatural",ONA,Tencent Animation & Comics,Haoliners Animation League,1960.0,6524,6,3402.0,8269,37.193646881699316
Fox Spirit Matchmaker 6th Season,7.34,"Comedy, Romance, Supernatural",ONA,"Tencent Animation & Comics, bilibili, Tencent Penguin Pictures",Haoliners Animation League,2326.0,6905,16,1961.0,7211,31.993998301808205
Caligula,6.0,"Action, Sci-Fi",TV,"Pony Canyon, FuRyu",Satelight,8819.0,2317,107,25786.0,75187,53.92355041468866
Fate/Kaleid Liner Prisma Illya: Vow in the Snow - Dark Sakura's Room,6.7,Slice of Life,Special,Kadokawa Shoten,SILVER LINK.,5349.0,4475,7,7137.0,20931,43.08058429614426
Gintama.: Silver Soul Arc,8.81,"Action, Comedy, Sci-Fi",TV,"TV Tokyo, Aniplex, Dentsu, Shueisha",Bandai Namco Pictures,29.0,1117,1136,97711.0,200193,69.77281598516964
The Seven Heavenly Virtues,5.24,"Fantasy, Ecchi",TV,Hobby Japan,Bridge,11506.0,2716,111,17054.0,56894,48.85490171530561
Cupid’s Chocolates II,7.05,"Comedy, Romance",ONA,"Tencent Animation & Comics, bilibili",B.CMAY PICTURES,3740.0,3574,103,13173.0,33995,49.210340463145606
Garo: The Fleeting Cherry Blossom,6.14,"Action, Fantasy, Supernatural",Movie,Tohokushinsha Film Corporation,"Studio VOLN, Studio M2",8142.0,7896,3,643.0,5194,20.050103596466194
Sorcery in the Big City,5.91,"Action, Fantasy",ONA,XFLAG,SANZIGEN,9239.0,8274,5,1832.0,4602,29.364776983950456
Made in Abyss: Dawn of the Deep Soul,8.63,"Adventure, Drama, Fantasy, Mystery, Sci-Fi",Movie,"AT-X, Takeshobo, Kadokawa Media House, Cygames, Kanetsu Investment, Kadokawa, Global Solutions, Sony Music Solutions, IRMA LA DOUCE",Kinema Citrus,72.0,501,3343,227294.0,422830,77.3782486096403
Ultraman,6.68,"Action, Sci-Fi",ONA,"Dentsu, Tsuburaya Productions, Fields, Bandai Namco Arts, Netflix, G holdings","Production I.G, Sola Digital Arts",5420.0,4025,76,13243.0,26534,48.761456925284335
Back Street Girls: Gokudols,6.95,"Comedy, Ecchi",TV,"Toei Video, Kodansha",J.C.Staff,4177.0,1476,600,75130.0,143842,65.15611380287388
Arifureta: From Commonplace to World's Strongest,6.7,"Action, Adventure, Fantasy",TV,"AT-X, Sony Music Communications, Bushiroad, Toranoana, Hakuhodo DY Music & Pictures, Overlap, FuRyu, Bandai Namco Arts","asread., White Fox",5342.0,291,6169,372514.0,652116,79.60278333131973
Dragon Pilot: Hisone and Masotan,7.31,"Award Winning, Comedy, Drama, Fantasy",TV,"Warner Bros. Japan, BS Fuji, Hakuhodo DY Music & Pictures",Bones,2482.0,2213,310,35865.0,80502,58.7939445640497
Saekano the Movie: Finale,8.43,"Comedy, Romance",Movie,Aniplex,CloverWorks,159.0,1282,2432,76049.0,172613,67.05115580994641
My Hero Academia: Two Heroes,7.56,Action,Movie,"TOHO animation, Shueisha, Toho Music",Bones,1488.0,252,1392,440536.0,714356,82.26676988840153
Magical Girl Ore,6.64,"Comedy, Fantasy",TV,"Genco, AT-X, KlockWorx, Crunchyroll, My Theater D.D.",Pierrot Plus,5620.0,2195,141,25501.0,81384,54.756854676800096
Aggretsuko (ONA),7.64,Comedy,ONA,"Sanrio, Netflix",Fanworks,1267.0,1276,1246,112539.0,173301,69.76169623514525
Dropkick On My Devil!,7.02,"Comedy, Supernatural",TV,"BS Fuji, Strawberry Meets Pictures, Hokkaido Cultural Broadcasting, Kanetsu Investment, BookLive, ibis Capital Partners, Global Solutions, Y&N Brothers",Nomad,3905.0,1731,417,40798.0,117108,59.61019171290509
Mirai,7.28,"Adventure, Drama, Fantasy",Movie,"Toho, NTT Docomo, Nippon Television Network, Kadokawa, D.N. Dream Partners, Sonilude",Studio Chizu,2633.0,1555,338,64924.0,133784,64.2362331414566
Love To-LIE-Angle,5.61,"Comedy, Girls Love, Ecchi",TV,"Ichijinsha, Cloud22","Creators in Pack, Studio Lings",10426.0,2494,75,25974.0,66347,53.36999573606004
HIMOTE HOUSE: A share house of super psychic girls,5.66,Comedy,TV,"Sony Pictures Entertainment, Chugai Mining, Hakuhodo, GYAO!, THINKR, Moonbell, LinkedBrain",Bouncy,10228.0,4871,19,4406.0,17216,37.06900224400088
Dragon Ball Super: Broly,8.16,"Action, Adventure, Fantasy",Movie,"Shueisha, Echoes",Toei Animation,391.0,578,2838,259118.0,372353,78.07119688337174
Food Wars! The Third Plate: Totsuki Train Arc,7.96,"Gourmet, Ecchi",TV,Shueisha,J.C.Staff,634.0,268,1404,412893.0,691058,82.14445050738234
Mitchiri Neko,6.83,Comedy,TV,Frencel,helo.inc,4723.0,6467,29,3480.0,8461,36.62544760145722
Sword Dynasty,5.8,Action,ONA,iQIYI,EMT Squared,9714.0,9552,8,498.0,2922,17.16506583869607
Hinomaru Sumo,7.55,Sports,TV,"Nihon Ad Systems, Pony Canyon, Shueisha, BS11, Jinnan Studio, Cygames, CA-Cygames Anime Fund",Gonzo,1549.0,1730,333,52087.0,117097,62.538143744800855
I Want You To Show Me Your Panties With a Disgusted Face,5.74,Ecchi,ONA,Toranoana,UWAN Pictures,9938.0,2049,385,32725.0,91595,55.715105917897006
The Ancient Magus' Bride Recap,7.24,"Fantasy, Supernatural",Special,"Production I.G, Shochiku, flying DOG, Mag Garden",Wit Studio,2808.0,5091,29,4691.0,15196,39.92122613746001
Today's Menu for the Emiya Family,7.79,"Comedy, Gourmet, Slice of Life",ONA,"Aniplex, Kadokawa",ufotable,939.0,1646,701,55751.0,125220,63.45488298760764
Saga of Tanya the Evil: The Movie,8.24,"Action, Fantasy",Movie,"AT-X, Sony Music Communications, Kadokawa, Kadokawa Animation",Nut,306.0,860,1027,137688.0,260782,72.32236484719718
The King's Avatar (2018),8.18,Action,ONA,"Tencent Animation & Comics, Tencent Penguin Pictures, China Literature Limited, Colored Pencil Animation Japan",Colored Pencil Animation,377.0,1906,355,52547.0,101980,63.35943468212542
"Violet Evergarden: The Day You Understand ""I Love You"" Will Surely Come",8.33,"Drama, Fantasy",Special,"Lantis, Pony Canyon, Rakuonsha, ABC Animation",Kyoto Animation,221.0,711,837,185237.0,310089,75.1620622830292
Grand Blue Dreaming,8.43,Comedy,TV,"Mainichi Broadcasting System, Kodansha, NBCUniversal Entertainment Japan, Avex Pictures, Q-Tec, JR East Marketing & Communications, GYAO!",Zero-G,154.0,243,18468,391686.0,730380,82.18729676956075
GeGeGe no Kitaro,7.2,"Comedy, Horror, Supernatural",TV,"Yomiko Advertising, Fuji TV",Toei Animation,3016.0,2950,122,11084.0,48399,47.81028016667178
Cells at Work!,7.56,Comedy,TV,"Aniplex, Kodansha, Magic Capsule",David Production,1499.0,310,2265,305582.0,624353,78.88902117067217
Asobi Asobase - workshop of fun -,8.19,Comedy,TV,"Hakusensha, AT-X, Sony Music Communications, Kadokawa Media House, Kadokawa",Lerche,353.0,458,6237,213740.0,450287,76.32722503163329
Uncharted Walker,7.26,"Mystery, Suspense",ONA,"bilibili, Jay Zone Comic",Thundray,2738.0,4654,75,5552.0,19251,41.502790602014
Fights Break Sphere 2nd Season,7.56,"Action, Adventure, Fantasy, Romance",ONA,"Tencent Penguin Pictures, China Literature Limited, Bytehoo",Motion Magic,1492.0,6418,34,4499.0,8620,39.93470218750661
Radiant,6.88,"Action, Adventure, Fantasy",TV,"Studio Hibari, NHK, NHK Enterprises",Lerche,4472.0,1103,419,76720.0,203105,65.25602635951229
Crystal Sky of Yesterday,6.77,"Drama, Romance, Slice of Life",Movie,"Beijing Enlight Pictures, Horgos Coloroom Pictures Co., Ltd.","Nice Boat Animation, Guton Animation Studio",4975.0,5757,18,2500.0,11251,33.48988120093338
The Founder of Diabolism Season 1,8.43,"Action, Adventure, Drama, Fantasy, Mystery",ONA,"Aniplex, Tencent Penguin Pictures",B.CMAY PICTURES,156.0,1031,6323,73364.0,217671,66.71922572668879
The Beauty Blogger,6.66,"Drama, Romance",ONA,Tencent Penguin Pictures,Imagineer,5549.0,7734,28,1327.0,5439,27.490232021620884
How Not to Summon a Demon Lord,6.86,"Comedy, Fantasy, Ecchi",TV,"Sotsu, Kodansha, Half H.P Studio, AT-X, KlockWorx, DIVE II Entertainment, 81 Produce, Tokyo MX, Avex Pictures, Q-Tec, Animatic, Eswood",Ajia-do,4585.0,272,2460,403677.0,687927,80.56262289777905
Release the Spyce,6.94,Action,TV,"Mainichi Broadcasting System, Pony Canyon, Half H.P Studio, KlockWorx, Good Smile Company, Tablier Communications, Kadokawa, Legs, Hawkeye",Lay-duce,4216.0,2410,213,24132.0,70361,54.65537618207465
Merc Storia: The Apathetic Boy and the Girl in a Bottle,6.52,"Action, Adventure, Fantasy",TV,Happy Elements,Encourage Films,6233.0,3800,47,9009.0,30157,44.98007585896028
Starwing Paradox,5.53,"Action, Sci-Fi",ONA,"Square Enix, Q-Tec, dugout",Sunrise,10699.0,13252,1,166.0,829,6.586547896757366
Gundam Build Divers,6.3,"Action, Sci-Fi",TV,"TV Tokyo, Sotsu",Sunrise,7387.0,3840,51,12807.0,29568,47.91146971346644
Last Period: The Journey to the End of the Despair,6.37,"Action, Adventure, Comedy, Fantasy",TV,"Egg Firm, Happy Elements",J.C.Staff,7012.0,3388,28,10950.0,37840,46.56691649434593
You Don't Know Gunma Yet,5.24,Comedy,TV,TOHO animation,Asahi Production,11510.0,5301,2,5239.0,13834,37.95604619696756
Hanebado!,6.85,Sports,TV,"Kodansha, AT-X, Ultra Super Pictures, TOHO animation, Q-Tec, Sammy, BS11, Contents Seed, Toho Music, MediaLink Entertainment Limited",LIDENFILMS,4641.0,1408,355,72581.0,153064,64.70353261584259
For Whom the Alchemist Exists,6.42,"Action, Adventure, Fantasy",Movie,"Magic Capsule, flying DOG",Satelight,6786.0,5802,23,2583.0,11032,33.30130322318204
GOD EATER Reso Somehow Theatre,5.57,"Fantasy, Sci-Fi",ONA,"Bandai Namco Entertainment, DMM.futureworks, Aoni Production","Passione, Creators in Pack",10551.0,8106,3,733.0,4859,20.360041369020927
Beyblade Burst Turbo,6.51,"Action, Adventure, Sci-Fi, Sports",TV,"TV Tokyo, d-rights",OLM,6299.0,5270,84,7909.0,13972,43.76337847933104
