English name,Score,Genres,Type,Producers,Studios,Rank,Popularity,Favorites,Scored By,Members,Weighted_Score
Monkey Typhoon,6.55,"Action, Adventure, Comedy, Sci-Fi",TV,TV Tokyo,Studio Egg,6091.0,9121,6,1092.0,3373,25.53678184493124
Saban's Adventures of the Little Mermaid,6.15,"Drama, Fantasy, Romance",TV,Fuji TV,Telescreen,8121.0,11090,3,609.0,1718,19.563578723668734
They Are My Noble Masters,7.11,"Comedy, Romance, Ecchi",TV,"Lantis, Studio Jack, Good Smile Company",A.C.G.T.,3489.0,1746,227,53186.0,116004,62.17646969998099
Tower of Druaga: The Aegis of Uruk,7.13,"Adventure, Comedy, Fantasy",TV,"Dentsu, Sotsu Music Publishing",Gonzo,3392.0,1739,206,50652.0,116390,61.75161338631461
Gunslinger Girl: Il Teatrino,7.13,"Action, Drama, Sci-Fi",TV,Marvelous,Artland,3396.0,2650,111,27482.0,59571,56.10520684200615
Ambassador Magma,5.89,"Action, Sci-Fi",OVA,Bandai Visual,Tezuka Productions,9307.0,12029,2,297.0,1219,12.536309793898894
Kindaichi Case Files Special,7.19,Mystery,Special,"Dentsu, Magic Bus, YTV",Toei Animation,3098.0,9808,6,946.0,2645,25.072375140703336
Lily C.A.T.,5.94,"Horror, Sci-Fi",OVA,"Victor Entertainment, Streamline Pictures",Pierrot,9112.0,6308,10,3700.0,9027,35.90227714659639
Lemon Angel (1988),5.7,Ecchi,TV,Pony Canyon,AIC,10073.0,10794,1,431.0,1924,15.670707784431816
Lemon Angel (1988/II),5.61,Ecchi,TV,Pony Canyon,AIC,10420.0,11326,0,373.0,1567,14.18972684788073
.hack//G.U. Trilogy,7.08,"Action, Fantasy",Movie,Bandai Visual,CyberConnect2,3612.0,3670,104,14527.0,32201,50.15304669963785
IGPX: Immortal Grand Prix,7.07,"Action, Drama, Sci-Fi",TV,Bandai Visual,Production I.G,3664.0,4591,83,8323.0,19891,44.99655729811982
Daigunder,6.71,"Adventure, Sci-Fi",TV,"TV Tokyo, Victor Entertainment","Nippon Animation, Brain's Base",5271.0,9343,16,1630.0,3145,29.458266759483752
Skelter Heaven,1.85,Sci-Fi,OVA,"Idea Factory, Cospa",Minami Machi Bugyousho,12701.0,3415,111,26431.0,37328,43.28672382038118
Gundam Evolve,6.51,Action,OVA,Sotsu,Sunrise,6309.0,5850,12,4055.0,10824,37.59441713673256
Vampiyan Kids,5.91,"Comedy, Fantasy",TV,Fuji TV,Production I.G,9260.0,12446,2,189.0,1058,8.396730786107653
Aria the Origination,8.48,"Fantasy, Sci-Fi, Slice of Life",TV,"Production I.G, TV Tokyo, Media Factory, Shochiku, Mag Garden",Hal Film Maker,133.0,1659,4041,30786.0,123798,58.75483951796897
Hatenkou Yugi,7.11,"Adventure, Comedy, Drama, Fantasy, Romance",TV,"Frontier Works, Sotsu",Studio Deen,3485.0,3430,169,15843.0,37033,50.992892439539276
H2O: Footprints in the Sand,7.0,Romance,TV,"Kadokawa Shoten, Broccoli, Kadokawa Pictures Japan, KlockWorx, NTT Docomo, Studio Jack",Zexcs,4010.0,2001,380,47242.0,94580,60.93808648066134
Rumbling Hearts OVA,6.9,"Drama, Romance",OVA,Age,Brain's Base,4387.0,3892,33,14775.0,28607,50.0715535374484
Our Home's Fox Deity,7.19,"Comedy, Fantasy",TV,"Kadokawa Shoten, Kadokawa Pictures Japan, KlockWorx, NTT Docomo",Zexcs,3071.0,3681,81,11826.0,32011,48.39581608538949
The Brave Fighter Exkizer,6.67,"Action, Sci-Fi",TV,Nagoya Broadcasting Network,Sunrise,5478.0,9711,9,737.0,2737,22.074205056759457
Franz Kafka's A Country Doctor,6.66,"Avant Garde, Award Winning, Drama",Movie,Shochiku,"Imagica, Yamamura Animation, Inc.",5529.0,4384,71,9042.0,21962,45.21002482272921
Smart-san,7.2,"Drama, Romance, Slice of Life",TV,Asahi Broadcasting,Nippon Animation,3020.0,7358,20,880.0,6157,24.417462478468803
Rin: Daughters of Mnemosyne,7.26,"Action, Girls Love, Horror, Sci-Fi, Supernatural",TV,"VAP, Sotsu, Genco, AT-X, Showgate",Xebec,2739.0,1234,1114,71546.0,179497,65.10771410007605
Kiddy Girl-AND,6.84,"Action, Comedy, Sci-Fi",TV,"Lantis, Kadokawa Shoten, Kadokawa Pictures Japan, KlockWorx, gimik",Satelight,4667.0,4839,33,6197.0,17544,41.9674144276084
Zombie-Loan,7.0,"Action, Horror, Supernatural",Special,"Xebec, Nihon Ad Systems",XEBEC M2,3998.0,3899,19,15014.0,28452,50.35260617109161
Kurenai,7.33,"Comedy, Drama",TV,"Yomiko Advertising, Pony Canyon, Half H.P Studio, Shueisha",Brain's Base,2356.0,2098,223,36861.0,88656,59.07212841482275
Amatsuki,6.88,"Action, Fantasy, Mystery",TV,"Frontier Works, Sotsu",Studio Deen,4486.0,2714,124,25915.0,56981,55.233454850235645
Real Drive,7.09,"Action, Sci-Fi",TV,"VAP, Nippon Television Network, D.N. Dream Partners",Production I.G,3582.0,4042,52,6064.0,26383,42.09855967447922
Persona: Trinity Soul,6.52,"Action, Sci-Fi",TV,Aniplex,A-1 Pictures,6241.0,2209,162,25491.0,80969,54.58481825891521
Legend of the Galactic Heroes Gaiden,8.12,"Action, Drama, Sci-Fi",OVA,"Kitty Films, Tokuma Shoten, Wright Staff",K-Factory,434.0,4289,66,8575.0,23164,46.550684473369174
Miss Machiko,6.19,"Comedy, Ecchi",TV,TV Tokyo,Pierrot,7912.0,8807,10,671.0,3765,20.518499394009144
Hurricane Polymar: Holy Blood,5.77,"Action, Sci-Fi",OVA,"Nihon Ad Systems, Nippon Columbia, Audio Tanaka","J.C.Staff, Tatsunoko Production",9795.0,10214,4,840.0,2314,21.943713021871236
Blassreiter,6.89,"Action, Sci-Fi",TV,"Nitroplus, Sotsu Music Publishing",Gonzo,4417.0,2194,215,29250.0,81415,56.36477127320241
Shigofumi: Letters from the Departed,7.46,"Drama, Fantasy, Suspense",TV,"Bandai Visual, Genco, Lantis, Rakuonsha",J.C.Staff,1861.0,2083,354,31265.0,89616,57.7139665099634
Bumpety Boo,6.09,Adventure,TV,"NHK, Studio Jack",Nippon Animation,8404.0,11581,5,670.0,1434,20.35436387951875
The Many Dream Journeys of Meme,6.74,"Adventure, Sci-Fi",TV,TBS,Nippon Animation,5140.0,13044,3,291.0,880,13.592123697241787
Top Striker,6.69,Sports,TV,Fuji TV,Nippon Animation,5388.0,8457,15,2214.0,4319,32.2582845362041
Mad Bull 34,6.3,Action,OVA,Pony Canyon,Magic Bus,7401.0,5787,61,4128.0,11105,37.45638947871016
The Goddess is a Middle School Student,7.45,"Comedy, Drama, Slice of Life, Supernatural",Special,Geneon Universal Entertainment,Brain's Base,1894.0,5792,4,6062.0,11071,42.55287720782765
To Love Ru,6.99,"Comedy, Romance, Sci-Fi, Ecchi",TV,"Geneon Universal Entertainment, TBS, Shueisha",Xebec,4050.0,316,4062,314705.0,620071,78.43677799255902
Vampire Knight,6.88,"Drama, Mystery, Romance, Supernatural",TV,"TV Tokyo, Aniplex, Nihon Ad Systems",Studio Deen,4482.0,338,7279,345342.0,586546,79.14818378160469
Minky Momo in the Bridge Over Dreams,7.04,"Drama, Slice of Life",OVA,"Starchild Records, Yomiuri Advertising",Asahi Production,3808.0,9844,12,953.0,2612,24.945782358353227
Kino's Journey: Tower Country,7.56,"Adventure, Fantasy, Suspense",Special,Genco,A.C.G.T.,1507.0,3420,24,18796.0,37228,53.137919968298206
Haruka Nogizaka's Secret,7.2,"Comedy, Romance",TV,"Geneon Universal Entertainment, ASCII Media Works, Studio Mausu",Diomedéa,3037.0,1576,441,66950.0,132050,64.4179579150948
Special A (S.A),7.51,"Comedy, Romance",TV,Showgate,"Gonzo, AIC",1685.0,609,2698,182938.0,357664,74.08977950455152
Nayuta,5.43,"Action, Sci-Fi",OVA,OB Planning,Circus Production,11007.0,10786,3,636.0,1929,18.814565388539815
"Maison Ikkoku: Prelude, When the Cherry Blossoms in the Springtime Return",6.7,"Comedy, Drama, Romance",Special,Kitty Films,Studio Deen,5312.0,8737,2,1283.0,3877,27.23417293768128
Megaman Star Force Tribe,6.93,Adventure,TV,Half H.P Studio,Xebec,4282.0,7181,19,2847.0,6511,34.905768762362264
Sisters of Wellber Zwei,6.74,"Adventure, Fantasy, Romance",TV,"Production I.G, Avex Entertainment, Nagoya Broadcasting Network",Trans Arts,5112.0,7910,3,1479.0,5168,28.601820060148366
Kanokon: The Girl Who Cried Fox,6.38,"Comedy, Romance, Supernatural, Ecchi",TV,"Media Factory, Movic, AT-X",Xebec,6987.0,918,590,117288.0,243899,68.47905081599458
Brave Command Dagwon,6.91,"Action, Adventure",TV,Nagoya Broadcasting Network,Sunrise,4359.0,10231,3,561.0,2300,19.881349527159884
Riki-Oh: The Wall of Hell,5.96,Action,OVA,Trans Arts,Magic Bus,9035.0,8751,7,1669.0,3854,28.582143417347417
Riki-Oh 2: Child of Destruction,5.13,Action,OVA,Trans Arts,Magic Bus,11725.0,10332,3,1026.0,2230,22.704992512583097
Green Makibao,6.98,Comedy,TV,Fuji TV,Pierrot,4072.0,10601,17,934.0,2045,24.68081256913713
Brain Adventure Record Webdiver,6.89,"Action, Adventure, Sci-Fi",TV,"TV Tokyo, Nippon Animation, Nihon Ad Systems",Radix,4423.0,9886,19,988.0,2589,25.079946727747764
Speed Racer X,6.26,Adventure,TV,"TV Tokyo, Yomiuri Advertising",Tatsunoko Production,7593.0,8643,5,1486.0,4018,27.963245188134763
Macross Frontier,7.89,"Action, Award Winning, Romance, Sci-Fi",TV,"Bandai Visual, Mainichi Broadcasting System, Big West",Satelight,753.0,1479,1859,65933.0,143564,65.12170236305433
Dinosaur King,6.35,"Adventure, Fantasy",TV,"Asatsu DK, Sega, 4Kids Entertainment, Happinet Pictures, Nagoya Broadcasting Network",Sunrise,7135.0,4154,117,15067.0,24959,49.48520173996138
Getter Robo,6.77,"Action, Sci-Fi",TV,Dynamic Planning,Toei Animation,4986.0,6715,21,1912.0,7765,31.013894479918573
Soul Eater,7.84,"Action, Comedy, Fantasy",TV,"TV Tokyo, Aniplex, Dentsu, Media Factory",Bones,836.0,62,26107,818237.0,1565227,88.32025488610587
Utawarerumono OVA,7.18,"Action, Comedy, Fantasy",OVA,Frontier Works,Chaos Project,3146.0,4458,13,9387.0,21133,46.25004950572975
Tears to Tiara,7.15,"Action, Adventure, Fantasy",TV,"Dwango, Bushiroad, Showgate, Good Smile Company",White Fox,3298.0,2258,179,30787.0,77897,57.17975337675694
Spirit Warrior,5.8,"Action, Horror",OVA,"Pony Canyon, Pioneer LDC, Shueisha, Soeishinsha","AIC, Studio 88",9680.0,9580,5,749.0,2895,20.932964448929287
Lightning Trap: Leina & Laika,5.27,"Action, Sci-Fi",OVA,Youmex,Ashi Productions,11432.0,12358,0,416.0,1088,14.619730201140785
Girl from Phantasia,5.36,"Comedy, Drama, Fantasy, Romance",OVA,Starchild Records,Production I.G,11201.0,9772,1,1226.0,2682,24.754222643878503
Spirit Warrior,5.76,"Action, Horror",OVA,"Pony Canyon, Pioneer LDC, Shueisha",Madhouse,9849.0,10223,1,691.0,2309,20.124956706588286
JoJo's Bizarre Adventure: Phantom Blood,7.71,"Action, Adventure, Horror",Movie,"TV Tokyo, Bandai, KlockWorx, Asmik Ace, Shueisha, Sumitomo, Sony PCL",APPP,1115.0,2493,605,27700.0,66440,56.90037071418476
Hidamari Sketch x 365,7.82,"Comedy, Slice of Life",TV,"Aniplex, Lantis, TBS, Movic, Houbunsha",Shaft,880.0,3736,180,15490.0,31196,51.66376770958546
Princess Army: Wedding Combat,4.86,"Action, Romance",OVA,Movic,J.C.Staff,12129.0,11373,2,465.0,1544,14.899966569140808
Library Wars,7.44,"Action, Comedy, Romance",TV,"Dentsu, Fuji TV, Code, Asmik Ace, ASCII Media Works, Sony Music Entertainment, Atelier Musa",Production I.G,1931.0,2364,398,26662.0,72308,56.21849267443384
Ryoko's Case File,7.05,"Mystery, Supernatural",TV,"Starchild Records, GANSIS",Doga Kobo,3787.0,4725,40,5904.0,18646,41.799393150394806
Once Upon a Time... Life,7.15,Adventure,OVA,Procidis,Eiken,3290.0,9754,9,1335.0,2695,28.201244635722293
Battle Royal High School,5.56,"Action, Horror, Supernatural",OVA,Tokuma Shoten,D.A.S.T.,10589.0,6632,15,3095.0,8020,33.64311176716605
Adventure Hero Pluster World,6.24,"Action, Adventure, Sci-Fi",TV,TV Tokyo,"Actas, Brain's Base",7664.0,12454,3,270.0,1054,12.18942298329158
Kaiketsu Zorori,7.04,"Adventure, Comedy",TV,Nagoya Broadcasting Network,Ajia-do,3799.0,9080,39,1285.0,3422,27.70561849591548
Naisho no Tsubomi,6.5,Romance,OVA,Happinet Pictures,Studio Kikan,6409.0,6635,6,3548.0,8018,36.34684712164831
Higurashi: When They Cry – Rei,7.41,"Mystery, Supernatural, Suspense",OVA,"Geneon Universal Entertainment, Frontier Works, Sotsu, Movic",Studio Deen,2035.0,1171,455,100832.0,189436,68.4650666110396
Linebarrels of Iron,6.9,"Action, Sci-Fi",TV,"Akita Shoten, Sotsu Music Publishing",Gonzo,4390.0,3197,88,18547.0,42085,52.17120322574533
Magician's Academy,6.92,"Comedy, Fantasy, Romance, Supernatural, Ecchi",TV,Media Factory,Zexcs,4321.0,3170,109,18487.0,42602,52.16800893080912
Nabari no Ou,7.26,"Action, Drama, Supernatural",TV,"Square Enix, Kinyosha",J.C.Staff,2741.0,1338,1231,66004.0,163514,64.3631795261183
Legend of the Galactic Heroes Gaiden (1999),8.05,"Action, Drama, Sci-Fi",OVA,"Tokuma Shoten, Tokuma Japan, Wright Staff",K-Factory,528.0,4630,24,7227.0,19473,44.891404217950424
Strike Witches,6.95,"Action, Sci-Fi, Ecchi",TV,"GDH, Kadokawa Shoten, KlockWorx, NTT Docomo",Gonzo,4204.0,1310,1063,67634.0,166984,64.18548266750095
Genesis Climber Mospeada,7.09,Action,TV,"Artmic, Harmony Gold",Tatsunoko Production,3570.0,6305,33,3374.0,9033,36.684798716033896
"Genesis Climber Mospeada: Love, Live, Alive",6.1,Action,OVA,Artmic,Tatsunoko Production,8376.0,10992,0,538.0,1789,18.34383332606604
The Daughter of 20 Faces,7.55,"Action, Adventure, Mystery",TV,"PRA, Sakura Create, Fujipacific Music","Bones, Telecom Animation Film",1562.0,3579,157,11486.0,33803,48.57759375117879
Kaiba,8.14,"Adventure, Award Winning, Mystery, Romance, Sci-Fi",TV,"VAP, WOWOW",Madhouse,425.0,1458,3547,42924.0,145696,61.44624080830252
Detroit Metal City: The Animated Series,8.11,Comedy,OVA,"Sony Music Entertainment, Beyond C.",Studio 4°C,452.0,1092,3234,106329.0,205577,69.78883183909639
Graveyard Kitaro,6.86,"Horror, Supernatural",TV,"Dentsu, Yomiko Advertising, SKY Perfect Well Think, Fuji TV, Asmik Ace, Sony Music Entertainment, Fujipacific Music",Toei Animation,4577.0,5691,42,3816.0,11574,37.51703522120311
Hell Girl: Three Vessels,7.61,"Mystery, Supernatural",TV,"Aniplex, Tokyo MX",Studio Deen,1364.0,1926,273,41236.0,100427,60.454026613067406
The Adventures of the Little Koala,6.14,Comedy,TV,Tohokushinsha Film Corporation,Topcraft,8167.0,12865,1,320.0,929,13.608391687286334
ItaKiss,7.42,"Comedy, Romance",TV,"Bandai Visual, Trinity Sound",TMS Entertainment,2022.0,818,2919,142739.0,275035,71.68708764892777
Glass Mask: The Girl of a Thousand Masks,6.84,Drama,OVA,"Dentsu, TV Asahi",Tokyo Movie Shinsha,4657.0,10021,12,760.0,2464,22.59029834484261
Shooting Star Gakusaver,6.86,"Action, Comedy, Sci-Fi",OVA,"Starchild Records, Movic",Production I.G,4596.0,11283,0,475.0,1596,18.27805664642641
World's Famous Stories for Children: Thumb Princess,5.95,Fantasy,Movie,Harmony Gold,Toei Animation,9059.0,12374,1,430.0,1082,16.04550004850158
Aladdin and the Wonderful Lamp,6.12,"Adventure, Fantasy",Movie,Rankin/Bass,Toei Animation,8286.0,11323,1,679.0,1572,20.5229216717474
Sonic Soldier Borgman: Lovers Rain,5.61,"Action, Sci-Fi",Movie,Toho,Ashi Productions,10403.0,12238,2,330.0,1133,13.059203505710808
Play Ball,6.16,"Action, Sports",TV,Magic Bus,Eiken,8062.0,12424,1,205.0,1064,9.528797207660169
Cubix,5.34,Sci-Fi,TV,CinePix,Xebec,11267.0,8231,6,2423.0,4669,31.01002729658384
The Garden of Sinners Chapter 2: A Study in Murder - Part 1,7.78,"Action, Mystery, Romance, Supernatural, Suspense",Movie,Notes,ufotable,969.0,963,459,143662.0,233399,72.1841153910853
The Garden of Sinners Chapter 3: Remaining Sense of Pain,8.02,"Action, Drama, Mystery, Supernatural, Suspense",Movie,Notes,ufotable,567.0,1014,656,134951.0,221438,71.8870456875127
Maris the Chojo,5.89,"Comedy, Sci-Fi",OVA,"Shogakukan-Shueisha Productions, OB Planning",Pierrot,9325.0,8398,5,1862.0,4399,29.483458194507715
Amazing Sarutobi,7.1,"Adventure, Comedy, Romance, Sports",TV,"Nihon Ad Systems, Asatsu DK",Tsuchida Productions,3565.0,11062,11,543.0,1735,19.83069795806135
The Littl' Bits,6.34,"Adventure, Comedy, Fantasy",TV,Meruhensha,Tatsunoko Production,7156.0,11222,5,574.0,1635,19.29804548208106
The Adventures of the Little Prince,6.77,Adventure,TV,TV Asahi,Knack Productions,4993.0,10537,13,604.0,2090,20.37420855130085
Idol Fighter Su-Chi-Pai,4.28,"Action, Ecchi",OVA,"Nippon Columbia, Darts",Daume,12560.0,10804,0,799.0,1921,18.723874170069497
Little Lulu,6.39,"Comedy, Slice of Life",TV,Asahi Broadcasting,Nippon Animation,6933.0,12737,1,348.0,968,14.750996113585574
My Name Is Teppei,6.88,"Action, Sports",TV,Fuji TV,Nippon Animation,4468.0,11179,4,430.0,1666,17.38611895972605
The Diary of Anne Frank,6.75,Drama,Movie,"TBS, Imagica, Hakuhodo, Nichion, Bungeishunjuu, Tokyo FM Broadcasting",Madhouse,5064.0,6683,8,2438.0,7848,33.230671717518526
Belle and Sebastian,6.72,Adventure,TV,"NHK, Toho",Visual 80,5234.0,9111,8,1187.0,3378,26.54359369902252
Glass Maiden,6.12,"Action, Sci-Fi",TV,"Happinet Pictures, BIGLOBE",Studio Fantasia,8255.0,4947,10,5347.0,16538,39.57799615074311
"One Piece: Episode of Chopper Plus - Bloom in the Winter, Miracle Sakura",7.45,"Action, Adventure, Fantasy",Movie,"Fujipacific Music, Shueisha",Toei Animation,1866.0,2558,19,33328.0,63589,58.29165063771295
The Adventures of Hutch the Honeybee,6.89,"Adventure, Comedy, Drama",TV,Bandai,Tatsunoko Production,4436.0,9222,23,1732.0,3266,30.26316010390988
Coji-Coji,6.28,"Comedy, Fantasy",TV,Aniplex,Nippon Animation,7485.0,13927,1,145.0,668,6.512089334479461
Super Mario Brothers: Great Mission to Rescue Princess Peach,5.59,"Adventure, Comedy",Movie,"VAP, Nintendo, Harmony Gold",Grouper Productions,10488.0,7566,17,3097.0,5716,33.69876664066801
Junk Boy,5.86,"Comedy, Romance, Ecchi",OVA,Victor Entertainment,Madhouse,9472.0,6358,24,3984.0,8849,36.4599624485581
Mazinger Z vs. Devilman,6.09,"Adventure, Sci-Fi",Movie,Dynamic Planning,Toei Animation,8410.0,8367,5,1803.0,4447,29.494472590855533
Golden Bat,6.61,"Action, Sci-Fi",TV,Tele-Cartoon Japan,"Dai-Ichi Douga, Dongyang Animation",5767.0,10085,5,547.0,2412,19.238261859310366
Baccano! Specials,8.09,"Action, Comedy, Mystery, Supernatural",Special,Aniplex,Brain's Base,470.0,1264,300,110192.0,175205,70.09557569894338
Galaxy Warring State Chronicle Rai,7.89,"Adventure, Romance, Sci-Fi",TV,"TV Tokyo, SoftX",E&G Films,747.0,5114,85,4993.0,15032,41.291279204610426
Ogre Slayer,6.16,Action,OVA,"KSS, OB Planning, TBS, Shogakukan",Pastel,8060.0,9397,2,934.0,3089,23.526942519773282
Time Fighters,6.43,"Adventure, Comedy",TV,Harmony Gold,Tatsunoko Production,6719.0,9906,2,694.0,2571,21.180851477634995
Mobile Suit Gundam 00: Second Season,8.08,"Action, Drama, Sci-Fi",TV,Mainichi Broadcasting System,Sunrise,479.0,1453,1365,91787.0,146885,68.39651274359497
Hiwou War Chronicles,6.81,"Action, Adventure",TV,Bandai Visual,Bones,4802.0,10749,3,502.0,1953,18.720904148217915
Kannagi: Crazy Shrine Maidens,7.28,"Comedy, Supernatural",TV,"Aniplex, Sony Music Entertainment, Ichijinsha",A-1 Pictures,2622.0,1319,376,67766.0,165735,64.63186936529934
∀ Gundam I: Earth Light,6.45,"Action, Drama, Sci-Fi",Movie,"Sotsu, Atelier Musa",Sunrise,6638.0,8088,2,1413.0,4895,27.774208202631907
∀ Gundam II: Moonlight Butterfly,6.58,"Action, Drama, Sci-Fi",Movie,"Sotsu, Atelier Musa",Sunrise,5934.0,8189,1,1401.0,4747,27.879708348252326
Yu-Gi-Oh! 5D's,7.44,Action,TV,"Nihon Ad Systems, Konami Cross Media NY",Gallop,1937.0,1538,1515,79526.0,135950,66.31036529676538
Birdy the Mighty: Decode,7.42,"Action, Comedy, Sci-Fi",TV,"Aniplex, Shogakukan",A-1 Pictures,1995.0,2014,386,34349.0,93650,58.53304063907483
The Spider and the Tulip,5.65,Adventure,Movie,Shochiku,Shochiku Animation Institute,10256.0,10287,2,1213.0,2265,25.14230455750985
Tweeny Witches the Adventures,6.68,"Adventure, Comedy, Fantasy",OVA,Tohokushinsha Film Corporation,Studio 4°C,5443.0,7771,4,1517.0,5385,28.753496656239218
Paul in Fantasy Island,6.36,"Action, Adventure",TV,Fuji TV,Tatsunoko Production,7105.0,12416,1,340.0,1068,14.49289102509377
School Rumble 3rd Semester,7.29,"Comedy, Romance",OVA,Kodansha,Studio Comet,2581.0,2610,91,34824.0,61273,58.4966418503776
Antique Bakery,7.01,"Boys Love, Comedy, Gourmet",TV,"Dentsu, Fuji TV, Asmik Ace, Sony Music Entertainment, Shinshokan","Nippon Animation, Shirogumi",3960.0,3406,104,15268.0,37509,50.520706105924525
Hello Kitty's Paradise,6.55,Fantasy,TV,Bones,Sanrio,6056.0,10237,7,760.0,2295,22.190312509351624
Pokémon: Giratina and the Sky Warrior,6.88,"Action, Adventure, Fantasy",Movie,"Universal Studios, Studio Jack",OLM,4469.0,2103,30,54174.0,88178,62.042775280635354
THE IDOLM@STER Live For You!,6.18,"Comedy, Drama",OVA,"Frontier Works, Bandai Namco Games",Actas,7994.0,6090,9,3749.0,9806,36.389519574452784
Psychic Squad,7.29,"Action, Comedy, Supernatural",TV,"TV Tokyo, Geneon Universal Entertainment, Shogakukan-Shueisha Productions, Half H.P Studio",SynergySP,2597.0,3049,118,11826.0,45601,48.52336533702429
Golgo 13,7.52,"Action, Adventure, Drama, Suspense",TV,"TV Tokyo, Sotsu, Half H.P Studio",The Answer Studio,1652.0,3228,223,11267.0,41246,48.36305761535252
Hanappe Bazooka,5.31,"Action, Comedy, Ecchi",OVA,Nippon Columbia,Studio Signal,11328.0,8883,3,1552.0,3662,26.84477746028364
Mushiking: The Guardians of the Forest,7.07,Fantasy,TV,"TV Tokyo, Yomiuri Advertising",TMS Entertainment,3671.0,8852,19,1363.0,3694,28.2890095153403
Web Ghosts PiPoPa,6.72,"Action, Adventure, Comedy, Sci-Fi",TV,Milky Cartoon,Studio Hibari,5238.0,10460,7,751.0,2139,22.31689560383654
Medabots Spirits,6.65,"Action, Adventure, Sci-Fi",TV,"TV Tokyo, Nihon Ad Systems, Nelvana",Trans Arts,5602.0,4609,17,10061.0,19663,46.182253219206046
Ladius,5.45,"Action, Adventure, Sci-Fi",OVA,Toho,Ashi Productions,10938.0,10390,2,851.0,2193,21.537052658661494
"Clannad: Another World, Tomoyo Chapter",7.93,"Drama, Romance",Special,Pony Canyon,Kyoto Animation,680.0,743,846,199044.0,298969,75.37149566815785
Sekirei,7.04,"Action, Comedy, Ecchi",TV,"Aniplex, Movic",Seven Arcs,3820.0,537,1674,200937.0,397397,74.35958293892926
Tytania,6.8,"Adventure, Romance, Sci-Fi",TV,"Kodansha, Sogo Vision, Magic Capsule, Happinet Pictures, Sony PCL",Artland,4827.0,4666,33,7151.0,19136,43.235488174317396
The Call of the Wild,6.44,"Adventure, Drama",Special,"Fuji TV, Hoso Seisaku Doga",Toei Animation,6654.0,11561,4,476.0,1445,17.71422848213869
Super Robot Wars Original Generation: Divine Wars Special,6.69,"Action, Comedy",Special,"GDH, Genco, Banpresto",OLM,5402.0,9767,4,994.0,2686,24.863865964449456
Natsume's Book of Friends,8.31,"Drama, Slice of Life, Supernatural",TV,"Aniplex, Nihon Ad Systems, TV Tokyo Music, Sony Music Entertainment",Brain's Base,232.0,394,15221,179501.0,519303,74.8493892160481
Princess Comatose,6.95,"Action, Comedy, Horror, Supernatural",Special,Lantis,Madhouse,4188.0,5723,14,5126.0,11410,40.362626617382496
Michiko & Hatchin,7.84,"Action, Adventure",TV,"Media Factory, Shochiku, Yomiko Advertising, Fuji TV",Manglobe,834.0,1144,2365,59305.0,193544,64.08464165667719
The Amazing 3,6.88,"Action, Adventure, Comedy, Sci-Fi",TV,Fuji TV,Mushi Production,4485.0,12211,3,353.0,1146,15.564669051309492
Batman: Gotham Knight,6.94,"Action, Adventure",OVA,Cyclone Graphics,"Bee Train, Production I.G, Madhouse, Studio 4°C",4237.0,3868,66,17135.0,28980,51.49335259305436
Trigun - Badlands Rumble,7.92,"Action, Adventure, Sci-Fi",Movie,"flying DOG, Sunny Side Up, Studio Jack, Shounen Gahousha",Madhouse,700.0,1531,252,73536.0,137483,66.16456554355645
Gurren Lagann The Movie: Childhood's End,8.16,"Action, Comedy",Movie,Aniplex,Gainax,399.0,1371,397,78976.0,158312,67.09930027725659
Little Women,6.49,"Drama, Slice of Life",TV,Kokusai Eigasha,Toei Animation,6442.0,11522,2,449.0,1463,17.24655483330529
Naruto Shippuden: Konoha Gakuen - Special,7.14,Action,Special,Bandai,Pierrot,3351.0,2552,188,31518.0,63892,57.38352806793622
Penguin Musume♥Heart,6.7,"Comedy, Slice of Life, Ecchi",ONA,"Dwango, Good Smile Company, Nippon Cultural Broadcasting",Picture Magic,5321.0,4894,23,6355.0,17028,42.00893553457238
The Adventures of Scamper the Penguin,7.34,"Adventure, Drama, Fantasy, Slice of Life",OVA,"Life Work, Soyuzmultfilm",Toei Animation,2317.0,9314,12,1715.0,3165,30.756280797312638
Blade of the Immortal,6.82,"Action, Adventure, Supernatural",TV,"Production I.G, Kodansha",Bee Train,4742.0,2479,151,25721.0,67162,55.083178985769834
You're Under Arrest: Diverting Traffic at the Beach,6.99,"Action, Comedy",Special,"Bandai Visual, TBS",Studio Deen,4048.0,7959,3,2138.0,5085,32.3408048204452
Xam'd: Lost Memories,7.65,"Action, Adventure, Sci-Fi",ONA,"Aniplex, Half H.P Studio",Bones,1249.0,1518,1075,57612.0,138433,63.590633176262855
Clannad: After Story,8.93,"Drama, Romance, Supernatural",TV,"Pony Canyon, TBS, Rakuonsha, Animation Do",Kyoto Animation,19.0,114,68949,639729.0,1149886,87.2496980631885
Darker Than Black Episode 26: Beneath the Fully Bloomed Cherry Blossoms,7.54,"Comedy, Sci-Fi",Special,"Aniplex, Square Enix",Bones,1594.0,1529,189,78445.0,137574,66.30727231950095
Space Emperor God Sigma,6.88,Action,TV,TV Tokyo,Toei Animation,4481.0,11710,1,392.0,1373,16.532011907549247
Chrome Shelled Regios,7.28,"Action, Adventure, Fantasy, Sci-Fi",TV,"Kadokawa Shoten, AMG MUSIC",Zexcs,2609.0,1076,1042,102894.0,207899,68.48855911834583
Winter Sonata,7.26,"Drama, Romance",TV,Yoon's Color,"Studio Comet, KeyEast, REALTHING",2722.0,4266,68,5372.0,23435,41.19844725413875
Popolocrois Monogatari,7.01,"Adventure, Fantasy",TV,"Production I.G, TV Tokyo, Aniplex",Bee Train,3957.0,9148,17,979.0,3336,25.154879128915677
Hayate the Combat Butler!!,7.67,"Action, Comedy, Romance",TV,"TV Tokyo, Geneon Universal Entertainment, Shogakukan-Shueisha Productions, Shogakukan Music & Digital Entertainment",J.C.Staff,1204.0,1787,477,56309.0,112866,63.40349100999005
Blue Dragon: Trials of the Seven Shadows,6.53,"Adventure, Comedy, Fantasy, Supernatural",TV,TV Tokyo,Pierrot,6184.0,4859,17,7636.0,17369,43.46732577352685
Mokke Special Episodes,6.79,"Mystery, Slice of Life, Supernatural",Special,Kodansha,Madhouse,4868.0,10341,0,864.0,2223,23.70671238177183
The New Adventures of Gigantor,6.79,Action,TV,Studio Jack,Tokyo Movie Shinsha,4885.0,10388,9,762.0,2195,22.546824409538416
Twilight of the Cockroaches,5.78,Drama,Movie,"Kitty Films, TYO, Streamline Pictures","Madhouse, Animation Staff Room",9758.0,10375,1,635.0,2202,19.376706899985777
Hareluya II Boy,6.34,"Action, Comedy, Fantasy",TV,TV Tokyo,Triangle Staff,7187.0,9927,10,399.0,2543,15.940856341986812
Rosario + Vampire Capu2,6.9,"Comedy, Fantasy, Romance, Ecchi",TV,"GDH, Yomiko Advertising, Happinet Pictures, Shueisha, Sotsu Music Publishing",Gonzo,4399.0,520,1106,250387.0,407779,76.20583642937568
Toradora!,8.08,"Drama, Romance",TV,"Genco, Starchild Records, Magic Capsule, Yomiuri Advertising, TV Tokyo Music",J.C.Staff,487.0,22,55666,1330877.0,2121399,93.09075930650367
Galactic Cyclone Braiger,6.77,"Action, Adventure, Sci-Fi",TV,Kokusai Eigasha,Toei Animation,4987.0,9978,13,546.0,2501,19.442174675094932
