English name,Score,Genres,Type,Producers,Studios,Rank,Popularity,Favorites,Scored By,Members,Weighted_Score
Teekyu 2 Specials,6.47,"Comedy, Sports",Special,Earth Star Entertainment,MAPPA,6538.0,5969,0,5830.0,10272,40.89014215706525
Is the Order a Rabbit?,7.49,Slice of Life,TV,"Frontier Works, Sotsu, Magic Capsule, Showgate, Houbunsha, NBCUniversal Entertainment Japan, RAY",White Fox,1742.0,987,2144,88887.0,226805,67.39985152990874
One Week Friends,7.53,"Comedy, Slice of Life",TV,"Nihon Ad Systems, Pony Canyon, DAX Production, TOHO animation",Brain's Base,1616.0,726,1229,143697.0,306197,71.88475355433773
Mushi-shi: The Shadow that Devours the Sun,8.54,"Adventure, Mystery, Slice of Life, Supernatural",Special,"Aniplex, Kodansha, Delfi Sound",Artland,104.0,1558,181,64456.0,133534,65.64353174344978
Psycho-Pass: The Movie,7.71,"Action, Sci-Fi",Movie,"Dentsu, Fuji TV, Nitroplus, Sony Music Entertainment, TOHO animation, Kyoraku Industrial Holdings",Production I.G,1127.0,854,537,132719.0,262211,71.36900886749223
Tokyo ESP,6.54,"Action, Comedy, Sci-Fi, Supernatural",TV,"Lantis, Kadokawa Shoten, Rakuonsha, KlockWorx, Tokyo MX",Xebec,6160.0,1311,188,72361.0,166761,64.24783563909673
Crayon Shin-chan: Serious Battle! Robot Dad Strikes Back,7.35,"Award Winning, Comedy, Sci-Fi",Movie,"Futabasha, Imagine",Shin-Ei Animation,2266.0,7622,14,3320.0,5608,36.868380635844304
The Kawai Complex Guide to Manors and Hostel Behavior,7.67,Slice of Life,TV,TBS,Brain's Base,1200.0,577,2195,189031.0,373798,74.58701109451944
Unbreakable Machine-Doll Special,6.71,"Action, Fantasy, Ecchi",Special,"Genco, Movic, AT-X",Lerche,5294.0,3445,20,16221.0,36871,50.67592611331365
Brynhildr in the Darkness,6.86,"Drama, Mystery, Sci-Fi",TV,VAP,Arms,4574.0,664,1120,164575.0,328671,72.27696089071851
Encouragement of Climb Season 2,7.56,"Adventure, Comedy, Slice of Life",TV,"Earth Star Entertainment, Tokyo MX, Good Smile Company, Yomiuri TV Enterprise, Jinnan Studio, Radio Osaka, TSUTAYA, Ashisuto",8bit,1529.0,3548,156,14645.0,34473,50.83350745001674
Buddy Complex,7.12,"Action, Sci-Fi",TV,"Bandai Visual, Lantis, Bandai Namco Live Creative, Bandai Namco Games, Banpresto, Bandai Channel",Sunrise,3457.0,2139,222,39658.0,85456,59.479100123033774
Uta no Prince Sama Revolutions,7.01,"Comedy, Romance",TV,"Showgate, King Records",A-1 Pictures,3928.0,2666,220,24779.0,58706,54.99237613174069
Persona 3 the Movie: #2 Midsummer Knight's Dream,7.61,"Action, Fantasy, Supernatural",Movie,"Aniplex, Atlus",A-1 Pictures,1370.0,2171,208,44182.0,82306,61.09126061160545
Beyblade: Shogun Steel Specials,6.01,"Adventure, Sports",Special,"TV Tokyo, d-rights",SynergySP,8772.0,8796,0,1462.0,3780,27.43658430771839
KanColle: Kantai Collection,6.83,"Action, Sci-Fi, Slice of Life",TV,"Movic, KlockWorx, flying DOG, DMM.com, Kadokawa Media House, Kadokawa",Diomedéa,4720.0,1045,1353,90283.0,214924,66.69192602382051
When Marnie Was There,8.05,"Drama, Mystery",Movie,"Dentsu, Toho, Disney Platform Distribution, Nippon Television Network",Studio Ghibli,525.0,806,2473,154004.0,281136,73.14109793289549
Nanana's Buried Treasure,7.13,"Adventure, Comedy, Mystery, Supernatural",TV,"Aniplex, Dentsu, Movic, Fuji TV, BIGLOBE, Kyoraku Industrial Holdings, Kadokawa",A-1 Pictures,3422.0,959,359,98390.0,233749,67.88296164917314
Kamigami no Asobi,7.01,"Fantasy, Romance",TV,"Frontier Works, Broccoli, Movic, Showgate",Brain's Base,3947.0,1487,754,63948.0,142498,63.747355921948966
Symphogear GX,7.44,"Action, Sci-Fi",TV,"Starchild Records, Memory-Tech, Bushiroad, MAGES., Kinyosha",Satelight,1937.0,3046,373,20993.0,45629,54.010988996317714
MEKAKUCITY ACTORS,7.03,"Sci-Fi, Supernatural",TV,"Aniplex, 1st PLACE, Tokyo MX, BS11",Shaft,3840.0,486,3684,200755.0,433300,74.33808838016085
Yu-Gi-Oh! Arc-V,6.7,"Action, Fantasy",TV,"TV Tokyo, Nihon Ad Systems, Marvelous AQL, Konami Cross Media NY",Gallop,5336.0,2596,485,32340.0,61892,57.03391778719846
Planet:Valkyrie,5.51,Action,ONA,"Lantis, Infinite",P.A. Works,10756.0,11008,1,523.0,1780,17.143723865598677
Kill la Kill Specials,7.68,"Action, Comedy, Ecchi",Special,"Aniplex, Kadokawa Shoten",Trigger,1187.0,1134,283,111161.0,195361,69.69614702311097
Non Non Biyori: We're Going to Okinawa,7.64,Slice of Life,OVA,Media Factory,SILVER LINK.,1285.0,2556,48,35039.0,63632,58.98652219956995
Captain Earth,6.4,"Action, Romance, Sci-Fi",TV,"Avex Entertainment, Dentsu, Shochiku, Mainichi Broadcasting System, Bandai Namco Entertainment, Good Smile Company, A-Sketch",Bones,6890.0,2501,88,26411.0,66105,54.740684652575666
Hanayamata,7.32,"Comedy, Slice of Life",TV,"TV Tokyo, Avex Entertainment, Sotsu, Movic, AT-X, DIVE II Entertainment, Bandai Namco Games",Madhouse,2421.0,1837,380,39396.0,108686,59.67370968561179
Cardfight!! Vanguard Legion Mate,6.73,Action,TV,"Dentsu, Sotsu, Bushiroad",TMS Entertainment,5192.0,5048,36,7856.0,15563,44.00819870378293
Laughing Under the Clouds,7.48,"Action, Supernatural",TV,"VAP, Nippon Television Network",Doga Kobo,1786.0,1648,756,46131.0,125131,61.33077886972582
The Prince of Tennis II vs Genius10,7.59,Sports,OVA,Nihon Ad Systems,"Production I.G, M.S.C",1409.0,4781,48,8137.0,18122,45.4432230884862
Daimidaler: Prince vs. Penguin Empire,6.13,"Action, Comedy, Ecchi",TV,"Genco, Lantis, AT-X, Showgate, Kadokawa",TNK,8188.0,2456,101,25172.0,68398,53.89894829278416
Rage of Bahamut: Genesis,7.62,"Action, Adventure, Fantasy",TV,"NBCUniversal Entertainment Japan, Cygames",MAPPA,1342.0,533,1664,176666.0,400576,73.90189904356855
In Search of the Lost Future,6.73,"Drama, Romance, Sci-Fi",TV,"Starchild Records, GANSIS",feel.,5175.0,2067,181,33261.0,90485,57.334484596768405
Hanamonogatari,7.93,"Comedy, Mystery, Supernatural",TV,"Aniplex, Kodansha",Shaft,684.0,513,1066,232755.0,414442,76.81633344068581
The Comic Artist and His Assistants,7.1,"Comedy, Ecchi",TV,"Lantis, Magic Capsule, Showgate",Zexcs,3555.0,827,465,128254.0,271735,70.29185005653201
Hi Score Girl,7.77,Comedy,TV,"Square Enix, Warner Bros. Japan, KlockWorx, Good Smile Company",J.C.Staff,979.0,910,2732,129558.0,246937,71.21799239300002
Sword Art Online II,6.7,"Action, Adventure, Fantasy, Romance",TV,"Aniplex, Genco, ASCII Media Works, Bandai Namco Games",A-1 Pictures,5331.0,35,9227,1287086.0,1902495,91.05231416539148
Mushi-shi: Next Passage Part 1,8.7,"Adventure, Mystery, Slice of Life, Supernatural",TV,"Aniplex, Kodansha, Delfi Sound",Artland,52.0,776,1523,113920.0,288271,71.07412462595775
Blue Spring Ride,7.64,Romance,TV,"Mainichi Broadcasting System, Movic, Sony Music Entertainment, TOHO animation, Shueisha, BS11, Animatic, Hakuhodo DY Media Partners, Sony PCL",Production I.G,1268.0,174,10090,476310.0,886912,83.08497780723972
Duel Masters Victory V3,5.65,"Action, Adventure, Comedy, Fantasy",TV,"TV Tokyo, Shogakukan-Shueisha Productions",Shogakukan Music & Digital Entertainment,10288.0,12130,2,301.0,1181,12.275840978503025
Fairy Tail Series 2,7.65,"Action, Adventure, Fantasy",TV,"TV Tokyo, Dentsu","A-1 Pictures, Bridge",1253.0,155,11878,537001.0,954070,84.20456323034567
Inari Kon Kon OVA,6.86,"Comedy, Romance, Supernatural",OVA,"DAX Production, flying DOG",Production IMS,4580.0,4086,10,13183.0,25815,48.965061782163865
The World is Still Beautiful,7.6,"Adventure, Fantasy, Romance",TV,"VAP, Hakusensha, Nippon Television Network",Pierrot,1385.0,736,1939,137969.0,302046,71.59456169836785
Inugami-san to Nekoyama-san,6.52,"Comedy, Girls Love",TV,"DAX Production, Dream Creation",Seven,6290.0,2282,114,36618.0,76902,57.92968066645993
Ping Pong the Animation,8.62,"Award Winning, Drama, Sports",TV,"Aniplex, Dentsu, Fuji TV, Kyoraku Industrial Holdings",Tatsunoko Production,75.0,575,15186,174992.0,374516,74.95267691881766
Black Butler: Book of Circus,8.07,"Action, Comedy, Mystery, Supernatural",TV,"Aniplex, Square Enix, Mainichi Broadcasting System, Movic, DeNA",A-1 Pictures,500.0,547,3509,205366.0,387301,75.8218475101409
Amagi Brilliant Park,7.46,"Comedy, Fantasy",TV,"Avex Entertainment, TBS, DAX Production, flying DOG, Mobcast",Kyoto Animation,1837.0,302,2587,341942.0,635353,79.80422890364675
Locodol,6.88,"Comedy, Slice of Life",TV,"TBS, DAX Production, Nippon Columbia, Overlap, Fuji Creative, Ichijinsha",feel.,4495.0,3075,75,16888.0,44942,51.279085990622626
Akame ga Kill!,7.47,"Action, Fantasy",TV,"Nihon Ad Systems, Sony Music Entertainment, TOHO animation, Q-Tec, Fields, Jinnan Studio",White Fox,1794.0,29,28168,1255681.0,1997680,91.82879723121982
Momokyun Sword,5.56,"Comedy, Fantasy, Ecchi",TV,flying DOG,"Project No.9, Tri-Slash",10570.0,3598,29,10372.0,33325,44.81025141685025
Free! - Eternal Summer,7.62,Sports,TV,"Lantis, Iwatobi High School Swimming Club, Asahi Broadcasting","Kyoto Animation, Animation Do",1326.0,524,2547,223800.0,405047,76.08578795510162
Fate/stay night [Unlimited Blade Works],8.19,"Action, Fantasy, Supernatural",TV,"Aniplex, Notes",ufotable,356.0,137,16063,648901.0,1024263,86.58234678387892
Tokyo Ghoul,7.79,"Action, Fantasy, Horror",TV,"Marvelous AQL, TC Entertainment, Shueisha",Pierrot,933.0,9,49098,1791023.0,2699241,95.49540985560083
The Prince and the White Horse,5.34,Adventure,OVA,Shinano Kikaku,Toei Animation,11250.0,15021,0,130.0,489,4.009516639820729
Teekyu 3 Specials,6.46,"Comedy, Sports",Special,Earth Star Entertainment,MAPPA,6572.0,6191,2,5219.0,9429,39.853521923655904
Ronja the Robber's Daughter,7.07,Adventure,TV,"NHK, Dwango","Studio Ghibli, Polygon Pictures",3686.0,3861,71,6652.0,29248,42.927091179888976
New Year Special: It's New Year's! 7 x 7 = 49 Nanas?,6.23,"Adventure, Comedy",Special,"TV Tokyo, Genco",A.C.G.T.,7733.0,13527,0,267.0,767,12.071502486579163
Broken Blade,7.25,"Action, Fantasy",TV,"Bandai Visual, Lantis, Showgate","Production I.G, Xebec",2769.0,2026,211,36477.0,92767,58.8740836124517
Hello Kitty: The Mystery of The Apple Forest,5.88,"Comedy, Mystery",TV,Sanrio,Asahi Production,9360.0,13616,1,183.0,744,8.05213617479238
Hello Kitty: Apple Forest and Parallel Town,6.01,"Comedy, Fantasy",TV,Sanrio,Asahi Production,8812.0,13697,1,160.0,725,7.014786128903608
Parasyte: The Maxim,8.34,"Action, Horror, Sci-Fi",TV,"VAP, Kodansha, Nippon Television Network, Forecast Communications",Madhouse,210.0,42,33548,1103538.0,1781551,91.65344784620625
Theatre of Darkness: Yamishibai 2,6.5,"Avant Garde, Horror, Supernatural",TV,TV Tokyo,ILCA,6362.0,2979,30,27588.0,47553,55.28648353682993
Blade & Soul,6.05,"Action, Adventure, Fantasy",TV,TBS,Gonzo,8606.0,1695,131,54403.0,120651,60.894537460817155
Space Brothers #0,7.57,"Comedy, Sci-Fi",Movie,"Aniplex, Dentsu, Yomiuri Telecasting, Warner Bros. Japan, Sony Music Entertainment, Nippon Television Network, Asahi Shimbun, Sapporo Television Broadcasting, Miyagi Television Broadcasting, Shizuoka Daiichi Television, Chukyo TV Broadcasting, Hiroshima Television, Fukuoka Broadcasting System",A-1 Pictures,1466.0,6915,5,1846.0,7198,31.720867770334216
World Break: Aria of Curse for a Holy Swordsman,6.78,"Action, Fantasy, Romance",TV,Sotsu,Diomedéa,4951.0,741,863,155903.0,300203,71.66875044447765
Terraformars,7.0,"Action, Horror, Sci-Fi",TV,"Warner Bros. Japan, SANZIGEN, Ultra Super Pictures, MAGES., Good Smile Company, Shueisha, Animatic",LIDENFILMS,3986.0,1002,629,113815.0,224644,69.05790646707908
Aldnoah.Zero,7.39,"Action, Sci-Fi",TV,"Aniplex, Movic, Nitroplus, Houbunsha, MAGES., Tokyo MX, Asahi Broadcasting, BS11","A-1 Pictures, TROYCA",2118.0,408,3535,277852.0,501400,77.80052017104647
Barakamon,8.38,Slice of Life,TV,"VAP, Nippon Television Network",Kinema Citrus,187.0,298,12576,328337.0,638276,80.50320741454637
The File of Young Kindaichi Returns,7.52,Mystery,TV,Yomiuri Telecasting,Toei Animation,1661.0,4793,60,7167.0,18001,44.185503656453086
The Garden of Sinners: Future Gospel - Manner Movie,6.07,Drama,Movie,Aniplex,ufotable,8544.0,6039,2,3939.0,10040,36.680192397821784
Invaders of the Rokujyoma!?,7.13,"Comedy, Supernatural",TV,"Genco, Showgate",SILVER LINK.,3422.0,1263,410,81895.0,175907,66.18841722641382
Blade Dance of the Elementalers,6.69,"Action, Comedy, Fantasy, Romance, Ecchi",TV,"Genco, Media Factory, Movic, AT-X, Showgate",TNK,5398.0,614,903,182159.0,354738,72.98266256495643
Valis: The Fantasm Soldier,5.52,"Action, Adventure, Fantasy",Special,Studio Fantasia,Sunrise,10711.0,13019,2,401.0,888,14.708559867852095
Hungry Zombie Francesca,5.43,"Comedy, Fantasy",TV,"Pony Canyon, Bandai Namco Games, Daiichikosho, HeART-BIT, Hokkaido Azmacy, Hokkaido Cultural Broadcasting, Teichiku Entertainment, Amuse",Telecom Animation Film,10994.0,6112,5,2121.0,9739,29.935167663455704
Samurai Jam -Bakumatsu Rock-,6.02,"Action, Comedy",TV,"Nihon Ad Systems, Marvelous AQL, NBCUniversal Entertainment Japan, TV Asahi Music",Studio Deen,8730.0,3852,46,10788.0,29317,45.907421677639526
Glasslip,5.42,"Romance, Supernatural",TV,"Sotsu, Lantis, Pony Canyon, Showgate, Infinite",P.A. Works,11032.0,1342,217,80202.0,163131,63.463268476346556
JINSEI -Life Consulting-,6.46,"Comedy, Slice of Life",TV,"VAP, Yomiuri Telecasting",feel.,6591.0,2426,66,24713.0,69447,54.21321315198928
Durarara!! x2 Shou,7.98,"Action, Mystery, Supernatural",TV,"Aniplex, Square Enix, Mainichi Broadcasting System, Movic, ASCII Media Works",Shuka,607.0,442,978,244017.0,468938,77.31072086810728
Sengoku BASARA: End of Judgement,6.85,Action,TV,"VAP, Nippon Television Network",Telecom Animation Film,4616.0,3920,31,11180.0,28177,47.429743729478666
Celestial Method,6.76,"Drama, Fantasy, Slice of Life",TV,"Bandai Visual, Sotsu, Lantis, Showgate, Good Smile Company, Infinite",Studio 3Hz,5035.0,1863,316,34231.0,106225,57.64101296356071
The Testament of Sister New Devil,6.71,"Action, Fantasy, Romance, Ecchi",TV,"Kadokawa Shoten, AT-X, Nippon Columbia, Kadokawa Pictures Japan, KlockWorx, Mobcast",Production IMS,5306.0,290,1999,355389.0,652424,79.1819639702819
Space Battleship Yamato 2199: Odyssey of the Celestial Ark,7.71,"Action, Award Winning, Drama, Sci-Fi",Movie,"Production I.G, Bandai Visual, OLM, AIC, Lantis, Shochiku, Bandai, Tohokushinsha Film Corporation, Bandai Namco Games, Voyager Entertainment",Xebec,1135.0,5336,14,5273.0,13525,41.58201715535947
GUGURE! KOKKURI-SAN,7.56,"Comedy, Supernatural",TV,"TV Tokyo, Frontier Works, Media Factory, Nihon Ad Systems, Sony Music Communications",TMS Entertainment,1497.0,1247,1035,78083.0,178161,66.28902150284945
Gundam Reconguista in G,5.85,"Action, Sci-Fi",TV,"Sotsu, Mainichi Broadcasting System, Tohokushinsha Film Corporation",Sunrise,9480.0,3790,86,12100.0,30317,46.70273771856103
Hello!! KINMOZA!,7.5,Comedy,TV,"Genco, flying DOG, Showgate",Studio Gokumi,1708.0,2273,249,36789.0,77465,59.26579707053231
Your Lie in April,8.65,"Drama, Romance",TV,"Aniplex, Dentsu, Kodansha, Fuji TV, Lawson HMV Entertainment, Kyoraku Industrial Holdings, Kansai Telecasting",A-1 Pictures,65.0,23,83560,1290329.0,2111376,93.43452884744151
Saekano: How to Raise a Boring Girlfriend,7.48,"Comedy, Romance, Ecchi",TV,"Aniplex, Dentsu, Fuji TV, Half H.P Studio, Cospa, Fujipacific Music, Good Smile Company, Kyoraku Industrial Holdings, Kansai Telecasting, Fujimi Shobo",A-1 Pictures,1770.0,301,4248,303187.0,635769,78.7181199217256
Genocidal Organ,7.12,Sci-Fi,Movie,Twin Engine,"Manglobe, Geno Studio",3465.0,3046,151,12274.0,45652,48.648832355007215
Psycho-Pass 2,7.4,"Action, Sci-Fi, Suspense",TV,"Production I.G, Dentsu, Fuji TV, Nitroplus, Sony Music Entertainment, TOHO animation, Kyoraku Industrial Holdings",Tatsunoko Production,2097.0,304,1468,339628.0,632310,79.6669517592018
Terror in Resonance,8.1,"Mystery, Suspense",TV,"Aniplex, Dentsu, Fuji TV, Tohokushinsha Film Corporation, Kyoraku Industrial Holdings",MAPPA,464.0,123,21515,594065.0,1117359,85.664977450777
Monthly Girls' Nozaki-kun,7.83,"Comedy, Romance",TV,"TV Tokyo, Frontier Works, Media Factory, AT-X, Sony Music Communications",Doga Kobo,858.0,167,10778,490907.0,896030,83.59057452395663
Lupin the Third: Jigen's Gravestone,7.81,"Action, Adventure, Drama",Movie,"TMS Entertainment, TMS Music",Telecom Animation Film,888.0,3938,88,12980.0,27897,50.01944084676711
A Journey to Hiroshima,5.89,"Drama, Slice of Life",OVA,Shinano Kikaku,Toei Animation,9344.0,14723,1,151.0,528,6.2946926113624055
Rail Wars!,6.39,"Action, Ecchi",TV,"Lantis, Pony Canyon, TBS",Passione,6941.0,1091,285,90958.0,205995,66.1457810877685
GARO: THE ANIMATION,7.35,"Action, Fantasy",TV,Tohokushinsha Film Corporation,MAPPA,2268.0,1491,448,50495.0,141725,62.00357384253554
Black Butler: Book of Murder,8.06,"Action, Comedy, Mystery, Supernatural",OVA,DeNA,A-1 Pictures,519.0,948,1102,116880.0,235905,70.60539761732426
Gargantia on the Verdurous Planet: Far Beyond the Voyage,7.35,"Action, Adventure, Sci-Fi",OVA,Bandai Visual,Production I.G,2294.0,3243,30,18711.0,40923,52.83592196153783
Log Horizon 2,7.57,"Action, Adventure, Fantasy",TV,NHK,Studio Deen,1452.0,332,1393,331935.0,594839,79.66511716303567
Argevollen,6.48,Action,TV,"Warner Bros. Japan, KlockWorx, Bushiroad, Showgate",Xebec,6500.0,3134,43,18178.0,43485,51.4056959930862
Space Dandy 2nd Season,8.26,"Comedy, Sci-Fi",TV,"Bandai Visual, flying DOG, Bandai Namco Entertainment",Bones,280.0,1355,1807,85952.0,161732,67.99343581013494
DRAMAtical Murder,6.05,"Action, Sci-Fi",TV,"Avex Entertainment, Nitroplus, DIVE II Entertainment",NAZ,8608.0,1339,592,72010.0,163327,63.48375986869568
The Two Princes,5.77,"Fantasy, Slice of Life",Movie,Shinano Kikaku,Toei Animation,9814.0,15602,0,110.0,429,3.183277480002249
The Snow Country Prince,5.41,Slice of Life,Movie,Shinano Kikaku,Toei Animation,11054.0,15581,0,130.0,431,4.1296100714812916
Re: Hamatora: Season 2,7.35,"Action, Mystery, Supernatural",TV,"TV Tokyo, Sotsu, AT-X, DAX Production, NAZ, DIVE II Entertainment, Avex Pictures, Q-Tec, Shueisha, Toy's Factory",Lerche,2289.0,1321,411,76983.0,165436,65.89786034510261
Paradise of Innocence,5.87,"Comedy, Romance, Ecchi",OVA,"Hakusensha, Soft Garage","Seven, Office No. 8",9423.0,4127,42,9534.0,25327,44.53332220120697
"Waiting in the Summer: In Our Last Summer of High School, We Await That Summer",7.17,"Drama, Romance, Sci-Fi",Special,Geneon Universal Entertainment,J.C.Staff,3173.0,2962,37,25523.0,47984,55.473967301357256
Witch Craft Works Specials,6.73,Comedy,Special,Lantis,J.C.Staff,5179.0,5093,11,4398.0,15161,38.65113139638513
The Princess and the Moon,5.08,Fantasy,Movie,"Shin-Ei Animation, Shinano Kikaku",Toei Animation,11809.0,14805,0,183.0,517,6.702978309049346
The Lazy Egg,7.03,"Comedy, Gourmet",TV,Sanrio,Gathering,3883.0,5552,60,2409.0,12251,33.495482632484425
Ai-Mai-Mi Mousou Catastrophe,5.95,"Comedy, Slice of Life",TV,"Dream Creation, Studio CHANT",Seven,9079.0,5494,4,6422.0,12681,41.009520264147724
Age 12,6.23,Romance,OVA,Half H.P Studio,SynergySP,7707.0,5304,18,5865.0,13761,40.59636011848123
THE IDOLM@STER CINDERELLA GIRLS,7.16,"Comedy, Drama",TV,"Aniplex, Half H.P Studio, Nippon Columbia, Bandai Namco Games, Anime Consortium Japan, Cygames",A-1 Pictures,3215.0,2337,471,28793.0,73963,56.57431665941581
Ninja Slayer From Animation,6.6,Action,ONA,"Movic, KlockWorx, Ultra Super Pictures, Grooove, Good Smile Company, famima.com, King Records, Fields, QREAZY",Trigger,5839.0,3196,201,12696.0,42117,48.26067004533512
Non Non Biyori Repeat,8.18,Slice of Life,TV,"TV Tokyo, Lantis",SILVER LINK.,375.0,1145,1285,97067.0,193460,69.02659351938
Wolf Girl & Black Prince,7.04,"Comedy, Romance",TV,"VAP, Yomiuri Telecasting, Nippon Television Network",TYO Animations,3811.0,454,1861,247007.0,454422,76.26582123953364
The Garden of Sinners: Manner Movies,6.4,"Action, Comedy",Movie,Aniplex,ufotable,6906.0,5520,25,5180.0,12478,39.698090242700594
The Seven Deadly Sins,7.67,"Action, Adventure, Fantasy",TV,"Aniplex, Dentsu, Mainichi Broadcasting System, Kodansha, Movic",A-1 Pictures,1216.0,31,19160,1291643.0,1974171,92.33354360634127
Attack on Titan: Crimson Bow and Arrow,7.74,"Action, Drama",Movie,"Production I.G, Dentsu, Mainichi Broadcasting System, Pony Canyon, Kodansha, Pony Canyon Enterprise",Wit Studio,1052.0,1740,197,48540.0,116318,62.116375624225704
Attack on Titan: Wings of Freedom,7.85,"Action, Drama",Movie,"Production I.G, Dentsu, Mainichi Broadcasting System, Pony Canyon, Kodansha, Pony Canyon Enterprise",Wit Studio,832.0,1688,222,46923.0,121251,61.93382433341993
Hi☆sCoool! SeHa Girls,6.48,Comedy,TV,Sega,TMS Entertainment,6473.0,5675,47,5164.0,11665,39.784235972935605
My Teen Romantic Comedy SNAFU TOO!,8.21,"Comedy, Romance",TV,"TBS, Marvelous AQL, NBCUniversal Entertainment Japan",feel.,332.0,140,15731,658913.0,1016386,86.7462630263385
Magimoji Rurumo,6.83,"Comedy, Fantasy, Ecchi",TV,"Pony Canyon, Kodansha, AT-X, DAX Production, Bushiroad, Eswood",J.C.Staff,4725.0,2362,84,31021.0,72372,56.82685007231162
Lance N' Masques,5.49,Fantasy,TV,"Pony Canyon, TBS, DAX Production, KlockWorx, Docomo Anime Store, NichiNare",Studio Gokumi,10807.0,2934,19,20835.0,49209,51.13447970631275
Denki-gai,7.19,Comedy,TV,"Sotsu, Pony Canyon, DAX Production, Comic Umenohone, Mobcast",Shin-Ei Animation,3083.0,1628,276,51739.0,127402,62.0250753295283
Persona 4 the Golden ANIMATION,6.62,"Adventure, Mystery, Sci-Fi, Supernatural",TV,"Aniplex, Yomiko Advertising, Mainichi Broadcasting System, Movic, Sega",A-1 Pictures,5751.0,2090,150,39544.0,89092,58.78013145093926
Anti-Magic Academy: The 35th Test Platoon,6.82,"Action, Fantasy, Romance, Ecchi",TV,"KlockWorx, MAGES., Glovision, Kadokawa Media House, Kadokawa, Heiwa",SILVER LINK.,4755.0,733,471,144437.0,303513,71.01764100564009
Blue Spring Ride OVA,7.58,Romance,OVA,TOHO animation,Production I.G,1427.0,1481,246,77655.0,142846,66.26266237545217
Merman in my Tub,6.96,"Comedy, Fantasy",TV,Media Factory,Asahi Production,4149.0,1814,390,56828.0,110416,62.591202206166344
Chaika -The Coffin Princess- Avenging Battle,7.17,"Action, Adventure, Fantasy, Romance",TV,"Kadokawa Shoten, flying DOG, Fujimi Shobo",Bones,3190.0,1115,196,107428.0,200466,68.7461680589526
World Trigger,7.58,"Action, Sci-Fi",TV,TV Asahi,Toei Animation,1420.0,531,2693,139105.0,401101,71.64595154923553
Kuroko's Basketball 3,8.3,Sports,TV,"Bandai Visual, Lantis, Nihon Ad Systems, Banpresto, Shueisha, BS11",Production I.G,245.0,244,5023,450910.0,728725,83.3440687509425
Blood Blockade Battlefront,7.6,"Action, Comedy, Fantasy",TV,"Nihon Ad Systems, Mainichi Broadcasting System, TOHO animation, Shueisha, Toy's Factory, Sony PCL",Bones,1376.0,188,7590,374426.0,840932,80.81398606570447
Lord Marksman and Vanadis,7.12,"Adventure, Fantasy, Romance, Ecchi",TV,"Media Factory, Movic",Satelight,3431.0,639,992,173920.0,344419,73.13050114885569
Ane Log: Big Sister Moyako's Never-ending Monologue,6.03,"Comedy, Ecchi",OVA,Shogakukan-Shueisha Productions,Brain's Base,8679.0,3180,51,15190.0,42378,49.082789299953774
Persona 3 the Movie: #3 Falling Down,7.6,"Action, Fantasy, Supernatural",Movie,"Aniplex, Atlus",A-1 Pictures,1382.0,2374,213,34945.0,71872,58.91324017066878
"Yo-kai Watch the Movie: It's the Secret of Birth, Meow!",6.94,"Award Winning, Comedy, Supernatural",Movie,"GYAO!, BIGFACE",OLM,4231.0,7378,11,3627.0,6110,37.155032226436994
Gundam Build Fighters Try,7.2,"Action, Sci-Fi",TV,"TV Tokyo, Sotsu",Sunrise,3020.0,3159,114,24171.0,42895,55.00992506872452
Gourmet Girl Graffiti,6.79,"Comedy, Gourmet, Slice of Life",TV,"TBS, Movic, flying DOG, Sony Music Communications, Houbunsha, Kadokawa",Shaft,4865.0,2254,150,28394.0,78265,55.9554819255418
Mushishi Path of Thorns,8.43,"Adventure, Mystery, Slice of Life, Supernatural",Special,"Aniplex, Kodansha, Delfi Sound",Artland,158.0,1976,117,47459.0,96849,62.69697712968264
Brynhildr in the Darkness Special,6.59,"Comedy, Sci-Fi, Ecchi",Special,VAP,Arms,5872.0,3177,24,22190.0,42422,53.40276264400286
Mushi-shi: Next Passage Part 2,8.73,"Adventure, Mystery, Slice of Life, Supernatural",TV,"Aniplex, Kodansha, Delfi Sound",Artland,44.0,880,1402,101319.0,254587,70.02341991466064
High School DxD BorN,7.42,"Action, Comedy, Romance, Ecchi",TV,"Genco, Lantis, Movic, AT-X, Memory-Tech, Showgate, Fujimi Shobo, Kadokawa",TNK,2016.0,228,3868,492795.0,772849,83.12935724409289
Gonna be the Twin-Tail!!,6.43,"Action, Comedy, Fantasy, Romance",TV,"Pony Canyon, TBS, DAX Production, Daiichikosho, Shogakukan",Production IMS,6703.0,1390,522,64524.0,155780,63.03264058457775
Riddle Story of Devil: Who's the Winner?,6.51,"Action, Comedy, Girls Love, Ecchi",Special,Pony Canyon,Diomedéa,6292.0,3318,32,19923.0,39384,52.2948049025889
School-Live!,7.62,"Horror, Mystery, Slice of Life, Suspense",TV,"Sotsu, Nitroplus, NBCUniversal Entertainment Japan",Lerche,1329.0,478,5342,211263.0,435975,75.5534271013325
Alice in Borderland,7.29,"Action, Supernatural, Suspense",OVA,Barnum Studio,"SILVER LINK., Connect",2560.0,2728,161,22469.0,56518,54.45036715905093
Assassination Classroom,8.09,"Action, Comedy",TV,"Dentsu, Studio Hibari, Fuji TV, DAX Production, BS Fuji, Avex Pictures, Shueisha",Lerche,468.0,34,28752,1132903.0,1914784,91.61491676543481
Girl Friend Beta,5.92,Slice of Life,TV,"TV Tokyo, VAP, Age Global Networks",SILVER LINK.,9212.0,3178,61,12890.0,42420,47.39662126172242
Unlimited Fafnir,6.18,"Fantasy, Romance",TV,"TBS, Kodansha, DAX Production, Nippon Columbia, Daiichikosho, RAY, Nichion, NichiNare",Diomedéa,7981.0,1405,161,72385.0,153448,63.72805038257165
Knights of Sidonia: Battle for Planet Nine,7.72,"Action, Sci-Fi",TV,"Starchild Records, Mainichi Broadcasting System, Kodansha, Studio Mausu",Polygon Pictures,1092.0,1742,350,62375.0,116182,64.4082784883496
JOKER,6.93,"Adventure, Comedy, Mystery",TV,"Asatsu DK, Tokyo MX",Shin-Ei Animation,4266.0,5260,116,5286.0,14017,40.619841165280214
Love Live! The School Idol Movie,7.92,"Award Winning, Slice of Life",Movie,"Bandai Visual, Lantis, ASCII Media Works, Bushiroad, Graphinica, ILCA",Sunrise,695.0,1631,1199,72116.0,126997,65.98450044472203
Fate/Kaleid Liner Prisma Illya 2Wei! Shorts,6.81,"Comedy, Fantasy, Ecchi",Special,"Lantis, DAX Production",SILVER LINK.,4795.0,3175,22,20050.0,42573,52.76952042155991
