English name,Score,Genres,Type,Producers,Studios,Rank,Popularity,Favorites,Scored By,Members,Weighted_Score,Premiered Season,Premiered Year
Hello Kitty: Apple Forest and Parallel Town,6.01,"Comedy, Fantasy",TV,Sanrio,Asahi Production,8812.0,13697,1,160.0,725,3.0313217824798047,fall,2007
Parasyte: The Maxim,8.34,"Action, Horror, Sci-Fi",TV,"VAP, Kodansha, Nippon Television Network, Forecast Communications",Madhouse,210.0,42,33548,1103538.0,1781551,91.29588354607681,fall,2014
Theatre of Darkness: Yamishibai 2,6.5,"Avant Garde, Horror, Supernatural",TV,TV Tokyo,ILCA,6362.0,2979,30,27588.0,47553,53.370967174398494,summer,2014
Blade & Soul,6.05,"Action, Adventure, Fantasy",TV,TBS,Gonzo,8606.0,1695,131,54403.0,120651,59.21926878862595,spring,2014
World Break: Aria of Curse for a Holy Swordsman,6.78,"Action, Fantasy, Romance",TV,Sotsu,Diomedéa,4951.0,741,863,155903.0,300203,70.45504648235622,winter,2015
Terraformars,7.0,"Action, Horror, Sci-Fi",TV,"Warner Bros. Japan, SANZIGEN, Ultra Super Pictures, MAGES., Good Smile Company, Shueisha, Animatic",LIDENFILMS,3986.0,1002,629,113815.0,224644,67.73235457274274,fall,2014
Aldnoah.Zero,7.39,"Action, Sci-Fi",TV,"Aniplex, Movic, Nitroplus, Houbunsha, MAGES., Tokyo MX, Asahi Broadcasting, BS11","A-1 Pictures, TROYCA",2118.0,408,3535,277852.0,501400,76.84949975902289,summer,2014
Barakamon,8.38,Slice of Life,TV,"VAP, Nippon Television Network",Kinema Citrus,187.0,298,12576,328337.0,638276,79.66796947831448,summer,2014
The File of Young Kindaichi Returns,7.52,Mystery,TV,Yomiuri Telecasting,Toei Animation,1661.0,4793,60,7167.0,18001,41.79442396816695,spring,2014
Invaders of the Rokujyoma!?,7.13,"Comedy, Supernatural",TV,"Genco, Showgate",SILVER LINK.,3422.0,1263,410,81895.0,175907,64.73993709857916,summer,2014
Blade Dance of the Elementalers,6.69,"Action, Comedy, Fantasy, Romance, Ecchi",TV,"Genco, Media Factory, Movic, AT-X, Showgate",TNK,5398.0,614,903,182159.0,354738,71.82524628415945,summer,2014
Hungry Zombie Francesca,5.43,"Comedy, Fantasy",TV,"Pony Canyon, Bandai Namco Games, Daiichikosho, HeART-BIT, Hokkaido Azmacy, Hokkaido Cultural Broadcasting, Teichiku Entertainment, Amuse",Telecom Animation Film,10994.0,6112,5,2121.0,9739,26.933606985887142,summer,2014
Samurai Jam -Bakumatsu Rock-,6.02,"Action, Comedy",TV,"Nihon Ad Systems, Marvelous AQL, NBCUniversal Entertainment Japan, TV Asahi Music",Studio Deen,8730.0,3852,46,10788.0,29317,43.590108545984315,summer,2014
Glasslip,5.42,"Romance, Supernatural",TV,"Sotsu, Lantis, Pony Canyon, Showgate, Infinite",P.A. Works,11032.0,1342,217,80202.0,163131,61.89804362714531,summer,2014
JINSEI -Life Consulting-,6.46,"Comedy, Slice of Life",TV,"VAP, Yomiuri Telecasting",feel.,6591.0,2426,66,24713.0,69447,52.251718142694564,summer,2014
Durarara!! x2 Shou,7.98,"Action, Mystery, Supernatural",TV,"Aniplex, Square Enix, Mainichi Broadcasting System, Movic, ASCII Media Works",Shuka,607.0,442,978,244017.0,468938,76.3387175709675,winter,2015
Sengoku BASARA: End of Judgement,6.85,Action,TV,"VAP, Nippon Television Network",Telecom Animation Film,4616.0,3920,31,11180.0,28177,45.177646510814554,summer,2014
Celestial Method,6.76,"Drama, Fantasy, Slice of Life",TV,"Bandai Visual, Sotsu, Lantis, Showgate, Good Smile Company, Infinite",Studio 3Hz,5035.0,1863,316,34231.0,106225,55.82636407923165,fall,2014
The Testament of Sister New Devil,6.71,"Action, Fantasy, Romance, Ecchi",TV,"Kadokawa Shoten, AT-X, Nippon Columbia, Kadokawa Pictures Japan, KlockWorx, Mobcast",Production IMS,5306.0,290,1999,355389.0,652424,78.29012428056619,winter,2015
GUGURE! KOKKURI-SAN,7.56,"Comedy, Supernatural",TV,"TV Tokyo, Frontier Works, Media Factory, Nihon Ad Systems, Sony Music Communications",TMS Entertainment,1497.0,1247,1035,78083.0,178161,64.84485123818115,fall,2014
Gundam Reconguista in G,5.85,"Action, Sci-Fi",TV,"Sotsu, Mainichi Broadcasting System, Tohokushinsha Film Corporation",Sunrise,9480.0,3790,86,12100.0,30317,44.41949573608382,fall,2014
Hello!! KINMOZA!,7.5,Comedy,TV,"Genco, flying DOG, Showgate",Studio Gokumi,1708.0,2273,249,36789.0,77465,57.520753549156225,spring,2015
Your Lie in April,8.65,"Drama, Romance",TV,"Aniplex, Dentsu, Kodansha, Fuji TV, Lawson HMV Entertainment, Kyoraku Industrial Holdings, Kansai Telecasting",A-1 Pictures,65.0,23,83560,1290329.0,2111376,93.15326563187321,fall,2014
Saekano: How to Raise a Boring Girlfriend,7.48,"Comedy, Romance, Ecchi",TV,"Aniplex, Dentsu, Fuji TV, Half H.P Studio, Cospa, Fujipacific Music, Good Smile Company, Kyoraku Industrial Holdings, Kansai Telecasting, Fujimi Shobo",A-1 Pictures,1770.0,301,4248,303187.0,635769,77.8064092637903,winter,2015
Psycho-Pass 2,7.4,"Action, Sci-Fi, Suspense",TV,"Production I.G, Dentsu, Fuji TV, Nitroplus, Sony Music Entertainment, TOHO animation, Kyoraku Industrial Holdings",Tatsunoko Production,2097.0,304,1468,339628.0,632310,78.79588883049124,fall,2014
Terror in Resonance,8.1,"Mystery, Suspense",TV,"Aniplex, Dentsu, Fuji TV, Tohokushinsha Film Corporation, Kyoraku Industrial Holdings",MAPPA,464.0,123,21515,594065.0,1117359,85.050868509659,summer,2014
Monthly Girls' Nozaki-kun,7.83,"Comedy, Romance",TV,"TV Tokyo, Frontier Works, Media Factory, AT-X, Sony Music Communications",Doga Kobo,858.0,167,10778,490907.0,896030,82.88759865706524,summer,2014
Rail Wars!,6.39,"Action, Ecchi",TV,"Lantis, Pony Canyon, TBS",Passione,6941.0,1091,285,90958.0,205995,64.69547443794082,summer,2014
GARO: THE ANIMATION,7.35,"Action, Fantasy",TV,Tohokushinsha Film Corporation,MAPPA,2268.0,1491,448,50495.0,141725,60.375816023968724,fall,2014
Log Horizon 2,7.57,"Action, Adventure, Fantasy",TV,NHK,Studio Deen,1452.0,332,1393,331935.0,594839,78.79397564066367,fall,2014
Argevollen,6.48,Action,TV,"Warner Bros. Japan, KlockWorx, Bushiroad, Showgate",Xebec,6500.0,3134,43,18178.0,43485,49.323927619469636,summer,2014
Space Dandy 2nd Season,8.26,"Comedy, Sci-Fi",TV,"Bandai Visual, flying DOG, Bandai Namco Entertainment",Bones,280.0,1355,1807,85952.0,161732,66.622282247176,summer,2014
DRAMAtical Murder,6.05,"Action, Sci-Fi",TV,"Avex Entertainment, Nitroplus, DIVE II Entertainment",NAZ,8608.0,1339,592,72010.0,163327,61.919412865846915,summer,2014
Re: Hamatora: Season 2,7.35,"Action, Mystery, Supernatural",TV,"TV Tokyo, Sotsu, AT-X, DAX Production, NAZ, DIVE II Entertainment, Avex Pictures, Q-Tec, Shueisha, Toy's Factory",Lerche,2289.0,1321,411,76983.0,165436,64.43693282989179,summer,2014
The Lazy Egg,7.03,"Comedy, Gourmet",TV,Sanrio,Gathering,3883.0,5552,60,2409.0,12251,30.64644499756677,spring,2014
Ai-Mai-Mi Mousou Catastrophe,5.95,"Comedy, Slice of Life",TV,"Dream Creation, Studio CHANT",Seven,9079.0,5494,4,6422.0,12681,38.48238220613389,summer,2014
THE IDOLM@STER CINDERELLA GIRLS,7.16,"Comedy, Drama",TV,"Aniplex, Half H.P Studio, Nippon Columbia, Bandai Namco Games, Anime Consortium Japan, Cygames",A-1 Pictures,3215.0,2337,471,28793.0,73963,54.71397076026982,winter,2015
Non Non Biyori Repeat,8.18,Slice of Life,TV,"TV Tokyo, Lantis",SILVER LINK.,375.0,1145,1285,97067.0,193460,67.69970018584546,summer,2015
Wolf Girl & Black Prince,7.04,"Comedy, Romance",TV,"VAP, Yomiuri Telecasting, Nippon Television Network",TYO Animations,3811.0,454,1861,247007.0,454422,75.24905469195079,fall,2014
The Seven Deadly Sins,7.67,"Action, Adventure, Fantasy",TV,"Aniplex, Dentsu, Mainichi Broadcasting System, Kodansha, Movic",A-1 Pictures,1216.0,31,19160,1291643.0,1974171,92.0051144460891,fall,2014
Hi☆sCoool! SeHa Girls,6.48,Comedy,TV,Sega,TMS Entertainment,6473.0,5675,47,5164.0,11665,37.20460702862836,fall,2014
My Teen Romantic Comedy SNAFU TOO!,8.21,"Comedy, Romance",TV,"TBS, Marvelous AQL, NBCUniversal Entertainment Japan",feel.,332.0,140,15731,658913.0,1016386,86.17847610093926,spring,2015
Magimoji Rurumo,6.83,"Comedy, Fantasy, Ecchi",TV,"Pony Canyon, Kodansha, AT-X, DAX Production, Bushiroad, Eswood",J.C.Staff,4725.0,2362,84,31021.0,72372,54.977322644239386,summer,2014
Lance N' Masques,5.49,Fantasy,TV,"Pony Canyon, TBS, DAX Production, KlockWorx, Docomo Anime Store, NichiNare",Studio Gokumi,10807.0,2934,19,20835.0,49209,49.04109249176919,fall,2015
Denki-gai,7.19,Comedy,TV,"Sotsu, Pony Canyon, DAX Production, Comic Umenohone, Mobcast",Shin-Ei Animation,3083.0,1628,276,51739.0,127402,60.39823862952717,fall,2014
Persona 4 the Golden ANIMATION,6.62,"Adventure, Mystery, Sci-Fi, Supernatural",TV,"Aniplex, Yomiko Advertising, Mainichi Broadcasting System, Movic, Sega",A-1 Pictures,5751.0,2090,150,39544.0,89092,57.01428213045392,summer,2014
Anti-Magic Academy: The 35th Test Platoon,6.82,"Action, Fantasy, Romance, Ecchi",TV,"KlockWorx, MAGES., Glovision, Kadokawa Media House, Kadokawa, Heiwa",SILVER LINK.,4755.0,733,471,144437.0,303513,69.77604367072044,fall,2015
Merman in my Tub,6.96,"Comedy, Fantasy",TV,Media Factory,Asahi Production,4149.0,1814,390,56828.0,110416,60.98861824630266,fall,2014
Chaika -The Coffin Princess- Avenging Battle,7.17,"Action, Adventure, Fantasy, Romance",TV,"Kadokawa Shoten, flying DOG, Fujimi Shobo",Bones,3190.0,1115,196,107428.0,200466,67.40726136569195,fall,2014
World Trigger,7.58,"Action, Sci-Fi",TV,TV Asahi,Toei Animation,1420.0,531,2693,139105.0,401101,70.43127088788899,fall,2014
Kuroko's Basketball 3,8.3,Sports,TV,"Bandai Visual, Lantis, Nihon Ad Systems, Banpresto, Shueisha, BS11",Production I.G,245.0,244,5023,450910.0,728725,82.63053263562975,winter,2015
Blood Blockade Battlefront,7.6,"Action, Comedy, Fantasy",TV,"Nihon Ad Systems, Mainichi Broadcasting System, TOHO animation, Shueisha, Toy's Factory, Sony PCL",Bones,1376.0,188,7590,374426.0,840932,79.99206181263767,spring,2015
Lord Marksman and Vanadis,7.12,"Adventure, Fantasy, Romance, Ecchi",TV,"Media Factory, Movic",Satelight,3431.0,639,992,173920.0,344419,71.97941823767168,fall,2014
Gundam Build Fighters Try,7.2,"Action, Sci-Fi",TV,"TV Tokyo, Sotsu",Sunrise,3020.0,3159,114,24171.0,42895,53.082561007594165,fall,2014
Gourmet Girl Graffiti,6.79,"Comedy, Gourmet, Slice of Life",TV,"TBS, Movic, flying DOG, Sony Music Communications, Houbunsha, Kadokawa",Shaft,4865.0,2254,150,28394.0,78265,54.06862529424722,winter,2015
Mushi-shi: Next Passage Part 2,8.73,"Adventure, Mystery, Slice of Life, Supernatural",TV,"Aniplex, Kodansha, Delfi Sound",Artland,44.0,880,1402,101319.0,254587,68.73923038574044,fall,2014
High School DxD BorN,7.42,"Action, Comedy, Romance, Ecchi",TV,"Genco, Lantis, Movic, AT-X, Memory-Tech, Showgate, Fujimi Shobo, Kadokawa",TNK,2016.0,228,3868,492795.0,772849,82.40662293912509,spring,2015
Gonna be the Twin-Tail!!,6.43,"Action, Comedy, Fantasy, Romance",TV,"Pony Canyon, TBS, DAX Production, Daiichikosho, Shogakukan",Production IMS,6703.0,1390,522,64524.0,155780,61.44896773937776,fall,2014
School-Live!,7.62,"Horror, Mystery, Slice of Life, Suspense",TV,"Sotsu, Nitroplus, NBCUniversal Entertainment Japan",Lerche,1329.0,478,5342,211263.0,435975,74.5061417590727,summer,2015
Assassination Classroom,8.09,"Action, Comedy",TV,"Dentsu, Studio Hibari, Fuji TV, DAX Production, BS Fuji, Avex Pictures, Shueisha",Lerche,468.0,34,28752,1132903.0,1914784,91.25570180301088,winter,2015
Girl Friend Beta,5.92,Slice of Life,TV,"TV Tokyo, VAP, Age Global Networks",SILVER LINK.,9212.0,3178,61,12890.0,42420,45.143105084453175,fall,2014
Unlimited Fafnir,6.18,"Fantasy, Romance",TV,"TBS, Kodansha, DAX Production, Nippon Columbia, Daiichikosho, RAY, Nichion, NichiNare",Diomedéa,7981.0,1405,161,72385.0,153448,62.17416872697201,winter,2015
Knights of Sidonia: Battle for Planet Nine,7.72,"Action, Sci-Fi",TV,"Starchild Records, Mainichi Broadcasting System, Kodansha, Studio Mausu",Polygon Pictures,1092.0,1742,350,62375.0,116182,62.88353764228294,spring,2015
JOKER,6.93,"Adventure, Comedy, Mystery",TV,"Asatsu DK, Tokyo MX",Shin-Ei Animation,4266.0,5260,116,5286.0,14017,38.076009347772136,fall,2014
Yona of the Dawn,8.03,"Action, Adventure, Fantasy, Romance",TV,"VAP, Hakusensha, AT-X, Delfi Sound, Marvelous AQL, Tokyo MX, Age Global Networks, Docomo Anime Store, Top-Insight International",Pierrot,544.0,200,15560,398642.0,815285,81.12558442934478,fall,2014
Shomin Sample,6.69,"Comedy, Romance, Ecchi",TV,"Sotsu, AT-X, Memory-Tech, Showgate, Happinet Pictures, BS Fuji, MAGES., Contents Seed, Ichijinsha",SILVER LINK.,5392.0,831,438,129658.0,269888,68.55120000064996,fall,2015
Trinity Seven,7.06,"Action, Comedy, Fantasy, Romance, Ecchi",TV,"TV Tokyo, Sotsu, Kadokawa Shoten, AT-X, Studio Mausu, Avex Pictures, Q-Tec, Docomo Anime Store, DeNA",Seven Arcs Pictures,3713.0,204,3768,446740.0,810893,80.98280354137971,fall,2014
When Supernatural Battles Became Commonplace,7.06,"Comedy, Supernatural",TV,"TV Tokyo, Sotsu, Half H.P Studio, Ultra Super Pictures, DIVE II Entertainment, Avex Pictures",Trigger,3739.0,517,899,192219.0,409649,72.8613185405825,fall,2014
Gangsta.,7.41,"Action, Drama",TV,"Bandai Visual, Frontier Works, Lantis, DAX Production, Tokyo MX",Manglobe,2032.0,360,3622,270478.0,556697,76.6164975894467,summer,2015
Sky Wizards Academy,6.32,"Action, Drama, Fantasy",TV,"flying DOG, Kadokawa",Diomedéa,7286.0,898,333,123804.0,249764,67.55838074024047,summer,2015
Absolute Duo,6.43,"Action, Fantasy, Romance, Ecchi",TV,"Media Factory, Half H.P Studio, AT-X, feng, Showgate, Kadokawa",8bit,6726.0,377,1481,305709.0,537788,76.4295479730346,winter,2015
Isuca,5.98,"Action, Comedy, Romance, Supernatural, Ecchi",TV,"Kadokawa Shoten, AT-X, DAX Production, KlockWorx, MAGES.",Arms,8954.0,1472,97,66199.0,144370,60.997066630700594,winter,2015
Yuki Yuna is a Hero,7.38,"Drama, Fantasy",TV,"Dentsu, Mainichi Broadcasting System, Pony Canyon, Movic, KlockWorx",Studio Gokumi,2173.0,1433,1310,55375.0,149573,61.30345758258778,fall,2014
Junjo Romantica 3,7.62,"Boys Love, Comedy, Drama, Romance",TV,"Frontier Works, Lantis, Kadokawa Shoten, Romantica club !!",Studio Deen,1332.0,1725,495,61490.0,117849,62.62036606615737,summer,2015
Kamisama Kiss Season 2,8.21,"Comedy, Fantasy, Romance",TV,"Dentsu, Sotsu",TMS Entertainment,336.0,554,2921,206221.0,383764,74.99170388277126,winter,2015
Cross Ange: Rondo of Angel and Dragon,7.39,"Action, Sci-Fi",TV,"Starchild Records, Bandai Namco Live Creative, Bandai Namco Games, Docomo Anime Store, Fields, Bandai Channel",Sunrise,2122.0,1127,1650,81954.0,196954,65.09178951034751,fall,2014
Attack on Titan Season 2,8.5,"Action, Drama, Suspense",TV,"Production I.G, Dentsu, Mainichi Broadcasting System, Pony Canyon, Kodansha, Techno Sound, Pony Canyon Enterprise",Wit Studio,128.0,12,20899,1761316.0,2566796,95.98135463905909,spring,2017
Shirobako,8.28,"Award Winning, Comedy, Drama",TV,"Sotsu, Movic, Warner Bros. Japan, KlockWorx, Showgate, Infinite, Imagine",P.A. Works,261.0,489,6199,138671.0,431025,71.25180500273807,fall,2014
RE-KAN!,6.75,"Comedy, Supernatural",TV,"Pierrot, TBS, DAX Production, chara-ani.com, Houbunsha, Tokuma Japan, Docomo Anime Store, RAY",Pierrot Plus,5094.0,2651,64,24012.0,59441,52.397493082033826,spring,2015
The Rolling Girls,6.59,"Action, Adventure, Slice of Life",TV,"Dentsu, Shochiku, Mainichi Broadcasting System, Pony Canyon, Movic",Wit Studio,5894.0,2109,201,27654.0,87793,53.526402987953254,winter,2015
Wagnaria!!3,7.96,"Comedy, Romance",TV,Aniplex,A-1 Pictures,636.0,931,931,124885.0,240680,69.86386475524665,summer,2015
JoJo's Bizarre Adventure: Stardust Crusaders - Battle in Egypt,8.44,"Action, Adventure, Supernatural",TV,"Yomiko Advertising, Warner Bros. Japan, Kamikaze Douga, KlockWorx, Shueisha",David Production,152.0,132,19950,746262.0,1049227,87.64335971154911,winter,2015
Yurikuma Arashi,7.04,"Drama, Fantasy, Girls Love",TV,"Frontier Works, Media Factory, Mainichi Broadcasting System, Movic, Gentosha Comics",SILVER LINK.,3793.0,1943,729,33726.0,99313,56.07407569655712,winter,2015
Seraph of the End: Vampire Reign,7.49,"Action, Drama, Supernatural",TV,"Rakuonsha, NBCUniversal Entertainment Japan, Shueisha",Wit Studio,1755.0,94,13330,697841.0,1275952,85.84735033749689,spring,2015
I Can't Understand What My Husband Is Saying,7.29,"Comedy, Romance",TV,"DAX Production, Dream Creation",Seven,2551.0,643,814,180960.0,341534,72.5887779241905,fall,2014
The Disappearance of Nagato Yuki-chan,6.72,"Comedy, Romance",TV,"Lantis, Kadokawa Shoten, AT-X, KlockWorx, chara-ani.com, Tokyo MX, Sankyo Planning, Docomo Anime Store, Kadokawa Media House",Satelight,5237.0,1561,300,52278.0,133234,59.847018788822176,spring,2015
Teekyu 4,6.66,Comedy,TV,"DAX Production, Earth Star Entertainment",Millepensee,5554.0,4399,17,12170.0,21808,45.7238440069584,spring,2015
Maria the Virgin Witch,7.12,"Comedy, Fantasy, Romance",TV,"Bandai Visual, Lantis, Kodansha, I Will",Production I.G,3468.0,1431,232,63838.0,149921,62.32766289030465,winter,2015
Triage X,6.32,"Action, Adventure, Ecchi",TV,"DAX Production, Nippon Columbia, Kadokawa",Xebec,7251.0,1368,287,63513.0,158395,61.13071222876916,spring,2015
Fate/Kaleid Liner Prisma Illya 2Wei Herz!,7.17,"Action, Comedy, Fantasy, Slice of Life",TV,"Lantis, Kadokawa Shoten, AT-X, DAX Production, KlockWorx, Tokyo MX, Kadokawa Media House",SILVER LINK.,3183.0,1520,251,71970.0,138381,63.54971128458887,summer,2015
God Eater,7.2,"Action, Fantasy, Sci-Fi",TV,"Bandai Visual, Lantis, Anime Consortium Japan",ufotable,3020.0,383,1926,249083.0,531539,75.54607045545862,summer,2015
Aldnoah.Zero,6.92,"Action, Sci-Fi",TV,"Aniplex, Movic, Nitroplus, Houbunsha, MAGES., Tokyo MX, Asahi Broadcasting, BS11","A-1 Pictures, TROYCA",4302.0,731,732,188281.0,303807,72.46909222415862,winter,2015
Mistin,6.54,Fantasy,TV,NHK,OLM,6135.0,12131,2,219.0,1181,6.864777673100041,fall,2001
Cute High Earth Defense Club LOVE!,6.83,Comedy,TV,"Sotsu, Pony Canyon",Diomedéa,4700.0,2207,507,32872.0,81053,55.53545206394872,winter,2015
Plastic Memories,7.91,"Drama, Romance, Sci-Fi",TV,"Aniplex, Movic, AT-X, ASCII Media Works, Bushiroad, MAGES., Asahi Broadcasting, BS11",Doga Kobo,716.0,166,11518,454926.0,904647,82.25244675677746,spring,2015
Nisekoi: False Love,7.35,"Comedy, Romance",TV,"Aniplex, Shueisha",Shaft,2288.0,278,1806,413352.0,672060,80.62242507809461,spring,2015
Cardfight!! Vanguard G,6.5,Action,TV,"TV Tokyo, Dentsu, Sotsu, Bushiroad",TMS Entertainment,6375.0,5070,47,7643.0,15373,41.009959720112164,fall,2014
Heavy Object,7.25,"Action, Sci-Fi",TV,"Movic, Magic Capsule, Warner Bros. Japan, KlockWorx, ASCII Media Works, Showgate, GREE","J.C.Staff, SANZIGEN",2779.0,1425,443,59432.0,150645,61.813202391484474,fall,2015
Durarara!! x2 Ten,7.97,"Action, Mystery, Supernatural",TV,Aniplex,Shuka,616.0,556,753,197249.0,383391,74.27763053079279,summer,2015
Durarara!! x2 Ketsu,8.06,"Action, Mystery, Supernatural",TV,Aniplex,Shuka,513.0,593,1081,181188.0,367021,73.56786467012762,winter,2016
Tokyo Ghoul √A,7.02,"Action, Fantasy, Horror",TV,"Marvelous AQL, Shueisha",Pierrot,3920.0,46,10324,1157527.0,1707428,90.09658995027617,winter,2015
Lupin the Third Part 4,7.9,"Action, Adventure, Comedy, Mystery",TV,"TMS Entertainment, TMS Music",Telecom Animation Film,719.0,2454,433,21821.0,68448,52.99108467175512,fall,2015
Sound! Euphonium,8.0,Drama,TV,"Lantis, Pony Canyon, Rakuonsha",Kyoto Animation,591.0,476,6866,182751.0,437694,73.57862527073321,spring,2015
K: Return of Kings,7.56,"Action, Fantasy",TV,"Starchild Records, Mainichi Broadcasting System, Studio Tulip, Glovision",GoHands,1505.0,680,1194,152778.0,322002,71.30871795358526,fall,2015
Macross Delta,7.27,"Action, Romance, Sci-Fi",TV,"Bandai Visual, Big West, flying DOG, Techno Sound",Satelight,2662.0,2319,510,25969.0,74987,53.866692251181036,spring,2016
Tsukimonogatari,8.09,"Comedy, Mystery, Supernatural, Ecchi",TV,Aniplex,Shaft,465.0,525,936,229576.0,404900,75.88308309008421,fall,2014
Is It Wrong to Try to Pick Up Girls in a Dungeon?,7.55,"Action, Adventure, Fantasy",TV,"Genco, Movic, Warner Bros. Japan, KlockWorx, SoftBank Creative, Showgate, MAGES., FuRyu",J.C.Staff,1543.0,70,11540,915249.0,1465082,88.53592515402087,spring,2015
Yatterman Night,6.5,"Action, Adventure, Comedy, Drama",TV,"Yomiuri Telecasting, Starchild Records, Lantis, Half H.P Studio",Tatsunoko Production,6362.0,3693,33,12719.0,31812,45.91457340745293,winter,2015
Food Wars! Shokugeki no Soma,8.16,"Gourmet, Ecchi",TV,"Dentsu, Frontier Works, Mainichi Broadcasting System, Magic Capsule, Warner Bros. Japan, KlockWorx, Showgate, Shueisha, I Will",J.C.Staff,398.0,58,23435,967773.0,1585095,89.82152833197878,spring,2015
Etotama,6.8,"Action, Comedy, Fantasy",TV,"Pony Canyon, Tablier Communications","Shirogumi, Encourage Films",4839.0,2242,136,27636.0,78914,53.822221234929,spring,2015
Death Parade,8.15,"Drama, Supernatural, Suspense",TV,"VAP, DAX Production, Nippon Television Network",Madhouse,402.0,48,27492,964617.0,1688655,89.77826337179566,winter,2015
The Heroic Legend of Arslan,7.66,"Action, Adventure, Drama, Fantasy",TV,"Dentsu, Mainichi Broadcasting System, Kodansha, Magic Capsule, Ultra Super Pictures, Graphinica, NBCUniversal Entertainment Japan","SANZIGEN, LIDENFILMS",1241.0,597,1681,163308.0,364737,72.07713340496788,spring,2015
Samurai Warriors,6.52,Action,TV,"TV Tokyo, Avex Entertainment, Nihon Ad Systems, Koei","Tezuka Productions, TYO Animations",6247.0,4349,40,7775.0,22450,41.20444079406142,winter,2015
My Love Story!!,7.91,"Comedy, Romance",TV,"VAP, Nippon Television Network, Shueisha",Madhouse,715.0,294,4927,310198.0,646011,78.56483975722067,spring,2015
Castle Town Dandelion,7.16,"Comedy, Slice of Life",TV,"Pony Canyon, TBS, DAX Production, Houbunsha, TC Entertainment, Docomo Anime Store, Nichion",Production IMS,3240.0,1327,417,63515.0,164735,62.332764245849596,summer,2015
Aokana: Four Rhythm Across the Blue,6.65,"Sci-Fi, Sports",TV,"TV Tokyo, Pony Canyon, AT-X, DLE, NBCUniversal Entertainment Japan, Docomo Anime Store, bilibili, Kanon Sound, Hobibox",Gonzo,5572.0,1456,527,64642.0,146560,61.79054214966993,winter,2016
RIN-NE,6.89,"Comedy, Supernatural",TV,"Shogakukan-Shueisha Productions, NHK, Shogakukan",Brain's Base,4438.0,2125,134,32069.0,86625,55.38151520721751,spring,2015
Rokka: Braves of the Six Flowers,7.28,"Action, Adventure, Fantasy, Mystery",TV,Pony Canyon,Passione,2647.0,321,2586,323444.0,614302,78.1682544300202,summer,2015
Garo: Crimson Moon,5.88,"Action, Fantasy",TV,Tohokushinsha Film Corporation,MAPPA,9360.0,3806,18,9027.0,30084,41.64731252326598,fall,2015
Punch Line,6.91,"Comedy, Sci-Fi, Supernatural, Ecchi",TV,"Aniplex, Dentsu, Fuji TV, MAGES., Kyoraku Industrial Holdings, Kansai Telecasting",MAPPA,4349.0,982,626,92847.0,227648,65.6468382689562,spring,2015
Rampo Kitan: Game of Laplace,6.58,"Mystery, Suspense",TV,"Aniplex, Dentsu, Fuji TV, Fujipacific Music, Kyoraku Industrial Holdings, Kansai Telecasting, Kobunsha",Lerche,5921.0,1757,330,49723.0,115065,59.16172677526228,summer,2015
The Perfect Insider,7.25,"Mystery, Sci-Fi",TV,"Aniplex, Dentsu, Fuji TV, Kyoraku Industrial Holdings, Kansai Telecasting",A-1 Pictures,2801.0,1318,698,67420.0,165741,63.02764514656868,fall,2015
Kabaneri of the Iron Fortress,7.27,"Action, Drama, Fantasy, Horror",TV,"Aniplex, Dentsu, Fuji TV, Kyoraku Industrial Holdings, Kansai Telecasting",Wit Studio,2659.0,223,3470,415885.0,781694,80.57586560054581,spring,2016
Yamada-kun and the Seven Witches,7.55,"Comedy, Mystery, Romance, Supernatural",TV,"Dentsu, Frontier Works, Kodansha, Rakuonsha, Ultra Super Pictures, Memory-Tech, Daiichikosho, Lawson HMV Entertainment, Amuse, Animatic, A-Sketch",LIDENFILMS,1535.0,234,4021,429354.0,756642,81.24674125084476,spring,2015
Fate/stay night [Unlimited Blade Works] Season 2,8.32,"Action, Fantasy, Supernatural",TV,"Aniplex, Notes",ufotable,226.0,196,9054,542405.0,820465,84.43282996436544,spring,2015
Showa Genroku Rakugo Shinju,8.57,Drama,TV,"Starchild Records, Mainichi Broadcasting System, Kodansha, DAX Production",Studio Deen,93.0,804,5711,91359.0,281445,67.56459847198441,winter,2016
Gunslinger Stratos: The Animation,6.06,"Action, Sci-Fi",TV,"Aniplex, Square Enix, Nitroplus, ASCII Media Works, Tokyo MX, BS11",A-1 Pictures,8553.0,2385,48,31533.0,71477,53.98306798762075,spring,2015
Mikagura School Suite,6.68,"Action, Comedy, Girls Love",TV,"Media Factory, Movic, AT-X, Showgate",Doga Kobo,5446.0,2114,175,35050.0,87601,55.93941214124937,spring,2015
My Wife is the Student Council President!,6.58,"Comedy, Romance, Ecchi",TV,"DAX Production, Dream Creation, Studio CHANT, Crunchyroll SC Anime Fund",Seven,5918.0,774,420,146630.0,288363,69.57616330785606,summer,2015
Himouto! Umaru-chan,7.11,Comedy,TV,"AT-X, TOHO animation, Good Smile Company, Shueisha, BS11, Jinnan Studio, RAY",Doga Kobo,3486.0,282,4403,369851.0,666479,79.23185979278263,summer,2015
Chain Chronicle: The Light of Haecceitas,6.56,"Action, Adventure, Fantasy",TV,"Bandai Visual, Sotsu, Sega, flying DOG, Slow Curve, Showgate, Sound Team Don Juan, Hakuhodo DY Music & Pictures, Sammy, Pazzy Entertainment, Akatsuki","Telecom Animation Film, Graphinica",6024.0,1698,179,40507.0,120327,57.15831037162994,winter,2017
JOKER 2nd Season,7.23,"Adventure, Comedy, Mystery",TV,Asatsu DK,Shin-Ei Animation,2885.0,7282,18,2876.0,6311,32.62283781853455,spring,2015
Aria the Scarlet Ammo AA,6.21,"Action, Girls Love",TV,"flying DOG, Fujishouji",Doga Kobo,7817.0,1942,103,42325.0,99361,57.05308638679865,fall,2015
Haikyu!! 2nd Season,8.63,Sports,TV,"Dentsu, Mainichi Broadcasting System, Movic, Sony Music Entertainment, TOHO animation, Shueisha",Production I.G,69.0,85,15522,898877.0,1360265,89.64962074525256,fall,2015
GATE,7.69,"Action, Adventure, Fantasy",TV,"Genco, Magic Capsule, Warner Bros. Japan, KlockWorx, Showgate, Bandai Namco Games",A-1 Pictures,1175.0,228,6047,435487.0,773002,81.56026369253412,summer,2015
Seraph of the End: Battle in Nagoya,7.62,"Action, Drama, Supernatural",TV,"NBCUniversal Entertainment Japan, Shueisha",Wit Studio,1337.0,235,2898,451784.0,756606,81.82600546945535,fall,2015
Gintama Season 4,9.06,"Action, Comedy, Sci-Fi",TV,"TV Tokyo, Aniplex, Dentsu",Bandai Namco Pictures,4.0,331,15947,237957.0,595767,77.31889885724325,spring,2015
To LOVE Ru Darkness 2,7.44,"Comedy, Romance, Sci-Fi, Ecchi",TV,"TBS, Magic Capsule, Warner Bros. Japan, NBCUniversal Entertainment Japan, Shueisha",Xebec,1929.0,891,963,132140.0,251281,69.75707153365586,summer,2015
