English name,Score,Genres,Type,Producers,Studios,Rank,Popularity,Favorites,Scored By,Members,Weighted_Score,Premiered Season,Premiered Year
Barbapapa Around the World,5.92,"Adventure, Comedy",TV,Kodansha,Pierrot,9212.0,11900,3,467.0,1274,13.19486074312389,summer,1999
Arabian Nights: Sinbad's Adventures,7.2,"Adventure, Fantasy, Romance",TV,Studio Jack,Nippon Animation,3008.0,6975,28,3542.0,7012,34.58858085919313,fall,1975
The Wonderful Wizard of Oz,6.65,"Adventure, Fantasy",TV,"TV Tokyo, Meruhensha",Panmedia,5607.0,9934,11,945.0,2533,21.10055897517395,fall,1986
Nobody's Boy Remi,7.84,"Adventure, Drama, Slice of Life",TV,ImaginAsian Entertainment,"Madhouse, TMS Entertainment",848.0,5150,265,4703.0,14857,38.13877498936873,fall,1977
Sans Famille,7.89,"Adventure, Drama, Slice of Life",TV,Fuji TV,Nippon Animation,749.0,4593,115,8463.0,19894,43.85761212328775,fall,1996
Legend of the Mystical Ninja,6.31,Comedy,TV,Konami,Trans Arts,7363.0,11358,4,451.0,1550,13.473431528962967,fall,1997
Charge!! Men's Private School,7.4,"Action, Comedy",TV,Lantis,Toei Animation,2098.0,5331,106,3395.0,13590,34.44424240221622,winter,1988
Code Geass: Lelouch of the Rebellion R2,8.91,"Action, Award Winning, Drama, Sci-Fi",TV,"Bandai Visual, Mainichi Broadcasting System, Bandai, Bandai Namco Entertainment, Hakuhodo DY Media Partners",Sunrise,20.0,47,74578,1145264.0,1699634,92.28995207546919,spring,2008
"Bush Baby, Little Angel of the Great Plains",7.18,"Adventure, Drama",TV,Fuji TV,Nippon Animation,3165.0,9682,7,797.0,2777,20.19886950425089,winter,1992
Tomorrow's Joe 2,8.71,"Drama, Sports",TV,Annapuru,Tokyo Movie Shinsha,50.0,2971,2436,18528.0,47761,52.355685875882976,fall,1980
Shugo Chara!,7.4,"Comedy, Fantasy",TV,"TV Tokyo, Sotsu, Pony Canyon",Satelight,2101.0,1056,2906,103376.0,213234,67.34106697572201,fall,2007
ef - a tale of memories.,7.89,"Drama, Mystery, Romance",TV,Rondo Robe,Shaft,745.0,895,2762,106167.0,250471,68.21506422839974,fall,2007
Myself; Yourself,7.12,"Drama, Romance",TV,"Marvelous, Pony Canyon, Happinet Pictures, 5pb.",Doga Kobo,3434.0,1205,775,94521.0,183373,66.10722665163686,fall,2007
KimiKiss: Pure Rouge,7.28,"Drama, Romance",TV,"Bandai Visual, Lantis",J.C.Staff,2625.0,2097,296,40455.0,88704,58.14882083151507,fall,2007
Future Police Urashiman,7.17,"Action, Comedy, Sci-Fi",TV,Fuji TV,Tatsunoko Production,3197.0,9919,5,663.0,2552,18.41307893723314,winter,1983
Sketchbook ~full color's~,7.38,"Comedy, Slice of Life",TV,"Media Factory, Shochiku, AT-X, TV Tokyo Music, TYO, Mag Garden",Hal Film Maker,2163.0,3838,189,9225.0,29572,44.04434697906703,fall,2007
Blue Drop,6.68,"Drama, Girls Love, Sci-Fi",TV,"Pony Canyon, Memory-Tech, Showgate, King Records","BeSTACK, Asahi Production",5430.0,3805,106,12002.0,30098,45.61885663577012,fall,2007
Fantastic Detective Labyrinth,6.67,"Mystery, Sci-Fi",TV,Sotsu,Studio Deen,5472.0,6074,15,2466.0,9881,30.365443372144288,fall,2007
Spice and Wolf,8.22,"Adventure, Fantasy, Romance",TV,"Victor Entertainment, Pony Canyon, Movic, Kadokawa Pictures Japan",Imagin,327.0,220,17540,379926.0,785832,80.8877049087011,winter,2008
Neuro: Supernatural Detective,7.59,"Comedy, Mystery, Supernatural",TV,"VAP, Shueisha",Madhouse,1403.0,2502,574,27335.0,66095,54.77519153036228,fall,2007
Bamboo Blade,7.31,"Comedy, Sports",TV,"AIC, Square Enix, d-rights, Studio Tulip, KlockWorx, flying DOG",AIC ASTA,2466.0,2119,283,40321.0,87185,58.15647282482726,fall,2007
Rosario + Vampire,6.75,"Comedy, Fantasy, Romance, Ecchi",TV,"GDH, Yomiko Advertising, Happinet Pictures, Atelier Musa, Shueisha, Sotsu Music Publishing, Imagine",Gonzo,5095.0,283,3435,387939.0,665336,79.19129913775852,winter,2008
You're Under Arrest: Full Throttle,7.19,"Action, Comedy",TV,TBS,Studio Deen,3064.0,6108,5,3285.0,9757,33.84983789417745,fall,2007
Kaiji: Ultimate Survivor,8.27,Suspense,TV,"VAP, Nippon Television Network",Madhouse,268.0,646,9745,154532.0,339152,72.2830806552605,fall,2007
My Family,7.33,"Comedy, Slice of Life",TV,"TV Asahi, Yumeta Company",Shin-Ei Animation,2385.0,7972,51,2247.0,5057,30.378484132196096,spring,2002
The Magnificent Zorro,7.22,Adventure,TV,Toho,Ashi Productions,2942.0,5666,66,5686.0,11700,39.17324149706985,spring,1996
Wingman,7.06,"Action, Comedy, Romance",TV,TV Asahi,Toei Animation,3717.0,9503,14,829.0,2969,20.415617341705403,winter,1984
Princess Knight,6.73,"Action, Fantasy, Mystery, Romance",TV,Fuji TV,Mushi Production,5164.0,7962,13,1372.0,5077,24.805726652479567,spring,1967
Sonic Soldier Borgman,6.3,"Action, Sci-Fi",TV,"Yomiko Advertising, Toho, Nippon Television Network",Ashi Productions,7377.0,9322,6,523.0,3158,14.884055184431256,spring,1988
Astro Boy (1980),7.14,"Action, Adventure, Sci-Fi",TV,Nippon Television Network,Tezuka Productions,3363.0,5358,88,5710.0,13422,39.106504715360444,fall,1980
Fight! Kickers,6.85,Sports,TV,Nippon Television Network,Pierrot,4638.0,6241,34,5782.0,9268,38.82787819136745,fall,1986
Laughing Salesman,6.76,"Comedy, Drama, Supernatural",TV,TBS,Shin-Ei Animation,5040.0,7263,43,1341.0,6353,24.628492099158354,fall,1989
Attacker You!,6.73,"Romance, Sports",TV,"TV Tokyo, Shaft, Kino Production",Knack Productions,5185.0,6833,25,3321.0,7406,33.318116579499566,spring,1984
Junjo Romantica,7.5,"Boys Love, Comedy, Drama, Romance",TV,"Frontier Works, Kadokawa Shoten, Kadokawa Pictures Japan, KlockWorx, Memory-Tech, Romantica club !!",Studio Deen,1709.0,904,4395,141842.0,248273,70.51673379022944,spring,2008
Wild Knights Gulkeeva,6.33,"Action, Fantasy",TV,TV Tokyo Music,Sunrise,7216.0,10438,0,457.0,2154,13.631124010802296,spring,1995
F-Zero: GP Legend,6.47,"Action, Adventure, Sci-Fi",TV,"TV Tokyo, Dentsu",Ashi Productions,6519.0,6279,62,2645.0,9136,30.74706187250457,fall,2003
Geisters: Fractions of the Earth,5.58,"Action, Sci-Fi",TV,TV Osaka,Plum,10515.0,11120,1,258.0,1701,6.914236964520957,fall,2001
A Great Super Shot Boy,6.38,Sports,TV,"Nihon Ad Systems, Fuji TV",Tsuchida Productions,6966.0,12927,1,292.0,909,9.395111044900123,fall,1984
Gandalla: The King of Burning Desert,5.63,"Adventure, Drama, Fantasy, Horror, Sci-Fi, Supernatural",TV,Big West,Ashi Productions,10358.0,10855,2,230.0,1890,5.894579111487515,spring,1998
Monkey Typhoon,6.55,"Action, Adventure, Comedy, Sci-Fi",TV,TV Tokyo,Studio Egg,6091.0,9121,6,1092.0,3373,22.34679536974934,fall,2002
Saban's Adventures of the Little Mermaid,6.15,"Drama, Fantasy, Romance",TV,Fuji TV,Telescreen,8121.0,11090,3,609.0,1718,16.117701653875933,winter,1991
They Are My Noble Masters,7.11,"Comedy, Romance, Ecchi",TV,"Lantis, Studio Jack, Good Smile Company",A.C.G.T.,3489.0,1746,227,53186.0,116004,60.55611869863927,winter,2008
Tower of Druaga: The Aegis of Uruk,7.13,"Adventure, Comedy, Fantasy",TV,"Dentsu, Sotsu Music Publishing",Gonzo,3392.0,1739,206,50652.0,116390,60.11306164200111,spring,2008
Gunslinger Girl: Il Teatrino,7.13,"Action, Drama, Sci-Fi",TV,Marvelous,Artland,3396.0,2650,111,27482.0,59571,54.22476439036097,winter,2008
Lemon Angel (1988),5.7,Ecchi,TV,Pony Canyon,AIC,10073.0,10794,1,431.0,1924,12.058061053677898,winter,1988
Lemon Angel (1988/II),5.61,Ecchi,TV,Pony Canyon,AIC,10420.0,11326,0,373.0,1567,10.51363524763753,summer,1988
IGPX: Immortal Grand Prix,7.07,"Action, Drama, Sci-Fi",TV,Bandai Visual,Production I.G,3664.0,4591,83,8323.0,19891,42.64022295406761,fall,2005
Daigunder,6.71,"Adventure, Sci-Fi",TV,"TV Tokyo, Victor Entertainment","Nippon Animation, Brain's Base",5271.0,9343,16,1630.0,3145,26.436275761129103,spring,2002
Vampiyan Kids,5.91,"Comedy, Fantasy",TV,Fuji TV,Production I.G,9260.0,12446,2,189.0,1058,4.472468618627426,fall,2001
Aria the Origination,8.48,"Fantasy, Sci-Fi, Slice of Life",TV,"Production I.G, TV Tokyo, Media Factory, Shochiku, Mag Garden",Hal Film Maker,133.0,1659,4041,30786.0,123798,56.98790669711788,winter,2008
Hatenkou Yugi,7.11,"Adventure, Comedy, Drama, Fantasy, Romance",TV,"Frontier Works, Sotsu",Studio Deen,3485.0,3430,169,15843.0,37033,48.89343966031485,winter,2008
H2O: Footprints in the Sand,7.0,Romance,TV,"Kadokawa Shoten, Broccoli, Kadokawa Pictures Japan, KlockWorx, NTT Docomo, Studio Jack",Zexcs,4010.0,2001,380,47242.0,94580,59.264683438075636,winter,2008
Our Home's Fox Deity,7.19,"Comedy, Fantasy",TV,"Kadokawa Shoten, Kadokawa Pictures Japan, KlockWorx, NTT Docomo",Zexcs,3071.0,3681,81,11826.0,32011,46.18510517564081,spring,2008
The Brave Fighter Exkizer,6.67,"Action, Sci-Fi",TV,Nagoya Broadcasting Network,Sunrise,5478.0,9711,9,737.0,2737,18.735882619243178,winter,1990
Smart-san,7.2,"Drama, Romance, Slice of Life",TV,Asahi Broadcasting,Nippon Animation,3020.0,7358,20,880.0,6157,21.179524629052864,summer,1978
Rin: Daughters of Mnemosyne,7.26,"Action, Girls Love, Horror, Sci-Fi, Supernatural",TV,"VAP, Sotsu, Genco, AT-X, Showgate",Xebec,2739.0,1234,1114,71546.0,179497,63.61293690850821,winter,2008
Kiddy Girl-AND,6.84,"Action, Comedy, Sci-Fi",TV,"Lantis, Kadokawa Shoten, Kadokawa Pictures Japan, KlockWorx, gimik",Satelight,4667.0,4839,33,6197.0,17544,39.481312326699346,fall,2009
Kurenai,7.33,"Comedy, Drama",TV,"Yomiko Advertising, Pony Canyon, Half H.P Studio, Shueisha",Brain's Base,2356.0,2098,223,36861.0,88656,57.318788174506935,spring,2008
Amatsuki,6.88,"Action, Fantasy, Mystery",TV,"Frontier Works, Sotsu",Studio Deen,4486.0,2714,124,25915.0,56981,53.31566675154,spring,2008
Real Drive,7.09,"Action, Sci-Fi",TV,"VAP, Nippon Television Network, D.N. Dream Partners",Production I.G,3582.0,4042,52,6064.0,26383,39.61807580461319,spring,2008
Persona: Trinity Soul,6.52,"Action, Sci-Fi",TV,Aniplex,A-1 Pictures,6241.0,2209,162,25491.0,80969,52.63924272361817,winter,2008
Miss Machiko,6.19,"Comedy, Ecchi",TV,TV Tokyo,Pierrot,7912.0,8807,10,671.0,3765,17.11353089758627,fall,1981
Blassreiter,6.89,"Action, Sci-Fi",TV,"Nitroplus, Sotsu Music Publishing",Gonzo,4417.0,2194,215,29250.0,81415,54.49544849977514,spring,2008
Shigofumi: Letters from the Departed,7.46,"Drama, Fantasy, Suspense",TV,"Bandai Visual, Genco, Lantis, Rakuonsha",J.C.Staff,1861.0,2083,354,31265.0,89616,55.90244293813234,winter,2008
Bumpety Boo,6.09,Adventure,TV,"NHK, Studio Jack",Nippon Animation,8404.0,11581,5,670.0,1434,16.94236385686999,spring,1985
The Many Dream Journeys of Meme,6.74,"Adventure, Sci-Fi",TV,TBS,Nippon Animation,5140.0,13044,3,291.0,880,9.89043092080319,spring,1983
Top Striker,6.69,Sports,TV,Fuji TV,Nippon Animation,5388.0,8457,15,2214.0,4319,29.35624563043033,fall,1991
To Love Ru,6.99,"Comedy, Romance, Sci-Fi, Ecchi",TV,"Geneon Universal Entertainment, TBS, Shueisha",Xebec,4050.0,316,4062,314705.0,620071,77.51301471359578,spring,2008
Vampire Knight,6.88,"Drama, Mystery, Romance, Supernatural",TV,"TV Tokyo, Aniplex, Nihon Ad Systems",Studio Deen,4482.0,338,7279,345342.0,586546,78.2548969566767,spring,2008
Haruka Nogizaka's Secret,7.2,"Comedy, Romance",TV,"Geneon Universal Entertainment, ASCII Media Works, Studio Mausu",Diomedéa,3037.0,1576,441,66950.0,132050,62.89363173335733,summer,2008
Special A (S.A),7.51,"Comedy, Romance",TV,Showgate,"Gonzo, AIC",1685.0,609,2698,182938.0,357664,72.97979184893694,spring,2008
Megaman Star Force Tribe,6.93,Adventure,TV,Half H.P Studio,Xebec,4282.0,7181,19,2847.0,6511,32.11714744830625,fall,2007
Sisters of Wellber Zwei,6.74,"Adventure, Fantasy, Romance",TV,"Production I.G, Avex Entertainment, Nagoya Broadcasting Network",Trans Arts,5112.0,7910,3,1479.0,5168,25.54313908981447,winter,2008
Kanokon: The Girl Who Cried Fox,6.38,"Comedy, Romance, Supernatural, Ecchi",TV,"Media Factory, Movic, AT-X",Xebec,6987.0,918,590,117288.0,243899,67.12870088386465,spring,2008
Brave Command Dagwon,6.91,"Action, Adventure",TV,Nagoya Broadcasting Network,Sunrise,4359.0,10231,3,561.0,2300,16.449085682667572,winter,1996
Green Makibao,6.98,Comedy,TV,Fuji TV,Pierrot,4072.0,10601,17,934.0,2045,21.45415657468643,spring,1996
Brain Adventure Record Webdiver,6.89,"Action, Adventure, Sci-Fi",TV,"TV Tokyo, Nippon Animation, Nihon Ad Systems",Radix,4423.0,9886,19,988.0,2589,21.870389545291722,spring,2001
Speed Racer X,6.26,Adventure,TV,"TV Tokyo, Yomiuri Advertising",Tatsunoko Production,7593.0,8643,5,1486.0,4018,24.877207822850647,winter,1997
Macross Frontier,7.89,"Action, Award Winning, Romance, Sci-Fi",TV,"Bandai Visual, Mainichi Broadcasting System, Big West",Satelight,753.0,1479,1859,65933.0,143564,63.62752442533042,spring,2008
Dinosaur King,6.35,"Adventure, Fantasy",TV,"Asatsu DK, Sega, 4Kids Entertainment, Happinet Pictures, Nagoya Broadcasting Network",Sunrise,7135.0,4154,117,15067.0,24959,47.32115985138104,winter,2007
Getter Robo,6.77,"Action, Sci-Fi",TV,Dynamic Planning,Toei Animation,4986.0,6715,21,1912.0,7765,28.058546201440343,spring,1974
Soul Eater,7.84,"Action, Comedy, Fantasy",TV,"TV Tokyo, Aniplex, Dentsu, Media Factory",Bones,836.0,62,26107,818237.0,1565227,87.81989739592456,spring,2008
Tears to Tiara,7.15,"Action, Adventure, Fantasy",TV,"Dwango, Bushiroad, Showgate, Good Smile Company",White Fox,3298.0,2258,179,30787.0,77897,55.345344241932295,spring,2009
Hidamari Sketch x 365,7.82,"Comedy, Slice of Life",TV,"Aniplex, Lantis, TBS, Movic, Houbunsha",Shaft,880.0,3736,180,15490.0,31196,49.59305506664582,summer,2008
Library Wars,7.44,"Action, Comedy, Romance",TV,"Dentsu, Fuji TV, Code, Asmik Ace, ASCII Media Works, Sony Music Entertainment, Atelier Musa",Production I.G,1931.0,2364,398,26662.0,72308,54.34290336078387,spring,2008
Ryoko's Case File,7.05,"Mystery, Supernatural",TV,"Starchild Records, GANSIS",Doga Kobo,3787.0,4725,40,5904.0,18646,39.306093058113184,summer,2008
Adventure Hero Pluster World,6.24,"Action, Adventure, Sci-Fi",TV,TV Tokyo,"Actas, Brain's Base",7664.0,12454,3,270.0,1054,8.427638843397393,spring,2003
Kaiketsu Zorori,7.04,"Adventure, Comedy",TV,Nagoya Broadcasting Network,Ajia-do,3799.0,9080,39,1285.0,3422,24.60854446468827,winter,2004
Linebarrels of Iron,6.9,"Action, Sci-Fi",TV,"Akita Shoten, Sotsu Music Publishing",Gonzo,4390.0,3197,88,18547.0,42085,50.12222899908265,fall,2008
Magician's Academy,6.92,"Comedy, Fantasy, Romance, Supernatural, Ecchi",TV,Media Factory,Zexcs,4321.0,3170,109,18487.0,42602,50.11889786131456,fall,2008
Nabari no Ou,7.26,"Action, Drama, Supernatural",TV,"Square Enix, Kinyosha",J.C.Staff,2741.0,1338,1231,66004.0,163514,62.83650665128461,spring,2008
Strike Witches,6.95,"Action, Sci-Fi, Ecchi",TV,"GDH, Kadokawa Shoten, KlockWorx, NTT Docomo",Gonzo,4204.0,1310,1063,67634.0,166984,62.651197301699,summer,2008
Genesis Climber Mospeada,7.09,Action,TV,"Artmic, Harmony Gold",Tatsunoko Production,3570.0,6305,33,3374.0,9033,33.972390620151415,fall,1983
The Daughter of 20 Faces,7.55,"Action, Adventure, Mystery",TV,"PRA, Sakura Create, Fujipacific Music","Bones, Telecom Animation Film",1562.0,3579,157,11486.0,33803,46.374670153202615,spring,2008
Kaiba,8.14,"Adventure, Award Winning, Mystery, Romance, Sci-Fi",TV,"VAP, WOWOW",Madhouse,425.0,1458,3547,42924.0,145696,59.794606975705896,spring,2008
Graveyard Kitaro,6.86,"Horror, Supernatural",TV,"Dentsu, Yomiko Advertising, SKY Perfect Well Think, Fuji TV, Asmik Ace, Sony Music Entertainment, Fujipacific Music",Toei Animation,4577.0,5691,42,3816.0,11574,34.840279938366045,winter,2008
Hell Girl: Three Vessels,7.61,"Mystery, Supernatural",TV,"Aniplex, Tokyo MX",Studio Deen,1364.0,1926,273,41236.0,100427,58.75988656140444,fall,2008
The Adventures of the Little Koala,6.14,Comedy,TV,Tohokushinsha Film Corporation,Topcraft,8167.0,12865,1,320.0,929,9.907395827654534,spring,1984
ItaKiss,7.42,"Comedy, Romance",TV,"Bandai Visual, Trinity Sound",TMS Entertainment,2022.0,818,2919,142739.0,275035,70.4741692482639,spring,2008
Play Ball,6.16,"Action, Sports",TV,Magic Bus,Eiken,8062.0,12424,1,205.0,1064,5.653032495208538,summer,2005
Cubix,5.34,Sci-Fi,TV,CinePix,Xebec,11267.0,8231,6,2423.0,4669,28.05451334889549,summer,2001
Amazing Sarutobi,7.1,"Adventure, Comedy, Romance, Sports",TV,"Nihon Ad Systems, Asatsu DK",Tsuchida Productions,3565.0,11062,11,543.0,1735,16.39626421245041,fall,1982
The Littl' Bits,6.34,"Adventure, Comedy, Fantasy",TV,Meruhensha,Tatsunoko Production,7156.0,11222,5,574.0,1635,15.840793031659237,winter,1980
The Adventures of the Little Prince,6.77,Adventure,TV,TV Asahi,Knack Productions,4993.0,10537,13,604.0,2090,16.963058669649993,summer,1978
Little Lulu,6.39,"Comedy, Slice of Life",TV,Asahi Broadcasting,Nippon Animation,6933.0,12737,1,348.0,968,11.098949154588006,fall,1976
My Name Is Teppei,6.88,"Action, Sports",TV,Fuji TV,Nippon Animation,4468.0,11179,4,430.0,1666,13.846960033879636,fall,1977
Belle and Sebastian,6.72,Adventure,TV,"NHK, Toho",Visual 80,5234.0,9111,8,1187.0,3378,23.396738803124713,spring,1981
Glass Maiden,6.12,"Action, Sci-Fi",TV,"Happinet Pictures, BIGLOBE",Studio Fantasia,8255.0,4947,10,5347.0,16538,36.989531941727485,spring,2008
The Adventures of Hutch the Honeybee,6.89,"Adventure, Comedy, Drama",TV,Bandai,Tatsunoko Production,4436.0,9222,23,1732.0,3266,27.275650544127174,spring,1970
Coji-Coji,6.28,"Comedy, Fantasy",TV,Aniplex,Nippon Animation,7485.0,13927,1,145.0,668,2.5070895774856927,fall,1997
Golden Bat,6.61,"Action, Sci-Fi",TV,Tele-Cartoon Japan,"Dai-Ichi Douga, Dongyang Animation",5767.0,10085,5,547.0,2412,15.778448292772413,spring,1967
Galaxy Warring State Chronicle Rai,7.89,"Adventure, Romance, Sci-Fi",TV,"TV Tokyo, SoftX",E&G Films,747.0,5114,85,4993.0,15032,38.77621163228881,spring,1994
Time Fighters,6.43,"Adventure, Comedy",TV,Harmony Gold,Tatsunoko Production,6719.0,9906,2,694.0,2571,17.80425798622701,fall,1975
Mobile Suit Gundam 00: Second Season,8.08,"Action, Drama, Sci-Fi",TV,Mainichi Broadcasting System,Sunrise,479.0,1453,1365,91787.0,146885,67.04262690016324,fall,2008
Hiwou War Chronicles,6.81,"Action, Adventure",TV,Bandai Visual,Bones,4802.0,10749,3,502.0,1953,15.238927100942677,fall,2000
Kannagi: Crazy Shrine Maidens,7.28,"Comedy, Supernatural",TV,"Aniplex, Sony Music Entertainment, Ichijinsha",A-1 Pictures,2622.0,1319,376,67766.0,165735,63.11670709898139,fall,2008
Yu-Gi-Oh! 5D's,7.44,Action,TV,"Nihon Ad Systems, Konami Cross Media NY",Gallop,1937.0,1538,1515,79526.0,135950,64.86710939512903,spring,2008
Birdy the Mighty: Decode,7.42,"Action, Comedy, Sci-Fi",TV,"Aniplex, Shogakukan",A-1 Pictures,1995.0,2014,386,34349.0,93650,56.75660600724359,summer,2008
Paul in Fantasy Island,6.36,"Action, Adventure",TV,Fuji TV,Tatsunoko Production,7105.0,12416,1,340.0,1068,10.829786905771089,fall,1976
Antique Bakery,7.01,"Boys Love, Comedy, Gourmet",TV,"Dentsu, Fuji TV, Asmik Ace, Sony Music Entertainment, Shinshokan","Nippon Animation, Shirogumi",3960.0,3406,104,15268.0,37509,48.40102497698171,summer,2008
Hello Kitty's Paradise,6.55,Fantasy,TV,Bones,Sanrio,6056.0,10237,7,760.0,2295,18.85696408736427,spring,1994
Psychic Squad,7.29,"Action, Comedy, Supernatural",TV,"TV Tokyo, Geneon Universal Entertainment, Shogakukan-Shueisha Productions, Half H.P Studio",SynergySP,2597.0,3049,118,11826.0,45601,46.31811860674186,spring,2008
Golgo 13,7.52,"Action, Adventure, Drama, Suspense",TV,"TV Tokyo, Sotsu, Half H.P Studio",The Answer Studio,1652.0,3228,223,11267.0,41246,46.150943340574024,spring,2008
Mushiking: The Guardians of the Forest,7.07,Fantasy,TV,"TV Tokyo, Yomiuri Advertising",TMS Entertainment,3671.0,8852,19,1363.0,3694,25.2169278160028,spring,2005
Web Ghosts PiPoPa,6.72,"Action, Adventure, Comedy, Sci-Fi",TV,Milky Cartoon,Studio Hibari,5238.0,10460,7,751.0,2139,18.988969971373972,spring,2008
Medabots Spirits,6.65,"Action, Adventure, Sci-Fi",TV,"TV Tokyo, Nihon Ad Systems, Nelvana",Trans Arts,5602.0,4609,17,10061.0,19663,43.87671380512942,summer,2000
Sekirei,7.04,"Action, Comedy, Ecchi",TV,"Aniplex, Movic",Seven Arcs,3820.0,537,1674,200937.0,397397,73.26115359798261,summer,2008
Tytania,6.8,"Adventure, Romance, Sci-Fi",TV,"Kodansha, Sogo Vision, Magic Capsule, Happinet Pictures, Sony PCL",Artland,4827.0,4666,33,7151.0,19136,40.80371004975209,fall,2008
Natsume's Book of Friends,8.31,"Drama, Slice of Life, Supernatural",TV,"Aniplex, Nihon Ad Systems, TV Tokyo Music, Sony Music Entertainment",Brain's Base,232.0,394,15221,179501.0,519303,73.77194305898982,summer,2008
Michiko & Hatchin,7.84,"Action, Adventure",TV,"Media Factory, Shochiku, Yomiko Advertising, Fuji TV",Manglobe,834.0,1144,2365,59305.0,193544,62.546036286064265,fall,2008
The Amazing 3,6.88,"Action, Adventure, Comedy, Sci-Fi",TV,Fuji TV,Mushi Production,4485.0,12211,3,353.0,1146,11.947479646563146,summer,1965
Little Women,6.49,"Drama, Slice of Life",TV,Kokusai Eigasha,Toei Animation,6442.0,11522,2,449.0,1463,13.701417013627351,spring,1981
Blade of the Immortal,6.82,"Action, Adventure, Supernatural",TV,"Production I.G, Kodansha",Bee Train,4742.0,2479,151,25721.0,67162,53.15895310494404,summer,2008
Clannad: After Story,8.93,"Drama, Romance, Supernatural",TV,"Pony Canyon, TBS, Rakuonsha, Animation Do",Kyoto Animation,19.0,114,68949,639729.0,1149886,86.7034781744884,fall,2008
Space Emperor God Sigma,6.88,Action,TV,TV Tokyo,Toei Animation,4481.0,11710,1,392.0,1373,12.956263239648875,spring,1980
Chrome Shelled Regios,7.28,"Action, Adventure, Fantasy, Sci-Fi",TV,"Kadokawa Shoten, AMG MUSIC",Zexcs,2609.0,1076,1042,102894.0,207899,67.13861651961693,winter,2009
Winter Sonata,7.26,"Drama, Romance",TV,Yoon's Color,"Studio Comet, KeyEast, REALTHING",2722.0,4266,68,5372.0,23435,38.67940278323813,fall,2009
Popolocrois Monogatari,7.01,"Adventure, Fantasy",TV,"Production I.G, TV Tokyo, Aniplex",Bee Train,3957.0,9148,17,979.0,3336,21.94853203262299,fall,1998
Hayate the Combat Butler!!,7.67,"Action, Comedy, Romance",TV,"TV Tokyo, Geneon Universal Entertainment, Shogakukan-Shueisha Productions, Shogakukan Music & Digital Entertainment",J.C.Staff,1204.0,1787,477,56309.0,112866,61.83570530841199,spring,2009
Blue Dragon: Trials of the Seven Shadows,6.53,"Adventure, Comedy, Fantasy, Supernatural",TV,TV Tokyo,Pierrot,6184.0,4859,17,7636.0,17369,41.04547951632156,spring,2008
The New Adventures of Gigantor,6.79,Action,TV,Studio Jack,Tokyo Movie Shinsha,4885.0,10388,9,762.0,2195,19.22874887217806,fall,1980
Hareluya II Boy,6.34,"Action, Comedy, Fantasy",TV,TV Tokyo,Triangle Staff,7187.0,9927,10,399.0,2543,12.339782710895278,spring,1997
Rosario + Vampire Capu2,6.9,"Comedy, Fantasy, Romance, Ecchi",TV,"GDH, Yomiko Advertising, Happinet Pictures, Shueisha, Sotsu Music Publishing",Gonzo,4399.0,520,1106,250387.0,407779,75.1865001468571,fall,2008
Toradora!,8.08,"Drama, Romance",TV,"Genco, Starchild Records, Magic Capsule, Yomiuri Advertising, TV Tokyo Music",J.C.Staff,487.0,22,55666,1330877.0,2121399,92.79476908593422,fall,2008
Galactic Cyclone Braiger,6.77,"Action, Adventure, Sci-Fi",TV,Kokusai Eigasha,Toei Animation,4987.0,9978,13,546.0,2501,15.991096684866806,fall,1981
Ultraviolet: Code 044,5.78,"Action, Sci-Fi",TV,"Sony Pictures Entertainment, Tezuka Productions, Mill Creek Entertainment",Madhouse,9747.0,6998,6,1440.0,6971,23.806253481549405,summer,2008
Fireball,6.63,"Comedy, Sci-Fi",TV,Disney Platform Distribution,Jinnis Animation Studios,5678.0,6007,27,5562.0,10143,38.13996064489021,spring,2008
The Melancholy of Haruhi Suzumiya Season 2,7.22,"Comedy, Mystery, Sci-Fi",TV,Kadokawa Shoten,Kyoto Animation,2911.0,401,2224,295836.0,513230,77.22934921349591,spring,2009
Sands of Destruction,6.94,"Adventure, Fantasy",TV,Sega,Production I.G,4231.0,2869,112,23590.0,51299,52.494067858094105,summer,2008
Fight!! Ramenman,6.24,"Action, Adventure",TV,Yomiko Advertising,Toei Animation,7700.0,11463,9,331.0,1493,10.38820936335691,winter,1988
Prince Mackaroo,6.32,"Adventure, Award Winning, Comedy, Fantasy",TV,NHK,Gallop,7297.0,10857,4,503.0,1890,14.539193870077746,fall,1998
Someday's Dreamers II: Sora,7.24,"Drama, Romance, Slice of Life",TV,"Geneon Universal Entertainment, TV Asahi",Hal Film Maker,2807.0,4020,65,6916.0,26607,41.08571268012088,summer,2008
Getter Robo G,6.57,"Action, Sci-Fi",TV,"Fuji TV, Dynamic Planning",Toei Animation,5970.0,9412,7,1023.0,3069,21.747669883567134,spring,1975
Robotech Masters,6.56,"Action, Drama, Sci-Fi",TV,"Big West, Harmony Gold",Tatsunoko Production,6025.0,6677,18,3184.0,7867,32.666069208723954,spring,1984
Emergency Departure Rescue Kids,6.56,"Action, Adventure, Comedy, Sci-Fi",TV,"TV Tokyo, Sotsu",Tokyo Movie Shinsha,6039.0,13077,2,207.0,872,6.351864303093625,winter,1991
Brave of the Sun Fighbird,7.09,"Action, Sci-Fi",TV,Nagoya Broadcasting Network,Sunrise,3588.0,8890,12,713.0,3655,19.005077556189345,winter,1991
Invincible Robo Trider G7,6.41,"Comedy, Sci-Fi",TV,Sotsu,Sunrise,6840.0,11638,1,409.0,1402,12.683774584667642,winter,1980
Legends of the Dark King: A Fist of the North Star Story,7.1,"Action, Drama",TV,"Showgate, Index",Satelight,3545.0,5582,26,4619.0,12142,37.010479371700015,fall,2008
Corpse Princess: Aka,7.19,"Action, Horror, Supernatural",TV,"Square Enix, Starchild Records","Gainax, feel.",3118.0,1697,239,44362.0,120624,58.9168532241356,fall,2008
Fables of the Green Forest,6.1,"Adventure, Fantasy",TV,"Mushi Production, Fuji TV",Nippon Animation,8361.0,11353,3,465.0,1552,13.441886237765305,winter,1973
Ride Back,7.27,"Action, Drama, Sci-Fi",TV,Geneon Universal Entertainment,Madhouse,2670.0,3002,130,20747.0,46988,51.70472258156477,winter,2009
A Certain Magical Index,7.36,"Action, Fantasy, Sci-Fi",TV,"Geneon Universal Entertainment, Square Enix, AT-X, ASCII Media Works, Kadokawa Contents Gate",J.C.Staff,2239.0,215,5455,377460.0,789163,79.76076636827787,fall,2008
Iron Fist Chinmi,7.21,"Action, Adventure",TV,"TV Asahi, Toho","Production Reed, Ashi Productions",2972.0,8345,11,1906.0,4492,28.634624239481354,summer,1988
Queen's Blade: The Exiled Virgin,6.13,"Action, Adventure, Fantasy, Ecchi",TV,"Genco, Media Factory, AT-X, Magic Capsule, Hobby Japan, Toranoana",Arms,8208.0,1979,196,35851.0,96669,55.329563714716066,spring,2009
Skip Beat!,8.08,"Comedy, Drama, Romance",TV,"Sotsu, Pony Canyon, Hakusensha, TV Tokyo Music",Hal Film Maker,485.0,855,5118,137088.0,261344,70.90577289513816,fall,2008
Ga-Rei-Zero,7.58,"Action, Supernatural, Suspense",TV,"Lantis, Kadokawa Shoten, Rakuonsha, Kadokawa Pictures Japan, KlockWorx","AIC Spirits, asread.",1438.0,961,2837,94280.0,233605,66.68553950188402,fall,2008
