English name,Score,Genres,Type,Producers,Studios,Rank,Popularity,Favorites,Scored By,Members,Weighted_Score,Premiered Season,Premiered Year
MAGATSU WAHRHEIT,6.55,"Action, Fantasy",TV,"WOWOW, NBCUniversal Entertainment Japan, Tokyo MX, Q-Tec, Chugai Mining, BS11, KLab, Marui Group, Bit grooove promotion",Yokohama Animation Lab,6059.0,3510,62,11933.0,35517,45.3740755579677,fall,2020
Working Buddies! No 2!,6.4,Comedy,TV,"Lantis, Movic, Half H.P Studio, BS Fuji, Tokyo MX, Good Smile Company, Bandai Namco Arts","Fanworks, Tomovies",6896.0,8932,7,1688.0,3598,26.317483805477927,summer,2018
Gakuen Basara: Samurai High School,6.18,"Action, Comedy",TV,"TBS, DAX Production, High Kick Entertainment",Brain's Base,7977.0,4769,27,4179.0,18259,34.71008613789864,fall,2018
Late night! The Genius Bakabon,5.98,"Comedy, Slice of Life",TV,"Pierrot, Dentsu, TV Tokyo Music, Avex Pictures, Shogakukan, Daiichi Shokai",Pierrot Plus,8933.0,9166,3,1172.0,3324,22.150910834251782,summer,2018
Overlord III,7.92,"Action, Adventure, Fantasy",TV,"AT-X, Hakuhodo DY Music & Pictures, NTT Plala, Kadokawa",Madhouse,696.0,185,5260,530738.0,854053,83.74894137168073,summer,2018
As Miss Beelzebub Likes.,7.23,"Comedy, Fantasy, Romance",TV,"Aniplex, Square Enix, Movic, Studio Mausu, Tokyo MX, Q-Tec, ABC Animation, CA-Cygames Anime Fund",LIDENFILMS,2857.0,2032,317,35071.0,92460,56.70712322360218,fall,2018
UzaMaid!,6.88,"Comedy, Girls Love",TV,"AT-X, Sony Music Communications, Futabasha, Kadokawa Media House, NTT Plala, Kadokawa",Doga Kobo,4479.0,1753,181,49180.0,115514,59.48533040185962,fall,2018
Isekai Cheat Magician,5.46,"Action, Adventure, Fantasy",TV,"AT-X, Kadokawa Media House, Kadokawa, Shufunotomo",Encourage Films,10894.0,724,504,161870.0,306674,68.73155526110932,summer,2019
Aguu: Genius Dolls,5.4,"Action, Drama, Supernatural",TV,Tencent Animation & Comics,Studio Deen,11065.0,7009,6,2179.0,6931,27.14004194364531,summer,2018
The Promised Neverland,8.51,"Fantasy, Mystery, Sci-Fi, Suspense",TV,"Aniplex, Dentsu, Fuji TV, Shueisha, CA-Cygames Anime Fund",CloverWorks,122.0,37,32144,1221982.0,1866038,92.47202562435513,winter,2019
Bloom Into You,7.9,"Drama, Girls Love, Romance",TV,"AT-X, Sony Music Communications, Docomo Anime Store, Kadokawa Media House, Kadokawa",TROYCA,727.0,684,5966,133508.0,320828,70.43398578617025,fall,2018
The Journey Home,5.87,Adventure,TV,TMS Entertainment,"Studio W.Baba, P.I.C.S.",9436.0,13384,4,183.0,799,4.096735171032071,summer,2018
Tokyo Ghoul:re 2nd Season,6.43,"Action, Fantasy, Horror",TV,"Marvelous, Pierrot Plus, TC Entertainment, Shueisha",Pierrot,6720.0,192,2698,494458.0,829173,81.05998834933655,fall,2018
Ultramarine Magmell,6.1,"Action, Adventure, Fantasy",TV,"Shueisha, bilibili, Yomiuri TV Enterprise, FanFan Inc., Shun Produce",Pierrot Plus,8380.0,1426,169,70512.0,150507,61.79622844308624,spring,2019
"If My Favorite Pop Idol Made It to the Budokan, I Would Die",7.43,"Comedy, Girls Love",TV,"Pony Canyon, TBS, Movic, Tokuma Shoten",8bit,1973.0,3183,319,17814.0,42364,50.44657956514658,winter,2020
Theatre of Darkness: Yamishibai 6,6.17,"Avant Garde, Horror, Supernatural",TV,TV Tokyo,ILCA,8011.0,4491,5,9564.0,20800,42.66739526610004,summer,2018
"How clumsy you are, Miss Ueno.",6.57,Comedy,TV,Nippon Columbia,Lesprit,5996.0,1761,192,51454.0,114777,59.47662814364235,winter,2019
The Ones Within,6.87,"Comedy, Drama",TV,"Lantis, AT-X, Docomo Anime Store, Kadokawa Media House, Kadokawa, Muse Communication, Bandai Namco Arts, Bit Promotion",SILVER LINK.,4534.0,1633,577,53063.0,126721,60.20314205187268,summer,2019
Afterlost,5.47,"Action, Adventure, Drama, Fantasy, Mystery",TV,"Sotsu, Pony Canyon, KlockWorx, Tokyo MX, GREE, Akatsuki",Madhouse,10867.0,2519,54,19360.0,65378,48.29885854294738,spring,2019
Real Girl Season 2,7.67,Romance,TV,"VAP, Docomo Anime Store, DeNA, D.N. Dream Partners",Hoods Entertainment,1196.0,1237,1172,95862.0,179160,66.95945854371203,winter,2019
The Morose Mononokean II,7.57,"Comedy, Supernatural",TV,"Pierrot, VAP, Square Enix, AT-X, Nippon Columbia, Age Global Networks, Yomiuri TV Enterprise, Kanon Sound, RAY",Pierrot Plus,1481.0,2908,155,21085.0,50172,52.249755687110074,winter,2019
IDOLiSH7 Second BEAT!,8.14,Drama,TV,"Bandai Visual, Lantis, Bandai Namco Games",TROYCA,425.0,3868,376,9786.0,28951,45.5567592680401,spring,2020
Run with the Wind,8.39,"Drama, Sports",TV,"Movic, Nippon Television Network, TOHO animation, Toy's Factory, Cygames, Yomiuri Shimbun, MediaLink Entertainment Limited",Production I.G,177.0,788,5820,130556.0,285359,70.79818367795637,fall,2018
Stars Align,7.59,"Drama, Sports",TV,"TBS, Movic, Magic Capsule, flying DOG",8bit,1400.0,1152,2186,79922.0,192104,65.10716785447181,fall,2019
Forest of Piano Second Season,7.42,Drama,TV,NHK,Gaina,1986.0,2948,83,22209.0,48533,52.55716411061103,winter,2019
Zombie Land Saga,7.51,"Award Winning, Comedy, Supernatural",TV,"Avex Pictures, Cygames, dugout",MAPPA,1687.0,439,3063,227950.0,470781,75.09821731216586,fall,2018
Magical Girl Spec-Ops Asuka,6.33,"Action, Drama",TV,Kadokawa,LIDENFILMS,7221.0,2202,131,26648.0,81123,52.7819075785153,winter,2019
Domestic Girlfriend,6.67,"Drama, Romance",TV,"Mainichi Broadcasting System, Kodansha, flying DOG, DMM pictures, Bit Promotion",Diomedéa,5490.0,257,5646,428624.0,710124,80.03691417169911,winter,2019
"So I'm a Spider, So What?",7.45,"Action, Adventure, Comedy, Fantasy, Mystery",TV,"Movic, AT-X, Sammy, Crunchyroll, Kadokawa Media House, NTT Plala, Kadokawa",Millepensee,1864.0,530,4035,210482.0,401291,74.25319686391042,winter,2021
Space Battleship Tiramisu Zwei,6.52,"Comedy, Sci-Fi, Slice of Life",TV,"Frontier Works, Nippon Columbia, Studio Mausu, Tokyo MX, Adores, Shinchosha, FuRyu, Exa International, NTT Plala, JY Animation",Gonzo,6254.0,6155,4,4172.0,9577,35.20967523181927,fall,2018
Golden Kamuy Season 2,8.24,"Action, Adventure",TV,"Magic Capsule, NBCUniversal Entertainment Japan, Tokyo MX, Good Smile Company, Sammy, Shueisha, JR East Marketing & Communications, Twin Engine",Geno Studio,304.0,1172,895,103461.0,189247,68.3844157997653,fall,2018
JoJo's Bizarre Adventure: Golden Wind,8.58,"Action, Adventure, Supernatural",TV,"Warner Bros. Japan, KlockWorx, Medicos Entertainment, Shueisha",David Production,87.0,154,30447,638566.0,958134,86.30091858026013,fall,2018
Jingai-san no Yome,5.78,"Comedy, Fantasy, Romance",TV,"MAGES., Cloud22",Saetta,9763.0,3108,102,19088.0,44228,48.693457725320975,fall,2018
WataTen! An Angel Flew Down to Me,7.29,"Comedy, Girls Love",TV,"AT-X, flying DOG, Sony Music Communications, Kadokawa Media House, Ichijinsha, Kadokawa",Doga Kobo,2593.0,1139,946,79511.0,194043,64.66915333954418,winter,2019
Kaguya-sama: Love is War,8.41,Comedy,TV,"Aniplex, Mainichi Broadcasting System, Magic Capsule, Shueisha, JR East Marketing & Communications",A-1 Pictures,172.0,53,37697,1030416.0,1632893,90.7161446678842,winter,2019
Demon Slayer: Kimetsu no Yaiba,8.5,"Action, Award Winning, Fantasy",TV,"Aniplex, Shueisha",ufotable,126.0,7,88375,1943121.0,2808712,96.92736273963585,spring,2019
Bungo Stray Dogs 3,8.22,"Action, Mystery, Supernatural",TV,"WOWOW, Lantis, Movic, Bandai Namco Live Creative, Sony Music Entertainment, Glovision, Kadokawa Media House, Kadokawa, Bandai Namco Arts",Bones,317.0,342,4846,304810.0,581684,78.76630449530687,spring,2019
Strike Witches: 501st JOINT FIGHTER WING Take Off!,6.58,"Comedy, Sci-Fi",TV,"Nippon Columbia, Glovision, Anime Beans","Acca effe, Giga Production",5927.0,4716,28,5721.0,18717,38.338488193165716,spring,2019
League of Nations Air Force Aviation Magic Band Luminous Witches,6.69,Sci-Fi,TV,"AT-X, Docomo Anime Store, Sammy, TV Aichi, Kadokawa Media House, DeNA, Production Ace, BS NTV, Kadokawa",Shaft,5396.0,4330,64,4638.0,22670,36.477218851714184,summer,2022
ENDRO!,6.92,"Fantasy, Slice of Life",TV,"Egg Firm, Sega Games",Studio Gokumi,4313.0,2338,205,25886.0,73842,53.36071094076335,winter,2019
Kono Oto Tomare!: Sounds of Life,7.92,"Drama, Romance",TV,"WOWOW, Movic, KlockWorx, Memory-Tech, King Records, Shueisha, Pony Canyon Enterprise",Platinum Vision,693.0,795,2265,111904.0,283470,68.75842554229928,spring,2019
Xuan Yuan Sword Luminary,6.01,"Action, Adventure, Fantasy",TV,"TV Tokyo, Ai Addiction",Studio Deen,8763.0,4921,19,5002.0,16830,36.17258411475398,fall,2018
Fate/Grand Order: Absolute Demonic Front - Babylonia,7.94,"Action, Fantasy, Supernatural",TV,"Aniplex, Notes, Delightworks",CloverWorks,659.0,845,2443,124834.0,265020,69.83570450911051,fall,2019
"Welcome, Chitose",6.69,"Comedy, Slice of Life",TV,VAP,Gathering,5391.0,7323,14,1693.0,6227,26.772693558349815,fall,2018
Cinderella Nine,6.11,Sports,TV,"TV Tokyo, Victor Entertainment, AT-X",TMS Entertainment,8317.0,3988,34,9611.0,27020,42.620498876332384,spring,2019
MIX,7.22,"Drama, Romance, Sports",TV,"Shogakukan-Shueisha Productions, Yomiuri Telecasting",OLM,2951.0,4254,64,9179.0,23608,43.78513071238925,spring,2019
The Quintessential Quintuplets,7.66,"Comedy, Romance",TV,"Pony Canyon, Kodansha, ZERO-A, GYAO!",Tezuka Productions,1238.0,171,13209,576270.0,890586,84.22013001267429,winter,2019
My Roommate is a Cat,7.73,Slice of Life,TV,"AT-X, NBCUniversal Entertainment Japan, Tokyo MX, Avex Pictures, Q-Tec, BS11, ABC Animation, GYAO!, BookLive",Zero-G,1066.0,1179,1204,86678.0,186091,66.06465390710981,winter,2019
NAMUAMIDABUTSU! -UTENA-,6.06,Fantasy,TV,DMM pictures,Asahi Production,8566.0,5196,28,3446.0,14435,32.66409577381373,spring,2019
Case File nº221: Kabukicho,6.89,"Comedy, Drama, Mystery",TV,"Mainichi Broadcasting System, Movic, Glovision, DMM pictures, Kadokawa",Production I.G,4433.0,2200,190,24391.0,81129,52.74599664300349,fall,2019
Rinshi!! Ekodachan,5.53,"Comedy, Slice of Life",TV,"Sotsu, AT-X, Tokyo MX, Exit Tunes, Radio Osaka, Rakuten, Cloud22","Kinema Citrus, Ascension, Creators in Pack, Zero-G",10678.0,5853,18,3609.0,10791,32.22782020227004,winter,2019
We Never Learn: BOKUBEN,7.28,"Comedy, Romance",TV,"Aniplex, Movic, Barnum Studio, Magic Capsule, Shueisha, BS11, ADK","Silver, Arvo Animation",2608.0,509,1613,218811.0,419540,74.40463092313249,spring,2019
Sakugan,6.51,"Adventure, Comedy, Sci-Fi",TV,"VAP, Sotsu, Mainichi Broadcasting System, Bandai, Asmik Ace, Tohokushinsha Film Corporation, Sammy, DeNA, Nippon Cultural Broadcasting, Bandai Namco Arts, Bandai Spirits, NetEase, Fosun Entertainment Japan",Satelight,6344.0,1972,273,30030.0,97398,54.20255606092516,fall,2021
THE IDOLM@STER SideM Wakeatte Mini!,6.24,"Comedy, Slice of Life",TV,"Lantis, Bandai Namco Entertainment",Zero-G,7701.0,8898,7,1141.0,3649,22.302592771086456,fall,2018
Amazing Stranger,5.97,"Comedy, Romance, Sci-Fi",TV,"AT-X, Seven, Futabasha, A-Craft, AQUA ARIS",Studio A-CAT,8955.0,4881,27,7489.0,17094,39.99486745446899,spring,2019
I'm glad I could keep running.,6.38,"Drama, Slice of Life",TV,"DAX Production, Twin Planet",Signal.MD,6983.0,5585,12,4420.0,12113,35.5567122382034,fall,2018
Magia Record: Puella Magi Madoka Magica Side Story,6.8,"Drama, Suspense",TV,"Aniplex, Houbunsha, f4samurai",Shaft,4853.0,1410,799,53185.0,152739,60.12663106559942,winter,2020
Pingu in the City,6.41,"Comedy, Slice of Life",TV,"NHK, NHK Enterprises, Mattel Creations",Polygon Pictures,6840.0,6046,114,4994.0,10012,36.77766316866585,fall,2018
Operation Han-Gyaku-Sei Million Arthur 2nd Season,6.3,"Action, Adventure, Fantasy",TV,"Square Enix, Sotsu, Genco, Lantis, Magic Capsule, Fields, bilibili, Bandai Namco Arts, Happinet",J.C.Staff,7387.0,4730,19,4190.0,18587,34.92059383866286,spring,2019
After School Dice Club,6.7,Comedy,TV,"Genco, MediaNet, Nippon Columbia, Ai Addiction, Shogakukan, ABC Animation, Happinet, HOBBY BASE Yellow Submarine",LIDENFILMS,5355.0,2962,81,19947.0,48004,50.539757696417226,fall,2019
The Magnificent Kotobuki,6.84,"Action, Adventure",TV,"Digital Frontier, Bandai Namco Arts","WAO World, GEMBA",4668.0,3661,87,10362.0,32314,44.4318788146389,winter,2019
A Destructive God Sits Next to Me,6.65,Comedy,TV,"Toei Video, AT-X, Being, Crunchyroll, Yomiuri TV Enterprise, Kadokawa, JY Animation, MAGNET, Video Market",EMT Squared,5575.0,2707,259,19969.0,57280,50.47823744075239,winter,2020
Azur Lane the Animation,6.28,"Action, Sci-Fi",TV,"Frontier Works, Sotsu, Nitroplus, TOHO animation, i0+, Yostar Pictures, Stray Cats",Bibury Animation Studios,7502.0,1343,960,58398.0,162902,60.26099616266334,fall,2019
Stand My Heroes: Piece of Truth,5.76,"Mystery, Romance",TV,"Yomiuri Telecasting, Shochiku, Tokyo MX, BS11, JR East Marketing & Communications, Marui Group, Rakuten",M.S.C,9854.0,4090,87,6800.0,25807,38.720618494294186,fall,2019
Outburst Dreamer Boys,6.76,Comedy,TV,"Lantis, Bandai Namco Live Creative, Ai Addiction, Kadokawa Media House, NTT Plala, Kadokawa, Bandai Namco Arts",Studio Deen,5048.0,3043,163,16317.0,45775,48.69121249127156,fall,2019
My Hero Academia Season 4,7.91,Action,TV,"Dentsu, Yomiuri Telecasting, Movic, Sony Music Entertainment, TOHO animation, Shueisha",Bones,707.0,54,8217,1020099.0,1632615,90.0289711438344,fall,2019
Shikizakura,5.82,"Action, Drama, Sci-Fi",TV,Chukyo TV Broadcasting,Sublimation,9618.0,4955,50,3116.0,16500,31.305608776024098,fall,2021
Isekai Quartet,7.39,"Comedy, Fantasy",TV,Kadokawa,Studio PuYUKAI,2133.0,580,1007,208214.0,371676,74.07099450979233,spring,2019
Laid-Back Camp Season 2,8.53,Slice of Life,TV,"Half H.P Studio, MAGES., DeNA",C-Station,112.0,1088,2909,85887.0,206367,66.92474743219225,winter,2021
Room Camp,7.32,Slice of Life,TV,"Sotsu, AT-X, KlockWorx, Houbunsha, MAGES., BS11, DeNA, FuRyu",C-Station,2423.0,2033,127,41468.0,92437,58.439758331122334,winter,2020
A Certain Scientific Accelerator,7.21,"Action, Fantasy, Sci-Fi",TV,"Square Enix, Movic, AT-X, Warner Bros. Japan, NBCUniversal Entertainment Japan, Kadokawa",J.C.Staff,2974.0,1003,888,93141.0,224403,66.08655722102598,summer,2019
A Certain Scientific Railgun T,8.17,"Action, Fantasy, Sci-Fi",TV,"Square Enix, Movic, AT-X, Warner Bros. Japan, NBCUniversal Entertainment Japan, Kadokawa",J.C.Staff,378.0,1028,3220,87124.0,219430,66.64720221673386,winter,2020
ORESUKI Are you the only one who loves me?,7.32,"Comedy, Romance",TV,"Aniplex, Movic, Barnum Studio, Tokyo MX, Q-Tec, Docomo Anime Store, BS11, Straight Edge, Kadokawa",Connect,2437.0,479,2204,232554.0,435521,75.04400944439836,fall,2019
Attack on Titan Season 3 Part 2,9.05,"Action, Drama",TV,"Production I.G, Dentsu, Mainichi Broadcasting System, Pony Canyon, Kodansha, Techno Sound, Pony Canyon Enterprise",Wit Studio,6.0,24,55245,1471825.0,2104016,94.85598199303539,spring,2019
Chidori RSC,6.18,"Comedy, Sports",TV,"Hakuhodo DY Music & Pictures, Bandai Namco Arts",Studio 3Hz,7986.0,3427,37,10974.0,37149,44.00733200875023,fall,2019
The Price of Smiles,6.03,"Action, Drama, Fantasy, Sci-Fi",TV,"VAP, WOWOW, Yomiuri Telecasting, MediaNet, Asmik Ace, Nippon Television Network, Tokyo MX, Dynamo Pictures, Rakuten, Happinet",Tatsunoko Production,8687.0,3444,43,13116.0,36890,45.48777850967786,winter,2019
My Next Life as a Villainess: All Routes Lead to Doom!,7.47,"Comedy, Fantasy, Romance",TV,"Mainichi Broadcasting System, Asmik Ace, King Records, Ichijinsha, Nichion",SILVER LINK.,1817.0,508,2819,226951.0,420513,75.00449077925079,spring,2020
Do You Love Your Mom and Her Two-Hit Multi-Target Attacks?,5.55,"Adventure, Comedy, Fantasy, Ecchi",TV,"Aniplex, Toranoana, Tokyo MX, Q-Tec, BS11, Contents Seed, Kadokawa, KLab",J.C.Staff,10627.0,826,461,119584.0,271866,65.97324498189214,summer,2019
Magical Sempai,6.41,"Comedy, Ecchi",TV,"Nihon Ad Systems, Kodansha, KlockWorx, flying DOG, Avex Pictures, Q-Tec, Docomo Anime Store, GYAO!, BS NTV, Marui Group",LIDENFILMS,6798.0,842,456,123652.0,265320,67.68272062011611,summer,2019
Wasteful Days of High School Girls,7.71,Comedy,TV,"AT-X, Kadokawa Media House, Kadokawa",Passione,1115.0,1766,662,45384.0,114441,59.808633391260045,summer,2019
Darwin's Game,7.23,"Action, Mystery, Sci-Fi",TV,"Aniplex, AT-X, Tokyo MX, Akita Shoten, BS11, Kanetsu Investment, CA-Cygames Anime Fund, Hochi Shimbun, ADK",Nexus,2865.0,387,2455,284587.0,525368,76.86935428692274,winter,2020
Cautious Hero: The Hero Is Overpowered but Overly Cautious,7.49,"Action, Adventure, Comedy, Fantasy",TV,"AT-X, Kadokawa Media House, Kadokawa, Legs",White Fox,1760.0,341,2101,338603.0,582492,78.88319774720472,fall,2019
Fire Force,7.71,"Action, Supernatural",TV,"Mainichi Broadcasting System, Kodansha, bilibili, DMM pictures, DMM Music",David Production,1110.0,98,8931,675181.0,1251581,85.80824151313801,summer,2019
Katana Maidens: Mini Toji,6.12,"Action, Comedy, Fantasy",TV,"Square Enix, Genco, Mainichi Broadcasting System, AT-X, Studio Gokumi, Glovision, Crunchyroll, Kadokawa, My Theater D.D.",Project No.9,8279.0,7341,5,2405.0,6192,29.295553828967062,winter,2019
Fruits Basket 1st Season,8.22,"Drama, Romance, Supernatural",TV,"TV Tokyo, TV Osaka, Nihon Ad Systems, Hakusensha, Avex Pictures, TMS Music, 8PAN",TMS Entertainment,318.0,229,15081,366401.0,772961,80.5386307067923,spring,2019
Dr. Stone,8.29,"Adventure, Comedy, Sci-Fi",TV,"TOHO animation, Shueisha, 8PAN",TMS Entertainment,255.0,55,27001,986159.0,1630125,90.1549797288811,summer,2019
RobiHachi,6.53,"Adventure, Comedy, Sci-Fi",TV,"Sotsu, Pony Canyon, Cygames",Studio Comet,6217.0,3629,86,10748.0,32790,44.337443556803144,spring,2019
Ace of Diamond Act II,8.26,Sports,TV,"TV Tokyo, Sotsu, Pony Canyon, Kodansha, AT-X, DAX Production",Madhouse,282.0,2142,941,42052.0,84897,59.737888023284285,spring,2019
O Maidens in Your Savage Season,7.34,"Comedy, Drama, Romance",TV,"Mainichi Broadcasting System, Kodansha, DMM pictures",Lay-duce,2312.0,683,1521,145454.0,321086,70.55122836455324,summer,2019
The Helpful Fox Senko-san,7.33,"Slice of Life, Supernatural",TV,"Docomo Anime Store, Kadokawa",Doga Kobo,2377.0,648,2156,168297.0,336681,71.9428492172486,spring,2019
Ao-chan Can't Study!,6.72,"Comedy, Romance, Ecchi",TV,"Mainichi Broadcasting System, Kodansha, DMM pictures",SILVER LINK.,5232.0,852,575,129319.0,262515,68.5690762569098,spring,2019
Senryu Girl,7.38,"Comedy, Slice of Life",TV,"Mainichi Broadcasting System, Kodansha, DMM pictures",Connect,2163.0,1230,463,77187.0,179905,64.50164485367509,spring,2019
"BOFURI: I Don't Want to Get Hurt, so I'll Max Out My Defense.",7.54,"Action, Adventure, Comedy, Fantasy",TV,"AT-X, MAGES., Docomo Anime Store, Sammy, ABC Animation, Kadokawa Media House, Kadokawa, D-techno",SILVER LINK.,1601.0,410,3562,278559.0,498702,77.06748476860193,winter,2020
The 8th son? Are you kidding me?,6.26,"Action, Fantasy",TV,"Satelight, Frontier Works, flying DOG, Kadokawa Media House, Exa International, Kadokawa, GREE, arma bianca","SynergySP, Shin-Ei Animation",7585.0,1017,462,120337.0,221117,67.19298943204087,spring,2020
Shironeko Project ZERO CHRONICLE,5.37,"Action, Adventure, Fantasy",TV,"NBCUniversal Entertainment Japan, COLOPL, Kadokawa, GREE",Project No.9,11171.0,2052,200,39285.0,91331,54.935736147928274,spring,2020
Virtual-san Looking,5.29,Comedy,TV,Dwango,Lide,11374.0,6462,17,2457.0,8478,28.098107949379255,winter,2019
Haikyu!! To the Top,8.36,Sports,TV,"Dentsu, Mainichi Broadcasting System, Movic, Sony Music Entertainment, TOHO animation, Shueisha",Production I.G,201.0,180,5045,538442.0,876743,84.4083983407934,winter,2020
Kono Oto Tomare!: Sounds of Life Season 2,8.42,"Drama, Romance",TV,"WOWOW, Movic, KlockWorx, Memory-Tech, King Records, Shueisha, Pony Canyon Enterprise",Platinum Vision,160.0,1333,1643,86983.0,164001,66.92186499555747,fall,2019
Infinite Dendrogram,6.19,"Action, Fantasy",TV,"AT-X, Nippon Columbia, KlockWorx, Hobby Japan, Studio Mausu, Hakuhodo DY Music & Pictures, BS11, Anima&Co.",NAZ,7958.0,1306,268,76031.0,168325,62.66298228320695,winter,2020
Kochoki,6.52,"Action, Drama",TV,"WOWOW, Genco, MediaNet, AT-X, Tokuma Shoten, flying DOG, BS Fuji, 81 Produce, Tokyo MX, Docomo Anime Store, Happinet",Studio Deen,6226.0,3945,53,8641.0,27734,42.221410463194346,summer,2019
Nekopara,6.73,"Comedy, Slice of Life",TV,"Movic, AT-X, KlockWorx, Good Smile Company, Avex Pictures, Avex Technologies",Felix Film,5161.0,1317,803,62297.0,165945,61.54985880899398,winter,2020
Lord El-Melloi II's Case Files: Rail Zeppelin Grace Note,7.38,"Fantasy, Mystery, Supernatural",TV,"Aniplex, Notes",TROYCA,2152.0,1462,409,60327.0,145466,62.12829123102159,summer,2019
"Science Fell in Love, So I Tried to Prove It",7.36,"Comedy, Romance",TV,"Flex Comix, Hokkaido Cultural Broadcasting, BS11, Yomiuri TV Enterprise, Kanetsu Investment, Toyo Recording, ibis Capital Partners, Y&N Brothers, SUPA LOVE",Zero-G,2227.0,665,1112,138250.0,328635,70.08825873137484,winter,2020
Teasing Master Takagi-san 2,8.06,Comedy,TV,"Dentsu, TMS Entertainment, Asmik Ace, TOHO animation, Shogakukan, Sumitomo",Shin-Ei Animation,515.0,704,2303,172073.0,315942,73.07079266188214,summer,2019
In/Spectre,6.91,"Mystery, Romance, Supernatural",TV,"Nihon Ad Systems, Kodansha, KlockWorx, Docomo Anime Store, King Records, Crunchyroll, GYAO!, BS NTV, Marui Group",Brain's Base,4335.0,468,1279,194991.0,443681,72.79239229960636,winter,2020
How Heavy Are the Dumbbells You Lift?,7.26,"Comedy, Ecchi",TV,"AT-X, Shogakukan, Kadokawa Media House, RAY, NTT Plala, Kadokawa",Doga Kobo,2717.0,574,1268,173675.0,374807,72.15336155089224,summer,2019
Kemono Michi: Rise Up,6.61,"Comedy, Fantasy",TV,"AT-X, Nippon Columbia, Sammy, Kadokawa Media House, Kadokawa, CA-Cygames Anime Fund",ENGI,5803.0,1161,247,92189.0,190603,65.1509051542263,fall,2019
Dropkick on My Devil!! Dash,7.46,"Comedy, Supernatural",TV,"BookLive, ibis Capital Partners, Global Solutions",Nomad,1846.0,3078,107,18377.0,44925,50.785025849940006,spring,2020
Fairy Gone,5.79,"Action, Fantasy",TV,"Mainichi Broadcasting System, Movic, AT-X, TOHO animation, Medicos Entertainment, BS11, Sanyo",P.A. Works,9722.0,1345,207,52290.0,162680,58.4147688605352,spring,2019
The Demon Girl Next Door,7.65,"Comedy, Fantasy",TV,"Pony Canyon, TBS, Houbunsha, Medicos Entertainment, RAY",J.C.Staff,1257.0,1394,1121,59676.0,155627,62.3698353366863,summer,2019
A3! Season Spring & Summer,7.13,Drama,TV,"Pony Canyon, Liber Entertainment","P.A. Works, Studio 3Hz",3382.0,3594,260,10416.0,33392,44.88180508013882,winter,2020
Welcome to Demon School! Iruma-kun,7.75,"Comedy, Fantasy",TV,"NHK, NHK Enterprises",Bandai Namco Pictures,1015.0,457,3952,238819.0,450731,75.84972361674436,fall,2019
Astra Lost in Space,8.08,"Adventure, Award Winning, Mystery, Sci-Fi",TV,"AT-X, Docomo Anime Store, Shueisha, Kadokawa Media House, Kadokawa",Lerche,494.0,774,3049,139273.0,288362,71.05805384335306,summer,2019
To the Abandoned Sacred Beasts,6.4,"Action, Drama, Fantasy",TV,"Kodansha, NBCUniversal Entertainment Japan, Tokyo MX, BS11, JR East Marketing & Communications, Cygames, A-Sketch",MAPPA,6850.0,1616,212,52065.0,128304,59.33784768029291,summer,2019
Miss Kobayashi's Dragon Maid S,8.3,"Fantasy, Slice of Life",TV,"Lantis, ABC Animation, Heart Company",Kyoto Animation,244.0,392,5760,252626.0,520134,77.05124433731721,summer,2021
Beyblade Burst Rise,6.18,"Action, Adventure, Sci-Fi, Sports",TV,"TV Tokyo, d-rights, ADK Emotions",OLM,7967.0,6296,41,4373.0,9072,35.14705886917175,spring,2019
"If It's for My Daughter, I'd Even Defeat a Demon Lord",7.1,"Fantasy, Slice of Life",TV,"Genco, Asmik Ace, Hobby Japan, ZERO-A, BS11, Muse Communication",Maho Film,3515.0,1095,717,99939.0,204520,66.61690089354876,summer,2019
"Hensuki: Are you willing to Fall in Love with a Pervert, as long as she's a Cutie?",6.5,"Comedy, Romance, Ecchi",TV,"AT-X, Bandai Namco Live Creative, GYAO!, Kadokawa, INCS toenter, Bandai Namco Arts",Geek Toys,6398.0,720,894,150487.0,307747,69.70840150562353,summer,2019
RADIANT Season 2,7.58,"Action, Adventure, Fantasy",TV,NHK Enterprises,Lerche,1447.0,1884,242,42177.0,104270,58.93913563793898,fall,2019
Asteroid in Love,6.88,Slice of Life,TV,"AT-X, flying DOG, Houbunsha, Kadokawa Media House, RAY, Kadokawa, GRANTdesign",Doga Kobo,4459.0,2150,301,32097.0,84200,55.37593267701923,winter,2020
Are You Lost?,6.6,"Adventure, Comedy",TV,"Nihon Ad Systems, Kodansha, KlockWorx, flying DOG, Avex Pictures, Docomo Anime Store, GYAO!, BS NTV, Marui Group",Ezόla,5842.0,1412,231,72590.0,152274,62.83459647280989,summer,2019
Gleipnir,6.99,"Action, Mystery, Supernatural, Ecchi",TV,"Kodansha, bilibili, Good Smile Film",PINE JAM,4036.0,446,1874,215467.0,464215,73.86485387291367,spring,2020
Ascendance of a Bookworm,8.0,Fantasy,TV,"WOWOW, Genco, MediaNet, KlockWorx, flying DOG, BS Fuji, Yomiuri TV Enterprise, ABC Animation, Happinet, Tokyo Animator Gakuin, TO Books, JTB Next Creation",Ajia-do,592.0,801,2581,146468.0,281948,71.44730928615121,fall,2019
Psycho-Pass 3,7.45,"Action, Sci-Fi, Suspense",TV,"Dentsu, Fuji TV, Nitroplus, Sony Music Entertainment, TOHO animation, MAGNET",Production I.G,1869.0,870,500,80642.0,257262,65.01424578372816,fall,2019
Phantasy Star Online 2: Episode Oracle,6.52,"Action, Sci-Fi",TV,"Frontier Works, Pony Canyon, Sega, Tokyo MX, Sammy, Studio Kai, ADK Emotions, Sega Games",Gonzo,6242.0,4177,38,6306.0,24547,39.18782088175915,fall,2019
CHOYOYU!: High School Prodigies Have It Easy Even in Another World!,6.36,Fantasy,TV,"Sotsu, MediaNet, Pony Canyon, AT-X, KlockWorx, BS Fuji, Tokyo MX, Bit Promotion, Happinet, Dream Shift, SB Creative",Project No.9,7063.0,882,511,131060.0,253427,68.16762770097921,fall,2019
Drifting Dragons,6.96,"Adventure, Fantasy",TV,"Kodansha, Fuji TV, Bandai, Nexon, BS Fuji, TOHO animation, Hakuhodo DY Media Partners, Fuji Creative, Bandai Spirits",Polygon Pictures,4139.0,3128,103,14849.0,43741,48.064119573572356,winter,2020
Toilet-Bound Hanako-kun,7.84,Supernatural,TV,"Square Enix, Studio Hibari, Pony Canyon, TBS, Half H.P Studio, Contents Seed",Lerche,848.0,361,11418,271507.0,555251,77.19628471525517,winter,2020
Mushoku Tensei: Jobless Reincarnation,8.37,"Drama, Fantasy, Ecchi",TV,"Frontier Works, TOHO animation, Hakuhodo DY Music & Pictures, BS11, Egg Firm, Kadokawa, GREE, Toho Music",Studio Bind,196.0,110,28815,706690.0,1158166,87.03846165163532,winter,2021
